,comment,Gioco,URL,Video
1207,Using Apocalyptica made me enjoy this trailer oh so much more.,Death Stranding,https://www.youtube.com/watch?v=Gu8X7vM3Avw,Trailer
1208,"Climbs ladder 
Epic Music Intensifies",Death Stranding,https://www.youtube.com/watch?v=Gu8X7vM3Avw,Trailer
1209,the legend goes that the time fall is actually konami's tears.,Death Stranding,https://www.youtube.com/watch?v=Gu8X7vM3Avw,Trailer
1210,4:05 reminded me a lot of Horizon Zero Dawn. When you could use your sonar ability for sneaking past enemies. I like how Kojima is really embracing and utilizing the tech and talent at PlayStation.,Death Stranding,https://www.youtube.com/watch?v=Gu8X7vM3Avw,Trailer
1211,"""I don't know BRIDGEtte, do you think BRIDGEs will be a recurring theme in this game about a guy who's literal last name is BRIDGEs?""",Death Stranding,https://www.youtube.com/watch?v=Gu8X7vM3Avw,Trailer
1212,So... the baby is the rope and the articulated spinning-finger-blade device is the stick?,Death Stranding,https://www.youtube.com/watch?v=Gu8X7vM3Avw,Trailer
1213,"Build time travel machine to meet my future self to understand this game 
Me : What
Future Me : what?",Death Stranding,https://www.youtube.com/watch?v=Gu8X7vM3Avw,Trailer
1214,WHAAAAT! Well...there goes my social life again. Tell my family I love them. 😢😢😢,Death Stranding,https://www.youtube.com/watch?v=Gu8X7vM3Avw,Trailer
1215,"Nobody:


Kojima : hold my bridge baby",Death Stranding,https://www.youtube.com/watch?v=Gu8X7vM3Avw,Trailer
1216,"Oxygen: hold your breath.
Kojima: I don't need you, I have my umbilical cord.",Death Stranding,https://www.youtube.com/watch?v=Gu8X7vM3Avw,Trailer
1217,"When you finish this one, you'll feel just empty inside",Death Stranding,https://www.youtube.com/watch?v=Gu8X7vM3Avw,Trailer
1218,"We have been waiting al long time in excitement,so it has to be a great out of expansion game or Kojema will lose his good reputation.",Death Stranding,https://www.youtube.com/watch?v=Gu8X7vM3Avw,Trailer
1219,A one of a kind game! I look forward to playing it and discovering what it's all about! Anyone else excited ?,Death Stranding,https://www.youtube.com/watch?v=Gu8X7vM3Avw,Trailer
1220,"Nice, I thought I was hearing things when I recognized the first few seconds of Path",Death Stranding,https://www.youtube.com/watch?v=Gu8X7vM3Avw,Trailer
1221,How do you know its a kojima game ? The fire 7:07 ... Kojima dont know how fire work,Death Stranding,https://www.youtube.com/watch?v=Gu8X7vM3Avw,Trailer
1222,"This is very interesting project and everything... but I`ll keep my Keanu, thanks ;)",Death Stranding,https://www.youtube.com/watch?v=Gu8X7vM3Avw,Trailer
1223,"I really think that the way they edited this (and other trailers) make it more confusing than what the game will really be. But still, were they in WW1? Wtf?",Death Stranding,https://www.youtube.com/watch?v=Gu8X7vM3Avw,Trailer
1224,"I don't understand the storyline, but thats what makes it so good, i'm very curious. Can't wait to see more",Death Stranding,https://www.youtube.com/watch?v=Gu8X7vM3Avw,Trailer
1225,Jesus! This is the most we've ever gotten from this damn game!.... And I still don't know wtf it's about.,Death Stranding,https://www.youtube.com/watch?v=Gu8X7vM3Avw,Trailer
1226,This take part of the walking dead?!?!? I know one character looks finials in the trailer,Death Stranding,https://www.youtube.com/watch?v=Gu8X7vM3Avw,Trailer
1227,That part where masked man ocelot licked the girl reminded me of the 1/2nd episode of Jojo part 5,Death Stranding,https://www.youtube.com/watch?v=Gu8X7vM3Avw,Trailer
1228,5:02 I felt a bit of Metal gear in this part ;-;,Death Stranding,https://www.youtube.com/watch?v=Gu8X7vM3Avw,Trailer
1229,"this exists because of the result of only one thing, using drugs",Death Stranding,https://www.youtube.com/watch?v=Gu8X7vM3Avw,Trailer
1230,Kojima is coming after Konami with a vengance 🔥🔥🔥🔥🔥,Death Stranding,https://www.youtube.com/watch?v=Gu8X7vM3Avw,Trailer
1231,"first time ive watched an almost 9 minute vid, and have less of an idea of what something was about then when i started.",Death Stranding,https://www.youtube.com/watch?v=Gu8X7vM3Avw,Trailer
1232,Kojima has taught me to wait at least a week after the game releases to see if it's actually worth buying or just hype from fanboys.,Death Stranding,https://www.youtube.com/watch?v=Gu8X7vM3Avw,Trailer
1233,"Person: I once killed 2 men with a suit case
Other Person: I once killed 3 men with a pencil",Death Stranding,https://www.youtube.com/watch?v=Gu8X7vM3Avw,Trailer
1234,So I noticed in some games like Darkness Hell is shown as a never ending battle in a WW1 setting. Why is that?,Death Stranding,https://www.youtube.com/watch?v=Gu8X7vM3Avw,Trailer
1235,"waited long enough and could still do tho. 
we're all a hoard of masochists.",Death Stranding,https://www.youtube.com/watch?v=Gu8X7vM3Avw,Trailer
1236,You know the trailer good when you start off in the womb,Death Stranding,https://www.youtube.com/watch?v=Gu8X7vM3Avw,Trailer
1237,"What's this game about? It seems to be a horror but action but mixed with alot of genres. Care to explain what its about?
Kojami:Yes.",Death Stranding,https://www.youtube.com/watch?v=Gu8X7vM3Avw,Trailer
1238,7:04 thats the most gangster way to lit a cig if i've ever...salute,Death Stranding,https://www.youtube.com/watch?v=Gu8X7vM3Avw,Trailer
1239,The simple is idea of hiding from those things and travelling I saw before seemed cool but maybe a little boring but now this feels like there's too much,Death Stranding,https://www.youtube.com/watch?v=Gu8X7vM3Avw,Trailer
1240,How come this reminded me of PT if anyone remembers that,Death Stranding,https://www.youtube.com/watch?v=Gu8X7vM3Avw,Trailer
1241,Hey it’s that one guy with the crossbow,Death Stranding,https://www.youtube.com/watch?v=Gu8X7vM3Avw,Trailer
1242,Omg this is totally Daryl,Death Stranding,https://www.youtube.com/watch?v=Gu8X7vM3Avw,Trailer
1243,Never would I have expected to hear Apocolyptica,Death Stranding,https://www.youtube.com/watch?v=Gu8X7vM3Avw,Trailer
1244,What is Daryl from TWD doing here?!,Death Stranding,https://www.youtube.com/watch?v=Gu8X7vM3Avw,Trailer
1245,4:49 well....battlefield 1,Death Stranding,https://www.youtube.com/watch?v=Gu8X7vM3Avw,Trailer
1246,"Developers: What is the genre of the game?

Kojima: yes",Death Stranding,https://www.youtube.com/watch?v=Gu8X7vM3Avw,Trailer
1247,"Best walking game of all time (30 FPS), starring ... walkers - you just walk... Also the graphics looks cool... OK! Back to Cyberpunk!",Death Stranding,https://www.youtube.com/watch?v=Gu8X7vM3Avw,Trailer
1248,There's stealth sign me up,Death Stranding,https://www.youtube.com/watch?v=Gu8X7vM3Avw,Trailer
1249,It's about damn time!,Death Stranding,https://www.youtube.com/watch?v=Gu8X7vM3Avw,Trailer
1250,Good to see the skull squadron is still around,Death Stranding,https://www.youtube.com/watch?v=Gu8X7vM3Avw,Trailer
1251,"There is something being said by the Actor-reveal starting at 5:45. Most of the people are crying - but Diehardman and Cliff aren't, though Cliff seems distraught. Deadman isn't crying either, but has a look of concern on his face. Then Higgs is crying black sludge and Amelie is crying blood. 
Knowing Kojima, there is a message there.",Death Stranding,https://www.youtube.com/watch?v=Gu8X7vM3Avw,Trailer
1252,"Developers: Are you sure that this game should have 20 genres?

Kojima: Or course not. Release it anyway.",Death Stranding,https://www.youtube.com/watch?v=Gu8X7vM3Avw,Trailer
1253,"kojima : check out my game of the year.
a week later
cd projekt red: release cyberpunk 2077 trailer with keanu reeves.
kojima: mr stark i dont feel so good.",Death Stranding,https://www.youtube.com/watch?v=Gu8X7vM3Avw,Trailer
1254,Isnt the guy from thumbnail from walking dead,Death Stranding,https://www.youtube.com/watch?v=Gu8X7vM3Avw,Trailer
1255,"Why the hell is Darrell in this game? Is this a ""The Walking Dead"" game",Death Stranding,https://www.youtube.com/watch?v=Gu8X7vM3Avw,Trailer
1256,This is bubsy 4: bubsy strikes back masquerading as something else.,Death Stranding,https://www.youtube.com/watch?v=Gu8X7vM3Avw,Trailer
1257,"Oh a trailer

Sees its 8 minutes long",Death Stranding,https://www.youtube.com/watch?v=Gu8X7vM3Avw,Trailer
1258,So hype about this game!!!!,Death Stranding,https://www.youtube.com/watch?v=Gu8X7vM3Avw,Trailer
1259,"Can anyone tell me the music that plays, I recognize it but can't recall the name",Death Stranding,https://www.youtube.com/watch?v=Gu8X7vM3Avw,Trailer
1260,Looks like an open world game to me and I’m 1000x more keen. Horizon vibes!,Death Stranding,https://www.youtube.com/watch?v=Gu8X7vM3Avw,Trailer
1261,Man that throwback Apocalyptica!,Death Stranding,https://www.youtube.com/watch?v=Gu8X7vM3Avw,Trailer
1262,This is the most Kojima thing I’ve ever seen. It’s all over the place. It’s batshit. And I love it,Death Stranding,https://www.youtube.com/watch?v=Gu8X7vM3Avw,Trailer
1263,This looks mental!,Death Stranding,https://www.youtube.com/watch?v=Gu8X7vM3Avw,Trailer
1264,I think that was darly from walking dead,Death Stranding,https://www.youtube.com/watch?v=Gu8X7vM3Avw,Trailer
1265,Does anyone know what to eat when you've got the flu?,Death Stranding,https://www.youtube.com/watch?v=Gu8X7vM3Avw,Trailer
1266,So there's going to be pseudo time travel when you get got by goo. The babies are somewhat responsive to humans. There are terrorists attacking America. And lastly rain kills.,Death Stranding,https://www.youtube.com/watch?v=Gu8X7vM3Avw,Trailer
1267,Can’t wait to play Norman Reedus 🙏🏻😍,Death Stranding,https://www.youtube.com/watch?v=Gu8X7vM3Avw,Trailer
1268,Awesome Trailer with sexy Music ! Kojima its you !,Death Stranding,https://www.youtube.com/watch?v=Gu8X7vM3Avw,Trailer
1269,I miss Metal Gear!,Death Stranding,https://www.youtube.com/watch?v=Gu8X7vM3Avw,Trailer
1270,Don't you love when people focus on the graphics and content instead of the message that the trailer is trying to tell. The game is about a broken world. Where as a society were not connected were broken. We're too connected to our past which is making the future harder to reach.,Death Stranding,https://www.youtube.com/watch?v=Gu8X7vM3Avw,Trailer
1271,"One Word is Enough to Get this.. "" KOJIMA """,Death Stranding,https://www.youtube.com/watch?v=Gu8X7vM3Avw,Trailer
1272,That guy looks like from the walking dead,Death Stranding,https://www.youtube.com/watch?v=Gu8X7vM3Avw,Trailer
1273,"So, is this like a better version of that Darkest of Days game? Where you have to like fix time and shit and go to like special events in history and save them?",Death Stranding,https://www.youtube.com/watch?v=Gu8X7vM3Avw,Trailer
1274,...here’s my credit card?,Death Stranding,https://www.youtube.com/watch?v=Gu8X7vM3Avw,Trailer
1275,So many genres of game here. Can't wait!!!,Death Stranding,https://www.youtube.com/watch?v=Gu8X7vM3Avw,Trailer
1276,"I don't know what I just watched, but I liked it quite a lot.",Death Stranding,https://www.youtube.com/watch?v=Gu8X7vM3Avw,Trailer
1277,He had a magical ladder.,Death Stranding,https://www.youtube.com/watch?v=Gu8X7vM3Avw,Trailer
1278,Dude is it just me or the weed l just smoked is good af?,Death Stranding,https://www.youtube.com/watch?v=Gu8X7vM3Avw,Trailer
1279,That’s the walking dead bow guy right,Death Stranding,https://www.youtube.com/watch?v=Gu8X7vM3Avw,Trailer
1280,"wait.. i know.. this game is a story of humankind fighting those creatures who represent ""death"".. and the way they're fighting them is by using the power of ""life"" which is sourced from babies 😱 idk I'm just pulling shit outta my ass",Death Stranding,https://www.youtube.com/watch?v=Gu8X7vM3Avw,Trailer
1281,the music go hard,Death Stranding,https://www.youtube.com/watch?v=Gu8X7vM3Avw,Trailer
1282,I have this feeling that Sam is Kojima's Solid Snake replacement.,Death Stranding,https://www.youtube.com/watch?v=Gu8X7vM3Avw,Trailer
1283,What's that hell !? Look a good and long game,Death Stranding,https://www.youtube.com/watch?v=Gu8X7vM3Avw,Trailer
1284,"It feels like a movie with all those faces and Titles and credits...
Also wtf is going on with those babies...
Jeez someone needs a therapy session",Death Stranding,https://www.youtube.com/watch?v=Gu8X7vM3Avw,Trailer
1285,"2319, we got a 2319",Death Stranding,https://www.youtube.com/watch?v=Gu8X7vM3Avw,Trailer
1286,quand j'suis tombée sur la video: han ! c'est mon hlel darryl,Death Stranding,https://www.youtube.com/watch?v=Gu8X7vM3Avw,Trailer
1287,"Wow I have no idea what this game is about, even after 8+ mins! And what is up with that baby.",Death Stranding,https://www.youtube.com/watch?v=Gu8X7vM3Avw,Trailer
1288,I would’ve rather had the last of us part 2 but okay,Death Stranding,https://www.youtube.com/watch?v=Gu8X7vM3Avw,Trailer
1289,Most likely Game of the Year 2019,Death Stranding,https://www.youtube.com/watch?v=Gu8X7vM3Avw,Trailer
1290,I just want to see Mads smoking cigarettes no lie,Death Stranding,https://www.youtube.com/watch?v=Gu8X7vM3Avw,Trailer
1291,"Does anyone know the song playing in the background?
Edit: The song is Path by Apocalyptica",Death Stranding,https://www.youtube.com/watch?v=Gu8X7vM3Avw,Trailer
1292,"If i wanted to play mgs i would play mgs 
Hard pass",Death Stranding,https://www.youtube.com/watch?v=Gu8X7vM3Avw,Trailer
1293,Wait..wtf did I just watch?!,Death Stranding,https://www.youtube.com/watch?v=Gu8X7vM3Avw,Trailer
1294,acid trip here we come,Death Stranding,https://www.youtube.com/watch?v=Gu8X7vM3Avw,Trailer
1295,"Reportero:
-Kojima creo que a enloquecido de poder!!!
Kojima:
-Claro a intentado enloquecer sin poder, no es divertido nadie le hace caso!",Death Stranding,https://www.youtube.com/watch?v=Gu8X7vM3Avw,Trailer
1296,Norman Reedus grunting intensifies,Death Stranding,https://www.youtube.com/watch?v=Gu8X7vM3Avw,Trailer
1297,Is this Daryl...?,Death Stranding,https://www.youtube.com/watch?v=Gu8X7vM3Avw,Trailer
1298,Is this wii sports 2?,Death Stranding,https://www.youtube.com/watch?v=Gu8X7vM3Avw,Trailer
1299,OMG ! They Asian Thanos !,Death Stranding,https://www.youtube.com/watch?v=Gu8X7vM3Avw,Trailer
1300,"Guys, this is totally Metal Gear Solid 6",Death Stranding,https://www.youtube.com/watch?v=Gu8X7vM3Avw,Trailer
1301,I saw so much and yet...I know nothing about it...how the hell is even possible?,Death Stranding,https://www.youtube.com/watch?v=Gu8X7vM3Avw,Trailer
1302,Whats the name of the music being used,Death Stranding,https://www.youtube.com/watch?v=Gu8X7vM3Avw,Trailer
1303,6:40 to 7:20 who's that voice?,Death Stranding,https://www.youtube.com/watch?v=Gu8X7vM3Avw,Trailer
1304,What kind of evangelion is this?,Death Stranding,https://www.youtube.com/watch?v=Gu8X7vM3Avw,Trailer
1305,Daryl? Is it you?,Death Stranding,https://www.youtube.com/watch?v=Gu8X7vM3Avw,Trailer
1306,Confusion... lots of confusion...,Death Stranding,https://www.youtube.com/watch?v=Gu8X7vM3Avw,Trailer
1307,I still don't know what the game is about but just take my money anyway,Death Stranding,https://www.youtube.com/watch?v=Gu8X7vM3Avw,Trailer
1308,idk what's going on but i think i feel like crying,Death Stranding,https://www.youtube.com/watch?v=Gu8X7vM3Avw,Trailer
1309,OMG metal gear survive made by kojima,Death Stranding,https://www.youtube.com/watch?v=Gu8X7vM3Avw,Trailer
1310,Daryl Dixon!?,Death Stranding,https://www.youtube.com/watch?v=Gu8X7vM3Avw,Trailer
1311,Who else has watched it 10 times?,Death Stranding,https://www.youtube.com/watch?v=Gu8X7vM3Avw,Trailer
1312,exclusively on PS4 booo,Death Stranding,https://www.youtube.com/watch?v=Gu8X7vM3Avw,Trailer
1313,I have no idea what's going on,Death Stranding,https://www.youtube.com/watch?v=Gu8X7vM3Avw,Trailer
1314,Lol i that is was a walking dead game ahahah,Death Stranding,https://www.youtube.com/watch?v=Gu8X7vM3Avw,Trailer
1315,"Konami fires Kojima
I guess you could say they're regretting their words and deeds now!",Death Stranding,https://www.youtube.com/watch?v=Gu8X7vM3Avw,Trailer
1316,Why were Hannibal Lecter and Daryl in the same trailer?,Death Stranding,https://www.youtube.com/watch?v=Gu8X7vM3Avw,Trailer
1317,Isn't this skull face?,Death Stranding,https://www.youtube.com/watch?v=Gu8X7vM3Avw,Trailer
1318,Wish P.T was launched..,Death Stranding,https://www.youtube.com/watch?v=Gu8X7vM3Avw,Trailer
1319,Is this Astrandia: An Elex Tale?,Death Stranding,https://www.youtube.com/watch?v=Gu8X7vM3Avw,Trailer
1320,I thought this was a movie,Death Stranding,https://www.youtube.com/watch?v=Gu8X7vM3Avw,Trailer
1321,Really Kojima? PS4 Exclusive?,Death Stranding,https://www.youtube.com/watch?v=Gu8X7vM3Avw,Trailer
1322,hardcore stork,Death Stranding,https://www.youtube.com/watch?v=Gu8X7vM3Avw,Trailer
1323,Um. What?,Death Stranding,https://www.youtube.com/watch?v=Gu8X7vM3Avw,Trailer
1324,wow. released on my birthday. but who cares,Death Stranding,https://www.youtube.com/watch?v=Gu8X7vM3Avw,Trailer
1325,"Me: so whats this game about 
Kojima: yes",Death Stranding,https://www.youtube.com/watch?v=Gu8X7vM3Avw,Trailer
1326,I'd rather have Silent Hills...,Death Stranding,https://www.youtube.com/watch?v=Gu8X7vM3Avw,Trailer
1327,Looks like a complex anime,Death Stranding,https://www.youtube.com/watch?v=Gu8X7vM3Avw,Trailer
1328,if kojima ever retires he should make an advertising company !,Death Stranding,https://www.youtube.com/watch?v=Gu8X7vM3Avw,Trailer
1329,"Could this game be talking about inter dimensional rifts and shit, like the upside down in stranger things, and the babies with their umbilical cord helps them to stay connected to the original world that’s why they need to equip them whenever they are outside",Death Stranding,https://www.youtube.com/watch?v=Gu8X7vM3Avw,Trailer
1330,some nice ladder gameplay👌,Death Stranding,https://www.youtube.com/watch?v=Gu8X7vM3Avw,Trailer
1331,Did he say UAC?,Death Stranding,https://www.youtube.com/watch?v=Gu8X7vM3Avw,Trailer
1332,Matpat is sure gonna have fun with this one.,Death Stranding,https://www.youtube.com/watch?v=Gu8X7vM3Avw,Trailer
1333,KP KP.,Death Stranding,https://www.youtube.com/watch?v=Gu8X7vM3Avw,Trailer
1334,Guillermo del toro?!! :0,Death Stranding,https://www.youtube.com/watch?v=Gu8X7vM3Avw,Trailer
1335,"Still don't know wath the game is about. Not buying until I know wath I'm buying, not even if Kojima name is in it.",Death Stranding,https://www.youtube.com/watch?v=Gu8X7vM3Avw,Trailer
1336,Why is darrel in this,Death Stranding,https://www.youtube.com/watch?v=Gu8X7vM3Avw,Trailer
1337,I have no idea wtf is goin on but this got so excited it's crazy.,Death Stranding,https://www.youtube.com/watch?v=Gu8X7vM3Avw,Trailer
1338,Norman Reedus!,Death Stranding,https://www.youtube.com/watch?v=Gu8X7vM3Avw,Trailer
1339,He was is Silent Hill,Death Stranding,https://www.youtube.com/watch?v=Gu8X7vM3Avw,Trailer
1340,"Please, please have any character in this game say ""Kept you waiting, huh?""",Death Stranding,https://www.youtube.com/watch?v=Gu8X7vM3Avw,Trailer
1341,great character,Death Stranding,https://www.youtube.com/watch?v=Gu8X7vM3Avw,Trailer
1342,We're going to the MOON! Mads Mikkelsen confirmed it!,Death Stranding,https://www.youtube.com/watch?v=Gu8X7vM3Avw,Trailer
1343,This game basically Kojima's new generation Metal Gear Solid. Metal Gear Solid has one hell of a complicated story. Just think about it,Death Stranding,https://www.youtube.com/watch?v=Gu8X7vM3Avw,Trailer
1344,"Okay...This game wasn't made for regular People. I'm confused with just the trailer, guess how the game will be like",Death Stranding,https://www.youtube.com/watch?v=Gu8X7vM3Avw,Trailer
1345,"Konami: How many Confucius does it take?


Gamers: What?",Death Stranding,https://www.youtube.com/watch?v=Gu8X7vM3Avw,Trailer
1346,I'm gonna buy ps5 for this. Kojima is GOD,Death Stranding,https://www.youtube.com/watch?v=Gu8X7vM3Avw,Trailer
1347,"even the moon 

Alright then.",Death Stranding,https://www.youtube.com/watch?v=Gu8X7vM3Avw,Trailer
1348,ahhh!!!...so he will be shifting back and forth between our world and the spirit world...Soul Reaver style!,Death Stranding,https://www.youtube.com/watch?v=Gu8X7vM3Avw,Trailer
1349,"Us consumers-Mr kojima what the hell is going on?!!
Kojima.*yes*",Death Stranding,https://www.youtube.com/watch?v=Gu8X7vM3Avw,Trailer
1350,Everyone is talking about Kojima. Are we not even thinking about the main character is one of the characters from the walking dead lol,Death Stranding,https://www.youtube.com/watch?v=Gu8X7vM3Avw,Trailer
1351,"YOU KNOW DAMN WELL IM BUYING IT, EVEN THO I AM COMPLETELY LOST ABOUT THE STORY LINE😂😂😂",Death Stranding,https://www.youtube.com/watch?v=Gu8X7vM3Avw,Trailer
1352,the uncanny valley strikes again,Death Stranding,https://www.youtube.com/watch?v=Gu8X7vM3Avw,Trailer
1353,i think i'm even more confused now than I was years ago when i heard of this game..Thanks Kojima,Death Stranding,https://www.youtube.com/watch?v=Gu8X7vM3Avw,Trailer
1354,"5:00
Oh, i didn't know that Kojima put Battlefield 1 in DS.",Death Stranding,https://www.youtube.com/watch?v=Gu8X7vM3Avw,Trailer
1355,mardicion esto es mi puto papá xD,Death Stranding,https://www.youtube.com/watch?v=Gu8X7vM3Avw,Trailer
1356,3:00 This is actually the future Amazon crew simulator,Death Stranding,https://www.youtube.com/watch?v=Gu8X7vM3Avw,Trailer
1357,Am I the only one who just got hyped by the apocalitica's-path soundtrack?,Death Stranding,https://www.youtube.com/watch?v=Gu8X7vM3Avw,Trailer
1358,This man was suppose to be in P.T DAMN IT 😭😭,Death Stranding,https://www.youtube.com/watch?v=Gu8X7vM3Avw,Trailer
1359,"My mind just experienced a blue screen. That was way too much information at one time I'm, I'm shook hahaha",Death Stranding,https://www.youtube.com/watch?v=Gu8X7vM3Avw,Trailer
1360,Huh so that's how Carol dies....,Death Stranding,https://www.youtube.com/watch?v=Gu8X7vM3Avw,Trailer
1361,"""I'll show you the real thing soon.""
Well, thanks?",Death Stranding,https://www.youtube.com/watch?v=Gu8X7vM3Avw,Trailer
1362,"""You can make America whole... Sam, if we don't all come together again, humanity will not survive.""

Ahh, classic.",Death Stranding,https://www.youtube.com/watch?v=Gu8X7vM3Avw,Trailer
1363,YOU DIED 0:09,Death Stranding,https://www.youtube.com/watch?v=Gu8X7vM3Avw,Trailer
1364,What’s the games plot? Yes or no?,Death Stranding,https://www.youtube.com/watch?v=Gu8X7vM3Avw,Trailer
1365,"damn, bringing in apocalyptica was an awesome choice. underrated band",Death Stranding,https://www.youtube.com/watch?v=Gu8X7vM3Avw,Trailer
1366,this game is written like a japanese anime,Death Stranding,https://www.youtube.com/watch?v=Gu8X7vM3Avw,Trailer
1367,So... what IS it,Death Stranding,https://www.youtube.com/watch?v=Gu8X7vM3Avw,Trailer
1368,Why is the Walking Dead Guy here ?,Death Stranding,https://www.youtube.com/watch?v=Gu8X7vM3Avw,Trailer
1369,So its a walking simulator where you can die?,Death Stranding,https://www.youtube.com/watch?v=Gu8X7vM3Avw,Trailer
1370,Game mechanics don't seem very good. I don't know. This looks like a game that you get and still have no idea what you're playing.,Death Stranding,https://www.youtube.com/watch?v=Gu8X7vM3Avw,Trailer
1371,Что ещё сказать? Кодзима гений!,Death Stranding,https://www.youtube.com/watch?v=Gu8X7vM3Avw,Trailer
1372,"Me: Is this garry's mod remastered?
Kojima: No
Me: But it looks like there is everything...
Kojima: Yes",Death Stranding,https://www.youtube.com/watch?v=Gu8X7vM3Avw,Trailer
1373,Like what even is this,Death Stranding,https://www.youtube.com/watch?v=Gu8X7vM3Avw,Trailer
1374,"20 years from now.... 

They will make a biopic about hideo kojima...",Death Stranding,https://www.youtube.com/watch?v=Gu8X7vM3Avw,Trailer
1375,ГЕНИАЛЬНО!!!!,Death Stranding,https://www.youtube.com/watch?v=Gu8X7vM3Avw,Trailer
1376,So does Sony have the exclusive rights or no?,Death Stranding,https://www.youtube.com/watch?v=Gu8X7vM3Avw,Trailer
1377,Damn! Daryl is the only character that survived the Walking Dead? Now he's fighting homodemons?,Death Stranding,https://www.youtube.com/watch?v=Gu8X7vM3Avw,Trailer
1378,The story in this game is that you are supposed to figure out the story while playing the story.,Death Stranding,https://www.youtube.com/watch?v=Gu8X7vM3Avw,Trailer
1379,this game screams FLOP,Death Stranding,https://www.youtube.com/watch?v=Gu8X7vM3Avw,Trailer
1380,it's a Lovcraftian Sci-fi. HYPEEEE!!,Death Stranding,https://www.youtube.com/watch?v=Gu8X7vM3Avw,Trailer
1381,When we get the game norman will take off the mask and reveal he was jack from metal gear 2 all along~,Death Stranding,https://www.youtube.com/watch?v=Gu8X7vM3Avw,Trailer
1382,"I'm feeling this will be a masterpiece of the modern day, we just don't understand it yet",Death Stranding,https://www.youtube.com/watch?v=Gu8X7vM3Avw,Trailer
1383,"I have never been so thoroughly impressed and excited about something that I cannot understand. 
10/10 Kojima isn't even a real person at this point.",Death Stranding,https://www.youtube.com/watch?v=Gu8X7vM3Avw,Trailer
1384,This game looks lame.,Death Stranding,https://www.youtube.com/watch?v=Gu8X7vM3Avw,Trailer
1385,"Voice in the game: you see, I’ve come to understand the true about death stranding 

Me: SHIIIIT..... tell me, cause, ma ass is lost",Death Stranding,https://www.youtube.com/watch?v=Gu8X7vM3Avw,Trailer
1386,"Thank you Mr. Kojima,

Now can you tell us what your game is about?",Death Stranding,https://www.youtube.com/watch?v=Gu8X7vM3Avw,Trailer
1387,"8:07 ""I'll show you the real thing soon, I promise.""

8:24 ""The whole wide world will be yours to explore, where you will be able to go wherever you want. Even the moon.""",Death Stranding,https://www.youtube.com/watch?v=Gu8X7vM3Avw,Trailer
