,comment,Gioco,URL,Video
672,3:00 I think Norman  has boos socks,Death Stranding,https://www.youtube.com/watch?v=Gu8X7vM3Avw,Trailer
673,Only Kojima can make a ladder look badass.,Death Stranding,https://www.youtube.com/watch?v=Gu8X7vM3Avw,Trailer
674,A game with Mads Mikkelsen? Noice,Death Stranding,https://www.youtube.com/watch?v=Gu8X7vM3Avw,Trailer
675,This is just not that good. Mediocre at best. I find many parts of this game to be lacking. Just not that good.,Death Stranding,https://www.youtube.com/watch?v=Gu8X7vM3Avw,Trailer
676,"They done messed up 10 ,with assassin Creed fight night",Death Stranding,https://www.youtube.com/watch?v=Gu8X7vM3Avw,Trailer
677,"I like and played metal gear solid 5 but some parts of the game were too complex to understand and use (like building extra bases), just not enough explanation, how is it possible to create a complicated game and not have any of the 50+? staff tell you it's too complicated?",Death Stranding,https://www.youtube.com/watch?v=Gu8X7vM3Avw,Trailer
678,I watched this 8 minute trailer and I’m still confused.,Death Stranding,https://www.youtube.com/watch?v=Gu8X7vM3Avw,Trailer
679,"This trailer is
Like a maze
Inside a maze inside another maze on another universe",Death Stranding,https://www.youtube.com/watch?v=Gu8X7vM3Avw,Trailer
680,This is def Japanese,Death Stranding,https://www.youtube.com/watch?v=Gu8X7vM3Avw,Trailer
681,Is it a MGSV DLC?,Death Stranding,https://www.youtube.com/watch?v=Gu8X7vM3Avw,Trailer
682,This game deserves a full length movie adaptation,Death Stranding,https://www.youtube.com/watch?v=Gu8X7vM3Avw,Trailer
683,"God: I know how and when you Will die Kojima...
Hideo Kojima: I know how Death Stranding will end.
God: Damn it.",Death Stranding,https://www.youtube.com/watch?v=Gu8X7vM3Avw,Trailer
684,Official Trailer... im Officially confused,Death Stranding,https://www.youtube.com/watch?v=Gu8X7vM3Avw,Trailer
685,"Now is this PS4 pro graphics or more like ps5 graphics? If this truly is PS4 pro, how great would this game have looked like at a ps5?",Death Stranding,https://www.youtube.com/watch?v=Gu8X7vM3Avw,Trailer
686,iOS or XBOX - when ?,Death Stranding,https://www.youtube.com/watch?v=Gu8X7vM3Avw,Trailer
687,Wait... I thought this was a Chvrches song...,Death Stranding,https://www.youtube.com/watch?v=Gu8X7vM3Avw,Trailer
688,"Kojima LSD simulator, coming on November.
I'm in.",Death Stranding,https://www.youtube.com/watch?v=Gu8X7vM3Avw,Trailer
689,ITS MY BIRTH DAY ON NOVEMBER 8,Death Stranding,https://www.youtube.com/watch?v=Gu8X7vM3Avw,Trailer
690,Apocalyptica brought me here,Death Stranding,https://www.youtube.com/watch?v=Gu8X7vM3Avw,Trailer
691,I think this walking sim is overhyped af.,Death Stranding,https://www.youtube.com/watch?v=Gu8X7vM3Avw,Trailer
692,The NeXT hideo flop ...,Death Stranding,https://www.youtube.com/watch?v=Gu8X7vM3Avw,Trailer
693,"Kojima: I want Die Hard man
Sony: So... Bruce Willis?
Kojima: Not quite",Death Stranding,https://www.youtube.com/watch?v=Gu8X7vM3Avw,Trailer
694,this is confusing... but im so intrigued,Death Stranding,https://www.youtube.com/watch?v=Gu8X7vM3Avw,Trailer
695,crispy balls at the end,Death Stranding,https://www.youtube.com/watch?v=Gu8X7vM3Avw,Trailer
696,What song is playing at the 6:20 part of the trailer?,Death Stranding,https://www.youtube.com/watch?v=Gu8X7vM3Avw,Trailer
697,I don't get why Mikkelsen has his own voice at the beginning and the end but is dubbed as the soldier,Death Stranding,https://www.youtube.com/watch?v=Gu8X7vM3Avw,Trailer
698,Bridges... Bridges...  Jeff Bridges?  The Dude?,Death Stranding,https://www.youtube.com/watch?v=Gu8X7vM3Avw,Trailer
699,"Now I get why Sony wasn't at E3, they would have no way to present this.",Death Stranding,https://www.youtube.com/watch?v=Gu8X7vM3Avw,Trailer
700,Woow!!!,Death Stranding,https://www.youtube.com/watch?v=Gu8X7vM3Avw,Trailer
701,"Guys it's not a game, but an emotion",Death Stranding,https://www.youtube.com/watch?v=Gu8X7vM3Avw,Trailer
702,"Me: what kind of game do you make exactly?
Kojima: yes",Death Stranding,https://www.youtube.com/watch?v=Gu8X7vM3Avw,Trailer
703,70 percent of hideo kojimas games are videos. so I change the name of hideo kojimas to 'VIDEO KOJIMA'.,Death Stranding,https://www.youtube.com/watch?v=Gu8X7vM3Avw,Trailer
704,What was the song?,Death Stranding,https://www.youtube.com/watch?v=Gu8X7vM3Avw,Trailer
705,I don't know man.  Tommy Sotomayor also warned us about the BTs.,Death Stranding,https://www.youtube.com/watch?v=Gu8X7vM3Avw,Trailer
706,What's that cool music!!???,Death Stranding,https://www.youtube.com/watch?v=Gu8X7vM3Avw,Trailer
707,This will be a straight slap to everyone at konami,Death Stranding,https://www.youtube.com/watch?v=Gu8X7vM3Avw,Trailer
708,What’s up Daryl,Death Stranding,https://www.youtube.com/watch?v=Gu8X7vM3Avw,Trailer
709,It's good to see Norman again,Death Stranding,https://www.youtube.com/watch?v=Gu8X7vM3Avw,Trailer
710,Ok the commentarys are funny but most of them end with kojima saiyng yes. Stooop. Btw game looks gooooooooood,Death Stranding,https://www.youtube.com/watch?v=Gu8X7vM3Avw,Trailer
711,it is just me or the titles can be also read 'eat standing' ? xD,Death Stranding,https://www.youtube.com/watch?v=Gu8X7vM3Avw,Trailer
712,"""I'll show you the real thing soon. The whole wide world will be yours 
to explore. You'll be able to go wherever you want. Even the moon.""",Death Stranding,https://www.youtube.com/watch?v=Gu8X7vM3Avw,Trailer
713,"Why not wait and play and find out whats its about....
Thats the whole point of a teaser.......
  so the game can be a surprise!
Kids are so dumb now days",Death Stranding,https://www.youtube.com/watch?v=Gu8X7vM3Avw,Trailer
714,Is that daryl from walking dead???,Death Stranding,https://www.youtube.com/watch?v=Gu8X7vM3Avw,Trailer
715,You pretty much just have to survive and thats it? Anything else?,Death Stranding,https://www.youtube.com/watch?v=Gu8X7vM3Avw,Trailer
716,Apocalyptica path beautiful,Death Stranding,https://www.youtube.com/watch?v=Gu8X7vM3Avw,Trailer
717,closes eyes at night THIS IS A HIDEO KOJIMA GAME,Death Stranding,https://www.youtube.com/watch?v=Gu8X7vM3Avw,Trailer
718,All i can think about is Norman Reedus is working as an Uber Eats delivery guy and everyone tries to steal the food.,Death Stranding,https://www.youtube.com/watch?v=Gu8X7vM3Avw,Trailer
719,I don’t know what it is but I want it,Death Stranding,https://www.youtube.com/watch?v=Gu8X7vM3Avw,Trailer
720,Ouu...I just saw skullface,Death Stranding,https://www.youtube.com/watch?v=Gu8X7vM3Avw,Trailer
721,"Hopefully this one will actually be completed and have an actual ending and not have some 30min bonus video of Kojima talking about what the ending would have been like, wasn't there a game where he did that already? 
*cough ""Phantom Pain.""",Death Stranding,https://www.youtube.com/watch?v=Gu8X7vM3Avw,Trailer
722,Kojima I want what you smoked.,Death Stranding,https://www.youtube.com/watch?v=Gu8X7vM3Avw,Trailer
723,Can't wait for this overhyped game to get a 6/10.,Death Stranding,https://www.youtube.com/watch?v=Gu8X7vM3Avw,Trailer
724,Lader simulator 2019 looks great,Death Stranding,https://www.youtube.com/watch?v=Gu8X7vM3Avw,Trailer
725,Music 3:17 plz,Death Stranding,https://www.youtube.com/watch?v=Gu8X7vM3Avw,Trailer
726,DEATH AND STRING?,Death Stranding,https://www.youtube.com/watch?v=Gu8X7vM3Avw,Trailer
727,"He protec 
He attac 
But most importantly 
He got featus in bakpak",Death Stranding,https://www.youtube.com/watch?v=Gu8X7vM3Avw,Trailer
728,Anyone doesn’t get hyped from the music?,Death Stranding,https://www.youtube.com/watch?v=Gu8X7vM3Avw,Trailer
729,LUV THE NEW BMTH SONG,Death Stranding,https://www.youtube.com/watch?v=Gu8X7vM3Avw,Trailer
730,TRUE. Sekiro: Shadows Die Twice is the Game of the year 2019 because Death Stranding is the Game of the Century,Death Stranding,https://www.youtube.com/watch?v=Gu8X7vM3Avw,Trailer
731,P.t. ?,Death Stranding,https://www.youtube.com/watch?v=Gu8X7vM3Avw,Trailer
732,When you have an official trailer and understand less about the game than in the first previews.,Death Stranding,https://www.youtube.com/watch?v=Gu8X7vM3Avw,Trailer
733,A Hideo Kojima Game with Norman Reedus and Mads Mikkleson I am Sold,Death Stranding,https://www.youtube.com/watch?v=Gu8X7vM3Avw,Trailer
734,daryl...,Death Stranding,https://www.youtube.com/watch?v=Gu8X7vM3Avw,Trailer
735,What is the background sound? Couldn't find it,Death Stranding,https://www.youtube.com/watch?v=Gu8X7vM3Avw,Trailer
736,I'll show you the real thing soon,Death Stranding,https://www.youtube.com/watch?v=Gu8X7vM3Avw,Trailer
737,"The more footage I see of this game, the less I understand what is it about. 

And to think some people thought MGSV the man who sold the world twist was complicated. :/",Death Stranding,https://www.youtube.com/watch?v=Gu8X7vM3Avw,Trailer
738,6:47  Troy Baker? Why is he in every game,Death Stranding,https://www.youtube.com/watch?v=Gu8X7vM3Avw,Trailer
739,"No one... Absolutely no one in the entire milky way and the multiverse... 
Kojima and Guillermo del Toro: Babies can be used to connect the past with the future.",Death Stranding,https://www.youtube.com/watch?v=Gu8X7vM3Avw,Trailer
740,"This game is Epic, I have no Idea. But I am amazed.",Death Stranding,https://www.youtube.com/watch?v=Gu8X7vM3Avw,Trailer
741,"OMG, they aren't showing Gears Gameplay, the world is going to end! Omg, THIS is so amazing, AMAZING! 8 Minutes to show us nothing is OUTSTANDING!",Death Stranding,https://www.youtube.com/watch?v=Gu8X7vM3Avw,Trailer
742,"We demand DLC character skins of USPS, UPS, FedEx (etc.) drivers.",Death Stranding,https://www.youtube.com/watch?v=Gu8X7vM3Avw,Trailer
743,Nobody is going to talk how creepy the beggining looks??,Death Stranding,https://www.youtube.com/watch?v=Gu8X7vM3Avw,Trailer
744,what the hell did i just watch,Death Stranding,https://www.youtube.com/watch?v=Gu8X7vM3Avw,Trailer
745,DARYL,Death Stranding,https://www.youtube.com/watch?v=Gu8X7vM3Avw,Trailer
746,Is it just me or does that look like Daryl form The Walking Dead ??,Death Stranding,https://www.youtube.com/watch?v=Gu8X7vM3Avw,Trailer
747,"Kojima: So, what did you understand from the trailer?
Everyone: YES",Death Stranding,https://www.youtube.com/watch?v=Gu8X7vM3Avw,Trailer
748,Does anyone have a clue wtf is even going on?,Death Stranding,https://www.youtube.com/watch?v=Gu8X7vM3Avw,Trailer
749,This needs to be a movie,Death Stranding,https://www.youtube.com/watch?v=Gu8X7vM3Avw,Trailer
750,I'll watch that movie,Death Stranding,https://www.youtube.com/watch?v=Gu8X7vM3Avw,Trailer
751,I came here because of Bring me the horizon new song!,Death Stranding,https://www.youtube.com/watch?v=Gu8X7vM3Avw,Trailer
752,"So its a critique of our modern isolationist lifestyle.  I'm assuming that this is a future of virtual realities and how our desire to create an artificial version of reality where our every fantasy can be real,  creates problems of its own for the real world that we have left deserted.  Kojima is trying to convey these types of messages (a critique of our modern society and way of life that is unhealthy) in his games for a while now.",Death Stranding,https://www.youtube.com/watch?v=Gu8X7vM3Avw,Trailer
753,1.25 is that Daryl of the Walking Dead?,Death Stranding,https://www.youtube.com/watch?v=Gu8X7vM3Avw,Trailer
754,"Este trailer me hace dudar de la existencia de la ""cordura""",Death Stranding,https://www.youtube.com/watch?v=Gu8X7vM3Avw,Trailer
755,Nothing get stuck in my mind,Death Stranding,https://www.youtube.com/watch?v=Gu8X7vM3Avw,Trailer
756,There's no Norman Reedus without a bike,Death Stranding,https://www.youtube.com/watch?v=Gu8X7vM3Avw,Trailer
757,I'm just gonna guess that these fetus things can see things from 'the other side' because they haven't been born yet?,Death Stranding,https://www.youtube.com/watch?v=Gu8X7vM3Avw,Trailer
758,If am not playing as daryl from the walking dead then no ty,Death Stranding,https://www.youtube.com/watch?v=Gu8X7vM3Avw,Trailer
759,actually the gameplay is excly the same as the trailer,Death Stranding,https://www.youtube.com/watch?v=Gu8X7vM3Avw,Trailer
760,Gureato dazee,Death Stranding,https://www.youtube.com/watch?v=Gu8X7vM3Avw,Trailer
761,"If you wanted David Lynch's remake of Kevin Costner's the Postman, this should be close enough.",Death Stranding,https://www.youtube.com/watch?v=Gu8X7vM3Avw,Trailer
762,people keep guessing,Death Stranding,https://www.youtube.com/watch?v=Gu8X7vM3Avw,Trailer
763,4:17,Death Stranding,https://www.youtube.com/watch?v=Gu8X7vM3Avw,Trailer
764,Daryl dixon?,Death Stranding,https://www.youtube.com/watch?v=Gu8X7vM3Avw,Trailer
765,Looks awesome,Death Stranding,https://www.youtube.com/watch?v=Gu8X7vM3Avw,Trailer
766,I have no idea what I just watched but I'm sold. lol,Death Stranding,https://www.youtube.com/watch?v=Gu8X7vM3Avw,Trailer
767,"Ok, is it official yet?  If you have motorcycles in your game, you must have Reedus in the game as well.  Hell, I only clicked on this because I saw his face! ❤️",Death Stranding,https://www.youtube.com/watch?v=Gu8X7vM3Avw,Trailer
768,anyone else think they got more info from the rick and morty ad for this game?,Death Stranding,https://www.youtube.com/watch?v=Gu8X7vM3Avw,Trailer
769,This game looks weird af!,Death Stranding,https://www.youtube.com/watch?v=Gu8X7vM3Avw,Trailer
770,what is the guy from twd doing here,Death Stranding,https://www.youtube.com/watch?v=Gu8X7vM3Avw,Trailer
771,5:33 what's the music?,Death Stranding,https://www.youtube.com/watch?v=Gu8X7vM3Avw,Trailer
772,"Будет хорошая игра, но у меня не PS",Death Stranding,https://www.youtube.com/watch?v=Gu8X7vM3Avw,Trailer
773,Am i the only one that thinks this dude from 1:25 looks like daryl from the walking dead ?😂,Death Stranding,https://www.youtube.com/watch?v=Gu8X7vM3Avw,Trailer
774,"of cours norman reedus gets to ride a bike in this mo-.. I mean serie-,,, ,  game, its a surv.. interactive storyte-, an apocalyptic war- ... a.. game",Death Stranding,https://www.youtube.com/watch?v=Gu8X7vM3Avw,Trailer
775,I lost interest on every game i'm playing right now after seeing this.,Death Stranding,https://www.youtube.com/watch?v=Gu8X7vM3Avw,Trailer
776,"I don’t how I feel about the combat or the traversal system (bikes). seeing as this game is using the same engine as horizon zero dawn - which had a shitty traversal system - I’m worried, but I hope other parts of the game are great",Death Stranding,https://www.youtube.com/watch?v=Gu8X7vM3Avw,Trailer
777,So is this what was supposed to be Silent Hills?,Death Stranding,https://www.youtube.com/watch?v=Gu8X7vM3Avw,Trailer
778,GOTY 2019,Death Stranding,https://www.youtube.com/watch?v=Gu8X7vM3Avw,Trailer
779,I DONT INOW WHY NOBODY IS DOING REAL WALKING DEAD GAME JUST AS THE TV SHOW. (Not the clementine one) BUT JUST LIKE THE ACTION GAME LIKE THIS BUT WITHA STORY AND CHOOSES AND ETC IT WOULD BE THE BEST GAME!!!!,Death Stranding,https://www.youtube.com/watch?v=Gu8X7vM3Avw,Trailer
780,"Well, that clears up everything!",Death Stranding,https://www.youtube.com/watch?v=Gu8X7vM3Avw,Trailer
781,Kojima has good taste of music,Death Stranding,https://www.youtube.com/watch?v=Gu8X7vM3Avw,Trailer
782,Do you need to be on shrooms to understand what the game is about?,Death Stranding,https://www.youtube.com/watch?v=Gu8X7vM3Avw,Trailer
783,MADs is so hawt,Death Stranding,https://www.youtube.com/watch?v=Gu8X7vM3Avw,Trailer
784,Am i the only one not hyped about this?,Death Stranding,https://www.youtube.com/watch?v=Gu8X7vM3Avw,Trailer
785,"This entire game so far:
""The only thing that makes sense is that nothing makes sense.""",Death Stranding,https://www.youtube.com/watch?v=Gu8X7vM3Avw,Trailer
786,Idk what is the main point of this game,Death Stranding,https://www.youtube.com/watch?v=Gu8X7vM3Avw,Trailer
787,The only reason I’ll download this game is because the walking dead character is in this game ! 😂,Death Stranding,https://www.youtube.com/watch?v=Gu8X7vM3Avw,Trailer
788,Why is there Battlefield 1 in the game?,Death Stranding,https://www.youtube.com/watch?v=Gu8X7vM3Avw,Trailer
789,What is the name of the song around the 06:20 min mark? I am desperately looking for it,Death Stranding,https://www.youtube.com/watch?v=Gu8X7vM3Avw,Trailer
790,Anybody here after watching beastboy shub's video,Death Stranding,https://www.youtube.com/watch?v=Gu8X7vM3Avw,Trailer
791,Anyone after finishing the game ?,Death Stranding,https://www.youtube.com/watch?v=Gu8X7vM3Avw,Trailer
792,Okayyy i need this.... its no where 6:32,Death Stranding,https://www.youtube.com/watch?v=Gu8X7vM3Avw,Trailer
793,Thats Kojima Konami the creator of solid games.,Death Stranding,https://www.youtube.com/watch?v=Gu8X7vM3Avw,Trailer
794,This literally makes zero sense and yet I'm totally fascinated and invested in it at the same time.,Death Stranding,https://www.youtube.com/watch?v=Gu8X7vM3Avw,Trailer
795,what ... ?,Death Stranding,https://www.youtube.com/watch?v=Gu8X7vM3Avw,Trailer
796,So.... Is your name going to be after and before every cut-scene or after every 1 kilometers walked?,Death Stranding,https://www.youtube.com/watch?v=Gu8X7vM3Avw,Trailer
797,OMG Mads!!!,Death Stranding,https://www.youtube.com/watch?v=Gu8X7vM3Avw,Trailer
798,"I pray Tomokazu Fukushima is brought back along with David Hayter for a fox engine finishing of MGS saga, all that investment must be their for another game with out Hideo Kojima, he fumbled MGSV, nothing wrong on fixing it!",Death Stranding,https://www.youtube.com/watch?v=Gu8X7vM3Avw,Trailer
799,"Kojima: Konami sent us to hell but we're going even deeper.
Sam: Hideo I'm already confused",Death Stranding,https://www.youtube.com/watch?v=Gu8X7vM3Avw,Trailer
800,Konami definitely will buy the Game 😅,Death Stranding,https://www.youtube.com/watch?v=Gu8X7vM3Avw,Trailer
801,this is how gameplay trailers should be done,Death Stranding,https://www.youtube.com/watch?v=Gu8X7vM3Avw,Trailer
802,"i think his name isnt sam, i think its daryl",Death Stranding,https://www.youtube.com/watch?v=Gu8X7vM3Avw,Trailer
803,"Yes: Kojima
No: Yes",Death Stranding,https://www.youtube.com/watch?v=Gu8X7vM3Avw,Trailer
804,"release date = Nov. 8, 2019
A popup was covering it",Death Stranding,https://www.youtube.com/watch?v=Gu8X7vM3Avw,Trailer
805,"Konami: you're fired kojima
Kojima: im gonna end this man whole career.",Death Stranding,https://www.youtube.com/watch?v=Gu8X7vM3Avw,Trailer
806,Anyone remember this guy from the walking dead?????,Death Stranding,https://www.youtube.com/watch?v=Gu8X7vM3Avw,Trailer
807,I can't wait to play as Sam Porknbritches,Death Stranding,https://www.youtube.com/watch?v=Gu8X7vM3Avw,Trailer
808,Lol PC players sweatin 😂😥,Death Stranding,https://www.youtube.com/watch?v=Gu8X7vM3Avw,Trailer
809,"""This game is either incredibly smart or incredibly stupid.  Either way we'll see on 11/9/2019.""
-Brill, Enemy of the State",Death Stranding,https://www.youtube.com/watch?v=Gu8X7vM3Avw,Trailer
810,One word: Minecraft?,Death Stranding,https://www.youtube.com/watch?v=Gu8X7vM3Avw,Trailer
811,Norman Reedus and The Freaky Fetus,Death Stranding,https://www.youtube.com/watch?v=Gu8X7vM3Avw,Trailer
812,Which trailer is the actual game ?,Death Stranding,https://www.youtube.com/watch?v=Gu8X7vM3Avw,Trailer
813,I still want silent hills,Death Stranding,https://www.youtube.com/watch?v=Gu8X7vM3Avw,Trailer
814,When u order something form Amazon but also live in Amazon.,Death Stranding,https://www.youtube.com/watch?v=Gu8X7vM3Avw,Trailer
815,Kojima + Del Toro = Ultimate Sify/Horror game,Death Stranding,https://www.youtube.com/watch?v=Gu8X7vM3Avw,Trailer
816,Another zombie game???,Death Stranding,https://www.youtube.com/watch?v=Gu8X7vM3Avw,Trailer
817,*sigh... Guess I'm buying a ps4 now...,Death Stranding,https://www.youtube.com/watch?v=Gu8X7vM3Avw,Trailer
818,"""rebuilding america isn't going to get rid of the PTs. long as they're still around, there's no escaping it""


hmm. really makes you think. really makes you think that P.T isn't dead..",Death Stranding,https://www.youtube.com/watch?v=Gu8X7vM3Avw,Trailer
819,They took his baby Metal Gear so Kojima made a game about protecting a baby from Konami employees.,Death Stranding,https://www.youtube.com/watch?v=Gu8X7vM3Avw,Trailer
820,"When the world ends and wipes out almost all of humanity, the only survivors would be Mick Jagger, cockroaches, and Amazon Prime. Especially Amazon Prime...",Death Stranding,https://www.youtube.com/watch?v=Gu8X7vM3Avw,Trailer
821,"So I think it's going to be a standard stealth action game at its core but it's gameplay is going to thrive due to some addicting gameplay loop just like MGSV. It will probably be a mostly single player game but I expect something like what we seen in Dark Souls but taken to the next level as far as multiplayer is concerned. The stuff other players do in their game might change the game world for everyone somehow. Exploration seems to be a heavy focus. It won't be a ""survival horror"" game but avoiding enemies seems to be encouraged. It will be survival horror-lite like The Last of Us probably.",Death Stranding,https://www.youtube.com/watch?v=Gu8X7vM3Avw,Trailer
822,You can make America great again Sam,Death Stranding,https://www.youtube.com/watch?v=Gu8X7vM3Avw,Trailer
823,Graphics seems good but game too confusing,Death Stranding,https://www.youtube.com/watch?v=Gu8X7vM3Avw,Trailer
824,Kojima and the author of Evangelion now are drinking some cold beers while looks at their fandoms confused AF,Death Stranding,https://www.youtube.com/watch?v=Gu8X7vM3Avw,Trailer
825,That baby has the sickest job,Death Stranding,https://www.youtube.com/watch?v=Gu8X7vM3Avw,Trailer
826,Anyone else confused?,Death Stranding,https://www.youtube.com/watch?v=Gu8X7vM3Avw,Trailer
827,I have zero idea what's going on but at least the music is good.,Death Stranding,https://www.youtube.com/watch?v=Gu8X7vM3Avw,Trailer
828,Should I be worried that Kojima is releasing Death Stranding on my birthday?,Death Stranding,https://www.youtube.com/watch?v=Gu8X7vM3Avw,Trailer
829,"Thanks kojima !! now i understand everything


-",Death Stranding,https://www.youtube.com/watch?v=Gu8X7vM3Avw,Trailer
830,BB : bridge baby,Death Stranding,https://www.youtube.com/watch?v=Gu8X7vM3Avw,Trailer
831,Just finished the game...want to start it again immediately..,Death Stranding,https://www.youtube.com/watch?v=Gu8X7vM3Avw,Trailer
832,Welp have to get it now lolz,Death Stranding,https://www.youtube.com/watch?v=Gu8X7vM3Avw,Trailer
833,"This is silent hill or metal gear solid game ?

Why not both",Death Stranding,https://www.youtube.com/watch?v=Gu8X7vM3Avw,Trailer
834,"1st trailer: I’m gonna be as weird, crazy and cryptic as possible.
2nd trailer: Hold my beer.",Death Stranding,https://www.youtube.com/watch?v=Gu8X7vM3Avw,Trailer
835,Music pls,Death Stranding,https://www.youtube.com/watch?v=Gu8X7vM3Avw,Trailer
836,Anyone know the song from 1:17 starting,Death Stranding,https://www.youtube.com/watch?v=Gu8X7vM3Avw,Trailer
837,Perhaps the guy who had a connection to the other side is a grown up bridge baby? Or he might be Dr Facilier,Death Stranding,https://www.youtube.com/watch?v=Gu8X7vM3Avw,Trailer
838,What’s with the baby?,Death Stranding,https://www.youtube.com/watch?v=Gu8X7vM3Avw,Trailer
839,How to make labor look cool,Death Stranding,https://www.youtube.com/watch?v=Gu8X7vM3Avw,Trailer
840,Wow,Death Stranding,https://www.youtube.com/watch?v=Gu8X7vM3Avw,Trailer
841,I think Hideo Kojima will show AAA gaming companies how to make  a real game.,Death Stranding,https://www.youtube.com/watch?v=Gu8X7vM3Avw,Trailer
842,The Kojima Effect,Death Stranding,https://www.youtube.com/watch?v=Gu8X7vM3Avw,Trailer
843,"Writer: so what kind of plot should we have?


Kojima: YES. I mean... no. Wait maybe? Idk",Death Stranding,https://www.youtube.com/watch?v=Gu8X7vM3Avw,Trailer
844,They made a Jacobs ladder game?,Death Stranding,https://www.youtube.com/watch?v=Gu8X7vM3Avw,Trailer
845,This game is gonna be...,Death Stranding,https://www.youtube.com/watch?v=Gu8X7vM3Avw,Trailer
846,What is happening,Death Stranding,https://www.youtube.com/watch?v=Gu8X7vM3Avw,Trailer
847,"Also it’s not hard to make connections without shaking hands, gamers know that’s not true",Death Stranding,https://www.youtube.com/watch?v=Gu8X7vM3Avw,Trailer
848,"It looks like a heavily story based game that is open world with action and fighting, along with puzzle solving, maybe racing, and some horror.
Wtf",Death Stranding,https://www.youtube.com/watch?v=Gu8X7vM3Avw,Trailer
849,What is happening,Death Stranding,https://www.youtube.com/watch?v=Gu8X7vM3Avw,Trailer
850,smog????no gameplay... mmmm....,Death Stranding,https://www.youtube.com/watch?v=Gu8X7vM3Avw,Trailer
851,Time to flex on those Xbox owners,Death Stranding,https://www.youtube.com/watch?v=Gu8X7vM3Avw,Trailer
852,Who pulled a reverse card?!?,Death Stranding,https://www.youtube.com/watch?v=Gu8X7vM3Avw,Trailer
853,I bet you'll see 'Written and Directed by Hideo Kojima' 12 times before the actual gameplay starts.,Death Stranding,https://www.youtube.com/watch?v=Gu8X7vM3Avw,Trailer
854,Это вот такую колхозную графику и анимационность фанаты гениальностью называют?,Death Stranding,https://www.youtube.com/watch?v=Gu8X7vM3Avw,Trailer
855,"I still don’t understand what it is about, but I will buy it, Kojima has never released a bad game (his worst MGSV won game of the year and I enjoyed the first 20 hours of it until I got bored from lack of story) so he is pretty much a guarantee",Death Stranding,https://www.youtube.com/watch?v=Gu8X7vM3Avw,Trailer
856,"wtf this game is about, i can't understand it",Death Stranding,https://www.youtube.com/watch?v=Gu8X7vM3Avw,Trailer
