,comment,Gioco,URL,Video
3,How our parents got to school according to their stories,Death Stranding,https://www.youtube.com/watch?v=Gu8X7vM3Avw,Trailer
4,"Sony: So, how much context should we give the players?

Kojima: No.",Death Stranding,https://www.youtube.com/watch?v=Gu8X7vM3Avw,Trailer
5,"Kojima: You know how there were parts in metal gear that weren’t weird?
Employee: Yeah
Kojima: We’re not doing that this time",Death Stranding,https://www.youtube.com/watch?v=Gu8X7vM3Avw,Trailer
6,"2019: This game makes no sense?! 

2020 Pandemic: ...Ok...this game makes sense now...",Death Stranding,https://www.youtube.com/watch?v=Gu8X7vM3Avw,Trailer
7,"Kojima: So what's this game about?


Interviewer: wait what",Death Stranding,https://www.youtube.com/watch?v=Gu8X7vM3Avw,Trailer
8,"Interviewer: Mr Kojima, what about the baby in the jar and the monster made from nightmare tar?

Hideo Kojima: Did you see the ladders?",Death Stranding,https://www.youtube.com/watch?v=Gu8X7vM3Avw,Trailer
9,I just want to know who’s the English interpreter was for Kojima that had to listen to this story then explain it to the American actors. That’s the real MVP,Death Stranding,https://www.youtube.com/watch?v=Gu8X7vM3Avw,Trailer
10,"Wow, looking back, the trailers absolutely told us about what the game is.",Death Stranding,https://www.youtube.com/watch?v=Gu8X7vM3Avw,Trailer
11,"6:47 ""It's so hard to form connections when you can't shake hands""
Listening to this in March 2020 makes me feel that Kojima is a prophet.",Death Stranding,https://www.youtube.com/watch?v=Gu8X7vM3Avw,Trailer
12,Anyone else feels like you just watched trailer for 5 different games?,Death Stranding,https://www.youtube.com/watch?v=Gu8X7vM3Avw,Trailer
13,"Game Developer: Kojima-san, please... We've been coding, writing, and designing this game for months! Could you please just tell us what this game is about?

Kojima: You're fired",Death Stranding,https://www.youtube.com/watch?v=Gu8X7vM3Avw,Trailer
14,This makes Inception look like an elementary school play.,Death Stranding,https://www.youtube.com/watch?v=Gu8X7vM3Avw,Trailer
15,Norman should Reedus the backstory of this game,Death Stranding,https://www.youtube.com/watch?v=Gu8X7vM3Avw,Trailer
16,"People who don't play games: What?
People who do play games: What?
Kojima: What? Oh wait.",Death Stranding,https://www.youtube.com/watch?v=Gu8X7vM3Avw,Trailer
17,"Normal media: show more content= spoiling
Kojima Media: show more content= make you more confused",Death Stranding,https://www.youtube.com/watch?v=Gu8X7vM3Avw,Trailer
18,"This comment section has made me cry laughing more times than i have in 365 day's, this fan base is full of comedians",Death Stranding,https://www.youtube.com/watch?v=Gu8X7vM3Avw,Trailer
19,"You had me at portable pickled fetus backpack plug in cord black smoke jar portal to hell thing,",Death Stranding,https://www.youtube.com/watch?v=Gu8X7vM3Avw,Trailer
20,"Me: watches death stranding trailer

My mom late at night : It's late go to sleep.",Death Stranding,https://www.youtube.com/watch?v=Gu8X7vM3Avw,Trailer
21,"audience: okay this looks cool but what the hell is going on?
kojima: we actually don't know ourselves",Death Stranding,https://www.youtube.com/watch?v=Gu8X7vM3Avw,Trailer
22,I have a better understanding on quantum physics than I do of this game.,Death Stranding,https://www.youtube.com/watch?v=Gu8X7vM3Avw,Trailer
23,"Can't help but imagine how Kojima got this crazy casting together :


Kojima : Listen I can't really tell you about the story right now, but there's gonna be portable extendable ladders in this game.",Death Stranding,https://www.youtube.com/watch?v=Gu8X7vM3Avw,Trailer
24,"Fans: Please tell us about your game! 

Kojima: performs an ancient ritualistic tribe dance filled with grunts, screams, and undistinguishable singing",Death Stranding,https://www.youtube.com/watch?v=Gu8X7vM3Avw,Trailer
25,"Repairman walks in with a ladder: 
Kojima:  perfect..",Death Stranding,https://www.youtube.com/watch?v=Gu8X7vM3Avw,Trailer
26,"reveal trailer drops
Don't worry, we will know what this game is once there are more trailers dropping
VGA trailer drops
Don't worry, we will know what this game is once there is a gameplay trailer dropping",Death Stranding,https://www.youtube.com/watch?v=Gu8X7vM3Avw,Trailer
27,"Ah, nice to see a fresh new survival racing farming horror RPG adventure puzzle magic platformer RTS dating sim arcade shooter sci-fi hack n' slash scientist simulator game from Kojima",Death Stranding,https://www.youtube.com/watch?v=Gu8X7vM3Avw,Trailer
28,"I’m hoping/predicting that after Death Stranding’s release, Kojima is going make enough money to buy the gaming rights for Silent Hill from Konami",Death Stranding,https://www.youtube.com/watch?v=Gu8X7vM3Avw,Trailer
29,"""WE NEED TO REUNITE SOCIETY!""

""WHAT?""

""I SAID WE NEED TO REUNITE SOCIETY!""

""I CAN´T HEAR YOU!""",Death Stranding,https://www.youtube.com/watch?v=Gu8X7vM3Avw,Trailer
30,Who else is back here after finishing the game?,Death Stranding,https://www.youtube.com/watch?v=Gu8X7vM3Avw,Trailer
31,When did USPS become so determined?,Death Stranding,https://www.youtube.com/watch?v=Gu8X7vM3Avw,Trailer
32,This is what Amazon has to go through when you order 2 day delivery.....,Death Stranding,https://www.youtube.com/watch?v=Gu8X7vM3Avw,Trailer
33,This game is being made in an asylum with a lot of free drugs.,Death Stranding,https://www.youtube.com/watch?v=Gu8X7vM3Avw,Trailer
34,"5:09
Can you imagine being a WW1 soldier and some time traveler pulls up and starts blasting you",Death Stranding,https://www.youtube.com/watch?v=Gu8X7vM3Avw,Trailer
35,"People: What type of game is this?
Hideo Kojima: Yes",Death Stranding,https://www.youtube.com/watch?v=Gu8X7vM3Avw,Trailer
36,Anyone noticed there's an eye blink every time the shot changes...? Is whole thing through someone's eyes...?,Death Stranding,https://www.youtube.com/watch?v=Gu8X7vM3Avw,Trailer
37,I'm excited but I'm not sure what I'm excited about.,Death Stranding,https://www.youtube.com/watch?v=Gu8X7vM3Avw,Trailer
38,3:22 I always wanted to fight my enemies with a suitcase.,Death Stranding,https://www.youtube.com/watch?v=Gu8X7vM3Avw,Trailer
39,3:15 I wonder if my UPS delivery man can do this...,Death Stranding,https://www.youtube.com/watch?v=Gu8X7vM3Avw,Trailer
40,"I honestly believe, that most of the time when Hideo makes a game he's on acid...",Death Stranding,https://www.youtube.com/watch?v=Gu8X7vM3Avw,Trailer
41,"Deadman, Heartman, Die-Hardman...........it sounds like a parody lol. Like that one scene in Dodgeball when Ben Stiller introduces his ""badass"" team ""This is Blade, Laser, Blazer...""",Death Stranding,https://www.youtube.com/watch?v=Gu8X7vM3Avw,Trailer
42,Mr kojima you can't fool us I know that is a racing game,Death Stranding,https://www.youtube.com/watch?v=Gu8X7vM3Avw,Trailer
43,"For some reason I feel this is Kojima's take on purgatory, heaven, and hell.",Death Stranding,https://www.youtube.com/watch?v=Gu8X7vM3Avw,Trailer
44,"Kojima: Enters game development studio high AF 
""Arright everybody! Risten up!""",Death Stranding,https://www.youtube.com/watch?v=Gu8X7vM3Avw,Trailer
45,"Wow, everything make sense now after I played the game and watched this trailer again.",Death Stranding,https://www.youtube.com/watch?v=Gu8X7vM3Avw,Trailer
46,"Interviewer: ""Are you happy with how the game is looking""?
Kojima: "" Yes,  l are"".",Death Stranding,https://www.youtube.com/watch?v=Gu8X7vM3Avw,Trailer
47,"So what is the game about? Survival? Action? Horror? Warfare? Sci-Fi? Military? Magic? Zombie? Post Apocalyptic? or Historic?

Kojima: Yes",Death Stranding,https://www.youtube.com/watch?v=Gu8X7vM3Avw,Trailer
48,"Me: what??
Kojima: Exactly
Norman: ohhh okay
Me: huh?",Death Stranding,https://www.youtube.com/watch?v=Gu8X7vM3Avw,Trailer
49,"All the funny comments about how the plot does not make sense
It surely doesnt for people who are used to plain and simple stories like short movies and simple series
If you play the game, pay attention, read some files (the important ones are highlighted, as always) youll certainly understand it",Death Stranding,https://www.youtube.com/watch?v=Gu8X7vM3Avw,Trailer
50,This game was so surreal it really felt like I went through a whole journey to finish it. Kojima and his team did a great job. Very unique and enjoyable. The only thing missing was a music player after you beat the game that would be perfect,Death Stranding,https://www.youtube.com/watch?v=Gu8X7vM3Avw,Trailer
51,This game was dope. Been thinking about replaying it,Death Stranding,https://www.youtube.com/watch?v=Gu8X7vM3Avw,Trailer
52,"Everyone: What is Death Stranding about?
Hideo Kojima: NO..
Everyone: No what?..
Hideo Kojima: Yes.",Death Stranding,https://www.youtube.com/watch?v=Gu8X7vM3Avw,Trailer
53,So Hannibal survived his fall after all.....,Death Stranding,https://www.youtube.com/watch?v=Gu8X7vM3Avw,Trailer
54,"I’ve watched these trailers hundreds of times, beaten the game and this one still gets me psyched",Death Stranding,https://www.youtube.com/watch?v=Gu8X7vM3Avw,Trailer
55,Come back to see the trailers after the game is released is actually becoming a religion for me,Death Stranding,https://www.youtube.com/watch?v=Gu8X7vM3Avw,Trailer
56,"He: travels with baby in a container trough a dangerous world
We: He has a expendable ladder!!!!",Death Stranding,https://www.youtube.com/watch?v=Gu8X7vM3Avw,Trailer
57,"Co-writer: How confusing should the game's story be?

Hideo: ""Yes""",Death Stranding,https://www.youtube.com/watch?v=Gu8X7vM3Avw,Trailer
58,Let's all put our confusion to the side and just admire that beautiful soundtrack though.,Death Stranding,https://www.youtube.com/watch?v=Gu8X7vM3Avw,Trailer
59,This is the game that inspired the year 2020.,Death Stranding,https://www.youtube.com/watch?v=Gu8X7vM3Avw,Trailer
60,"Kojima: Let's ƒuck up the Matrix.


Dev: wait what?",Death Stranding,https://www.youtube.com/watch?v=Gu8X7vM3Avw,Trailer
61,I'm genuinely excited for those ladder physics haha,Death Stranding,https://www.youtube.com/watch?v=Gu8X7vM3Avw,Trailer
62,"People : mgs is confusing 
Kojima : hold my konami tears",Death Stranding,https://www.youtube.com/watch?v=Gu8X7vM3Avw,Trailer
63,“Maybe we should eat the baby???”,Death Stranding,https://www.youtube.com/watch?v=Gu8X7vM3Avw,Trailer
64,Man this new Fallout: The Walking Dead looks amazing!,Death Stranding,https://www.youtube.com/watch?v=Gu8X7vM3Avw,Trailer
65,I can't belive they're making another Dance Dance Revolution Game,Death Stranding,https://www.youtube.com/watch?v=Gu8X7vM3Avw,Trailer
66,"The visuals are AMAZING.
finally a game with characters that don't look like each other..",Death Stranding,https://www.youtube.com/watch?v=Gu8X7vM3Avw,Trailer
67,"Konami: you can't make a expensive and extremely confusing story game.
Kojima: Hold my bridge-baby.",Death Stranding,https://www.youtube.com/watch?v=Gu8X7vM3Avw,Trailer
68,"Everyone: what game is it? kojema : yes

Me: NOBODY GON TELL ME ABOUT THE BABY?",Death Stranding,https://www.youtube.com/watch?v=Gu8X7vM3Avw,Trailer
69,I imagine this game is gonna invent a genre the way Metal Gear invented the stealth genre.,Death Stranding,https://www.youtube.com/watch?v=Gu8X7vM3Avw,Trailer
70,This is a great game. I haven't played all the way through yet cause I just go it but it's still a pretty good game.,Death Stranding,https://www.youtube.com/watch?v=Gu8X7vM3Avw,Trailer
71,I love how this game is looking I’ve been following it since it was announced. And I love the fact that I still have no clue what it is 😂,Death Stranding,https://www.youtube.com/watch?v=Gu8X7vM3Avw,Trailer
72,"Konami: ""we're taking MGS and you're fired""
Kojima: creates an entirely unique universe for paranormal political drama from scratch in just a few years
He can't be stopped",Death Stranding,https://www.youtube.com/watch?v=Gu8X7vM3Avw,Trailer
73,I wonder if all the actors will come back for the sequels to this Sony trilogy.,Death Stranding,https://www.youtube.com/watch?v=Gu8X7vM3Avw,Trailer
74,Metal Gear Solid Gaiden: Death Stranding,Death Stranding,https://www.youtube.com/watch?v=Gu8X7vM3Avw,Trailer
75,Looks a bit like MGSV in parts but on even more crack.  Sweet.,Death Stranding,https://www.youtube.com/watch?v=Gu8X7vM3Avw,Trailer
76,I played when it released and finished it fully...then Covid19 happened and it almost seems like foreshadowing. We got porters now... and we can't even shake hands. Heck just rethinking of many aspects of the game and it doesn't seem so fictional anymore...,Death Stranding,https://www.youtube.com/watch?v=Gu8X7vM3Avw,Trailer
77,"me after trailer: 
All Right Then, Keep Your Secrets",Death Stranding,https://www.youtube.com/watch?v=Gu8X7vM3Avw,Trailer
78,"Game developers: “Okay, so what’s this new game going to be about?”
 kojima: “Yes”",Death Stranding,https://www.youtube.com/watch?v=Gu8X7vM3Avw,Trailer
79,This entire game has taken on a whole new meaning nowadays.,Death Stranding,https://www.youtube.com/watch?v=Gu8X7vM3Avw,Trailer
80,"2019: ok this game looks really contemporary
2020: so what's your dooms level?",Death Stranding,https://www.youtube.com/watch?v=Gu8X7vM3Avw,Trailer
81,Remember is to live. I remember the first time watched this trailer. I still consider this game one of the best of my life,Death Stranding,https://www.youtube.com/watch?v=Gu8X7vM3Avw,Trailer
82,"Non gamers : confused
Gamers : confused
Kojima : confused",Death Stranding,https://www.youtube.com/watch?v=Gu8X7vM3Avw,Trailer
83,Finally here! And its a Master pjece and a Milestone in Gaming History.,Death Stranding,https://www.youtube.com/watch?v=Gu8X7vM3Avw,Trailer
84,"Graphics: great
Music: great
Story: ?
Gameplay: ?",Death Stranding,https://www.youtube.com/watch?v=Gu8X7vM3Avw,Trailer
85,"This reminds me of Dark, Norman Reedus looks like Jonas and Mad Mikkelsen looks like Ulrich, maybe is a parallel universe from the end of the second season",Death Stranding,https://www.youtube.com/watch?v=Gu8X7vM3Avw,Trailer
86,6:20 I NEED THIS SOUNDTRACK,Death Stranding,https://www.youtube.com/watch?v=Gu8X7vM3Avw,Trailer
87,"Can you tell us what the game is going to be about?

Kojima: Yesn't",Death Stranding,https://www.youtube.com/watch?v=Gu8X7vM3Avw,Trailer
88,"I kinda think that line at the end from Mads Mikkelson was also kinda addressed to us, from Kojima.",Death Stranding,https://www.youtube.com/watch?v=Gu8X7vM3Avw,Trailer
89,My boy Kojima been dropping that acid again I see.,Death Stranding,https://www.youtube.com/watch?v=Gu8X7vM3Avw,Trailer
90,This trailer is a Masterpiece,Death Stranding,https://www.youtube.com/watch?v=Gu8X7vM3Avw,Trailer
91,"Interviewer: So what's this game about?

Kojima: Yes",Death Stranding,https://www.youtube.com/watch?v=Gu8X7vM3Avw,Trailer
92,"“I’ll show you the real thing soon, I promise”",Death Stranding,https://www.youtube.com/watch?v=Gu8X7vM3Avw,Trailer
93,the hype went on another level at 4:56 when apocalypta starts playing when I watched this trailer on 1st day.,Death Stranding,https://www.youtube.com/watch?v=Gu8X7vM3Avw,Trailer
94,"Everybody: buys and plays the game in order to understand the story
Death Stranding: stays ultra cryptic until the very end where it only drops a revelation that raises more questions, ready to be answered in a sequel
Everybody: WE'VE BEEN PLAYED",Death Stranding,https://www.youtube.com/watch?v=Gu8X7vM3Avw,Trailer
95,4:47 Doesn't it looks like Battlefield 1?,Death Stranding,https://www.youtube.com/watch?v=Gu8X7vM3Avw,Trailer
96,I see they took the ladder from MGS3,Death Stranding,https://www.youtube.com/watch?v=Gu8X7vM3Avw,Trailer
97,I hate how konami scrapped all the stuff kojima worked on in Mgsv like mission 51 and 52,Death Stranding,https://www.youtube.com/watch?v=Gu8X7vM3Avw,Trailer
98,"Interviewer: wait, what's this game even about?
Kojima: yes.",Death Stranding,https://www.youtube.com/watch?v=Gu8X7vM3Avw,Trailer
99,Can't wait for the Nekopara segment of this game,Death Stranding,https://www.youtube.com/watch?v=Gu8X7vM3Avw,Trailer
100,"Devs: Do you want us to put ""A HIDEO KOJIMA GAME"" title in every loading screen?
Kojima: No, make sure players see it even in their nightmares. (Thanks A LOT for the ""Likes"" people, never reached 1K Before 🙏🙏🙏)",Death Stranding,https://www.youtube.com/watch?v=Gu8X7vM3Avw,Trailer
101,İn the end the soldier is Venom Snake he is want revenge for a his incomplete game.,Death Stranding,https://www.youtube.com/watch?v=Gu8X7vM3Avw,Trailer
102,Why does it feel nostalgic watching the trailer again?,Death Stranding,https://www.youtube.com/watch?v=Gu8X7vM3Avw,Trailer
103,"I see kojima used some of the leftover fabric from MGS to sow together this magnificent tapestry. 

Looks like a post apocalyptic mgs.",Death Stranding,https://www.youtube.com/watch?v=Gu8X7vM3Avw,Trailer
104,"Eric Andre and Hannibal 
“What do you think they did before Ladders were invented!”",Death Stranding,https://www.youtube.com/watch?v=Gu8X7vM3Avw,Trailer
105,"Gamers: What is this game all about??
Kojima: Yes!",Death Stranding,https://www.youtube.com/watch?v=Gu8X7vM3Avw,Trailer
106,The Best graphics game in the history,Death Stranding,https://www.youtube.com/watch?v=Gu8X7vM3Avw,Trailer
107,can already tell from the start I'm gonna go through a wave of emotions,Death Stranding,https://www.youtube.com/watch?v=Gu8X7vM3Avw,Trailer
108,Death Stranding has some similarities to Metal Gear. A nod to how The Legend of Dragoon has similarities to Final Fantasy.,Death Stranding,https://www.youtube.com/watch?v=Gu8X7vM3Avw,Trailer
109,I love this comment section... I love it with all my heart! <3,Death Stranding,https://www.youtube.com/watch?v=Gu8X7vM3Avw,Trailer
110,"I'll give you one thing, Kojima sure knows how to make an audience excited for a game they know nothing about.",Death Stranding,https://www.youtube.com/watch?v=Gu8X7vM3Avw,Trailer
111,So....is there going to be an Alpine front? Just like in Battlefield 1?,Death Stranding,https://www.youtube.com/watch?v=Gu8X7vM3Avw,Trailer
112,"Music sounds like heavy metal Witcher 3 music.  That violin mixed with the distortion.  Sounds pretty cool.  Looking forward to playing this game in ""approximately 1 day and 11 hours.""",Death Stranding,https://www.youtube.com/watch?v=Gu8X7vM3Avw,Trailer
113,"Apocalyptica - Path in the background :O 
Now i wanna play this game even more xD",Death Stranding,https://www.youtube.com/watch?v=Gu8X7vM3Avw,Trailer
114,This trailer sounds amazing even if the game is crap at least we got a really cool trailer,Death Stranding,https://www.youtube.com/watch?v=Gu8X7vM3Avw,Trailer
115,"I love how the Man in the Golden Mask takes off his mask to reveal...


ANOTHER MASK! XD",Death Stranding,https://www.youtube.com/watch?v=Gu8X7vM3Avw,Trailer
116,4:45 If Kojima Productions and EA worked together on Battlefield 1.,Death Stranding,https://www.youtube.com/watch?v=Gu8X7vM3Avw,Trailer
117,"""ps4 pro enhanced"" sure wonder what that title came from.",Death Stranding,https://www.youtube.com/watch?v=Gu8X7vM3Avw,Trailer
118,"My genuine first reaction to this game was ""WTF""",Death Stranding,https://www.youtube.com/watch?v=Gu8X7vM3Avw,Trailer
119,"Noticed the logo and the tears.
Says: Eat Sting.",Death Stranding,https://www.youtube.com/watch?v=Gu8X7vM3Avw,Trailer
120,"Me: How can you watch a game trailer and get less information about the game?

Hideo Kojima: Yes",Death Stranding,https://www.youtube.com/watch?v=Gu8X7vM3Avw,Trailer
121,"Omg, so nice to hear good old Apocalyptica! Great choice!",Death Stranding,https://www.youtube.com/watch?v=Gu8X7vM3Avw,Trailer
122,That end shot with Mads would make an incredible poster,Death Stranding,https://www.youtube.com/watch?v=Gu8X7vM3Avw,Trailer
123,Norman Reedus is getting ready to deletus the fetus to complete us.,Death Stranding,https://www.youtube.com/watch?v=Gu8X7vM3Avw,Trailer
124,"God, I ABSOLUTELY loved this song back when I played Oblivion (Elder Scrolls 4)  Used to bump apocalyptica to all this. So amazing, can't wait to see the next Hideo Game with Gorillaz, System of a Down, Linkin Park,  Amon Amarth and all the others from the days.",Death Stranding,https://www.youtube.com/watch?v=Gu8X7vM3Avw,Trailer
125,"Alright, then. Keep your secrets",Death Stranding,https://www.youtube.com/watch?v=Gu8X7vM3Avw,Trailer
126,1:52 - What a Snakes and Ladders game looks like in my head.,Death Stranding,https://www.youtube.com/watch?v=Gu8X7vM3Avw,Trailer
127,"Me: Ohh Game trailer. Let me check it out
Video: Starts playing crazy violin music with maddening visuals
Me: But YouTube you know I stopped LSD a long time ago...",Death Stranding,https://www.youtube.com/watch?v=Gu8X7vM3Avw,Trailer
128,6:49 why do I hear cayde 6 from destiny 2,Death Stranding,https://www.youtube.com/watch?v=Gu8X7vM3Avw,Trailer
129,"2:38
This taste... is the taste of someone who's lying, Giorno Giovanna!",Death Stranding,https://www.youtube.com/watch?v=Gu8X7vM3Avw,Trailer
130,"Can you at least, just once, tell us a tiny bit about the game?


Kojima: get off my lawn.",Death Stranding,https://www.youtube.com/watch?v=Gu8X7vM3Avw,Trailer
131,"remember that ps3 ad 10 years ago with that crying baby?

this is what that was leading up too!",Death Stranding,https://www.youtube.com/watch?v=Gu8X7vM3Avw,Trailer
132,Hahaha this is the most confusing game ever. Its like 5 different games pack into one game. 5 different genre lol,Death Stranding,https://www.youtube.com/watch?v=Gu8X7vM3Avw,Trailer
133,"I will love this game damnit, mostly because of me being sad about silent hills",Death Stranding,https://www.youtube.com/watch?v=Gu8X7vM3Avw,Trailer
134,Heard that Stephanie joosten(Quiet) is also participating here damn it quiet your too late!!! Boss ordered solid snake to kill venom snake our boss!!!,Death Stranding,https://www.youtube.com/watch?v=Gu8X7vM3Avw,Trailer
135,"Kojima:You can now use a portable ladder 

Me: videogames have gone a long way",Death Stranding,https://www.youtube.com/watch?v=Gu8X7vM3Avw,Trailer
136,"Interviewer: What's the game about?


Kojima:",Death Stranding,https://www.youtube.com/watch?v=Gu8X7vM3Avw,Trailer
137,Came back to this after watching the Briefing Trailer (12 September) to see if it made more sense.,Death Stranding,https://www.youtube.com/watch?v=Gu8X7vM3Avw,Trailer
138,8:08 the only thing that made sense to me xD,Death Stranding,https://www.youtube.com/watch?v=Gu8X7vM3Avw,Trailer
139,Hideo Kojima is like a mad scientist of storytelling.,Death Stranding,https://www.youtube.com/watch?v=Gu8X7vM3Avw,Trailer
140,"You can't make a game that have 10 genre 
Kojima : hold my sake",Death Stranding,https://www.youtube.com/watch?v=Gu8X7vM3Avw,Trailer
141,"I thought I was looking at assassin's creed, and walking dead for a sec",Death Stranding,https://www.youtube.com/watch?v=Gu8X7vM3Avw,Trailer
142,"Interviewer: Mr Kojima so what is this game about?

Kojima: You don't listen do you? bam",Death Stranding,https://www.youtube.com/watch?v=Gu8X7vM3Avw,Trailer
143,He looks like Dylan from the Walking Dead.,Death Stranding,https://www.youtube.com/watch?v=Gu8X7vM3Avw,Trailer
144,This game would be amazing with keanu reeves,Death Stranding,https://www.youtube.com/watch?v=Gu8X7vM3Avw,Trailer
145,Disclaimer: Not a single coherent thought was harmed in the making of this video.,Death Stranding,https://www.youtube.com/watch?v=Gu8X7vM3Avw,Trailer
146,"""Bridget, you're the president of ******"". Can't wait for this! Happy 4th",Death Stranding,https://www.youtube.com/watch?v=Gu8X7vM3Avw,Trailer
147,"EPIC MUSIC STARTS (HYPE)
Sees him walking. But.. in A EPIC WAY",Death Stranding,https://www.youtube.com/watch?v=Gu8X7vM3Avw,Trailer
148,1:00 I swear I dreamed something like that with the futuristic motorcycles and a storm but doing some tricks and fighting bad guys with guns.,Death Stranding,https://www.youtube.com/watch?v=Gu8X7vM3Avw,Trailer
149,"Nobody: Alright Kojima, how many crazy twists and turns should this game have? 

Kojima: Agreed.",Death Stranding,https://www.youtube.com/watch?v=Gu8X7vM3Avw,Trailer
150,"Sees five dudes in marine gear

“Bravo six, going dark”",Death Stranding,https://www.youtube.com/watch?v=Gu8X7vM3Avw,Trailer
151,I like the music and the going back in time thing is really awesome,Death Stranding,https://www.youtube.com/watch?v=Gu8X7vM3Avw,Trailer
152,"We're on easy street
And it feels so sweet
'Cause the world is 'bout a treat
When you're on easy street",Death Stranding,https://www.youtube.com/watch?v=Gu8X7vM3Avw,Trailer
153,Why are Gamespot trailer reuploads always downscaled to 1080p???,Death Stranding,https://www.youtube.com/watch?v=Gu8X7vM3Avw,Trailer
154,"Konami: We don't need you, Kojima-san, you won't make anything good anymor--
Kojima: Hold my fetus",Death Stranding,https://www.youtube.com/watch?v=Gu8X7vM3Avw,Trailer
155,Solid Wild Metal: Of the Breath Gear,Death Stranding,https://www.youtube.com/watch?v=Gu8X7vM3Avw,Trailer
156,"I just loved its trailer, and also waiting to install it on my PC. I already purchased a gaming chair as well solely for this gaming chair.",Death Stranding,https://www.youtube.com/watch?v=Gu8X7vM3Avw,Trailer
157,well that was a REALLY weird 8 minutes lmfao,Death Stranding,https://www.youtube.com/watch?v=Gu8X7vM3Avw,Trailer
158,"Oh my god, mads face is perfect ❤",Death Stranding,https://www.youtube.com/watch?v=Gu8X7vM3Avw,Trailer
159,"People What genre is this game?'
Kojima All of them.",Death Stranding,https://www.youtube.com/watch?v=Gu8X7vM3Avw,Trailer
160,3:17 yeah you show him! i'll just watch from right here,Death Stranding,https://www.youtube.com/watch?v=Gu8X7vM3Avw,Trailer
161,5:00 We can see a cross scar on Cliff's belly just like the one Sam had in the first trailer,Death Stranding,https://www.youtube.com/watch?v=Gu8X7vM3Avw,Trailer
