,comment,Gioco,URL,Video
1,"Next gen starts now with Spider-Man Miles Morales on Playstation 5
My COFFEE ☕: https://topofthemornincoffee.com/
Twitter 🐥: https://twitter.com/Jack_Septic_Eye",Spiderman Miles Morales,https://www.youtube.com/watch?v=U-1cn1yOKYc,Gameplay
2,btw this video got copyright claimed TWICE! So any ads you see on it were not added by me but the people claiming the video,Spiderman Miles Morales,https://www.youtube.com/watch?v=U-1cn1yOKYc,Gameplay
3,Smash like if you're excited for a brand new Spidey series on the chan!,Spiderman Miles Morales,https://www.youtube.com/watch?v=U-1cn1yOKYc,Gameplay
4,"Jack: ""DONT SMASH THE SIGHNS!!""

Also Jack: ""Smash the christmas tree!""",Spiderman Miles Morales,https://www.youtube.com/watch?v=U-1cn1yOKYc,Gameplay
5,"“I feel like Peter will handle rhino”

Rhino: beats Peter near death",Spiderman Miles Morales,https://www.youtube.com/watch?v=U-1cn1yOKYc,Gameplay
6,"Instead of Peter dying, he goes on vacation.
That's a lot better.",Spiderman Miles Morales,https://www.youtube.com/watch?v=U-1cn1yOKYc,Gameplay
7,"""I think I like him more then peter already""
Peter: *sad noises",Spiderman Miles Morales,https://www.youtube.com/watch?v=U-1cn1yOKYc,Gameplay
8,"Rhino: ""I... HATE... CHASE OF GOOSE!""
The Hjonkening. It is time.",Spiderman Miles Morales,https://www.youtube.com/watch?v=U-1cn1yOKYc,Gameplay
9,"I like how jacksepticeye says this is ""fun"" while throwing someone into the fire and flames",Spiderman Miles Morales,https://www.youtube.com/watch?v=U-1cn1yOKYc,Gameplay
10,"Jack: LOOK AT ALL THIS FOOD
Me, having a Hispanic mom: Yep, that’s how it is...",Spiderman Miles Morales,https://www.youtube.com/watch?v=U-1cn1yOKYc,Gameplay
11,"Conspiracy:
They changed peters face so people would lose the connection they made with him in the first one so miles can take that place in your heart, this might be wrong because for me both are great!",Spiderman Miles Morales,https://www.youtube.com/watch?v=U-1cn1yOKYc,Gameplay
12,"""So everything's like properly reflected now I think""
""Yeah it is, the Avengers tower""
""Avengers tower? Ok""
lmao",Spiderman Miles Morales,https://www.youtube.com/watch?v=U-1cn1yOKYc,Gameplay
13,"Jack: destroys every thing in sight and killing everyone.

Also Jack: P S 5 R A Y T R A C E I N G!",Spiderman Miles Morales,https://www.youtube.com/watch?v=U-1cn1yOKYc,Gameplay
14,"Sean: ""You think they'll add the glider in?""
Insomniac: ""write that down! Write that down!""",Spiderman Miles Morales,https://www.youtube.com/watch?v=U-1cn1yOKYc,Gameplay
15,POV: Your home wishing you had the new console,Spiderman Miles Morales,https://www.youtube.com/watch?v=U-1cn1yOKYc,Gameplay
16,"Jack: kicks man into fire probably burning him alive
Also jack: this is so fun!",Spiderman Miles Morales,https://www.youtube.com/watch?v=U-1cn1yOKYc,Gameplay
17,"Nobody:
Jack: ""I like his AdD dE dAs shoes""",Spiderman Miles Morales,https://www.youtube.com/watch?v=U-1cn1yOKYc,Gameplay
18,"When someone play a game for the first time:

Everyone: enjoys the story and studying steering",Spiderman Miles Morales,https://www.youtube.com/watch?v=U-1cn1yOKYc,Gameplay
19,"Jack: “And he has so much personality cuz he’s B-......

what were u gonna say jack ",Spiderman Miles Morales,https://www.youtube.com/watch?v=U-1cn1yOKYc,Gameplay
20,I love this game but I can’t shake that Peter looks like he’s 12,Spiderman Miles Morales,https://www.youtube.com/watch?v=U-1cn1yOKYc,Gameplay
21,"Jack: I've played the Ps4 game!
Not even a second later: Ow! Take it easy on me, it's my first day!",Spiderman Miles Morales,https://www.youtube.com/watch?v=U-1cn1yOKYc,Gameplay
22,"Anything with miles: *exists*
Jack: peter's not gonna DIE is he?",Spiderman Miles Morales,https://www.youtube.com/watch?v=U-1cn1yOKYc,Gameplay
23,"Jack: "" they're straight up dead"" 
Mr. Obvious: ""Congrats you're in the group""",Spiderman Miles Morales,https://www.youtube.com/watch?v=U-1cn1yOKYc,Gameplay
24,"anyone notice when Miles first called himself Spider-Man, His name showed up as Spider-Man",Spiderman Miles Morales,https://www.youtube.com/watch?v=U-1cn1yOKYc,Gameplay
25,suggested title change: 'Sean gushes over well-arranged pixels for an hour and nine minutes',Spiderman Miles Morales,https://www.youtube.com/watch?v=U-1cn1yOKYc,Gameplay
26,"I’m sad, I Finished all the story, got all the suits and did all the side missions in one day. I wish that I distributed this amazing game into my week",Spiderman Miles Morales,https://www.youtube.com/watch?v=U-1cn1yOKYc,Gameplay
27,"I like the old face better honestly... Just glad they didn't kill peter! That suit itself... uhm hahaha
oh fin works for that dude!!! the bad guy! for sure!",Spiderman Miles Morales,https://www.youtube.com/watch?v=U-1cn1yOKYc,Gameplay
28,"Me the entire time:

But the COCONUT MILK",Spiderman Miles Morales,https://www.youtube.com/watch?v=U-1cn1yOKYc,Gameplay
29,"The first Peter looks like Andrew Garfield, the 2nd looks like Tom Holland.",Spiderman Miles Morales,https://www.youtube.com/watch?v=U-1cn1yOKYc,Gameplay
30,"""This new face is weird""
Lol I thought he liked Tom Holland or something cause this face is inspired by his face lol",Spiderman Miles Morales,https://www.youtube.com/watch?v=U-1cn1yOKYc,Gameplay
31,"I love how he knew he is getting copyrighted but he doesn't care just so we can have a good experience.
respect",Spiderman Miles Morales,https://www.youtube.com/watch?v=U-1cn1yOKYc,Gameplay
32,"“If I was a villain I would want to be called uh THE KILLER”
-Jacsepticeye 2020",Spiderman Miles Morales,https://www.youtube.com/watch?v=U-1cn1yOKYc,Gameplay
33,"""does being spiderman regulate your body temperature?"" Nah bro but living in New York long enough does",Spiderman Miles Morales,https://www.youtube.com/watch?v=U-1cn1yOKYc,Gameplay
34,"Random Criminal: ""This was never about you""
Spider-Man: ""Umm... have you been here for the last 60 years?""",Spiderman Miles Morales,https://www.youtube.com/watch?v=U-1cn1yOKYc,Gameplay
35,"Notification: A robbery is in progress

Séan: climbs to the top of the Avengers tower while listening to a podcast. “Let’s slow down a bit”",Spiderman Miles Morales,https://www.youtube.com/watch?v=U-1cn1yOKYc,Gameplay
36,"""hey dude i can kill you with a single punch"" had me absolutely dying",Spiderman Miles Morales,https://www.youtube.com/watch?v=U-1cn1yOKYc,Gameplay
37,"peter: tries really hard to keep his identity secret 
also peter whenever miles does something while in costume: MILES!",Spiderman Miles Morales,https://www.youtube.com/watch?v=U-1cn1yOKYc,Gameplay
38,Jack : oh the avenger's tower,Spiderman Miles Morales,https://www.youtube.com/watch?v=U-1cn1yOKYc,Gameplay
39,I just want everyone to know my name is actually Miles and I’m half Puerto Rican and half black. This was meant for me.,Spiderman Miles Morales,https://www.youtube.com/watch?v=U-1cn1yOKYc,Gameplay
40,"I was thinking about the coconut milk.  I was like ""GET THE COCONUT MILK JACK!"" The whole timeeee. Thank god for Ganke.",Spiderman Miles Morales,https://www.youtube.com/watch?v=U-1cn1yOKYc,Gameplay
41,"""Web Yank"" is such a weird duo of words to say together that I just know that someday someone (most likely me) is gonna stutter and accidentally call it a ""Yeb Wank""",Spiderman Miles Morales,https://www.youtube.com/watch?v=U-1cn1yOKYc,Gameplay
42,"""The Tinkerer? That's a stupid name.""

The Riddler: sad noises",Spiderman Miles Morales,https://www.youtube.com/watch?v=U-1cn1yOKYc,Gameplay
43,"Jack: ""o Avengers tower""
Jack agin: ""Avengers tower!?""",Spiderman Miles Morales,https://www.youtube.com/watch?v=U-1cn1yOKYc,Gameplay
44,WHAT EVER HAPPENED TO “TOP OF THE MORNIN TO YA LADDIES!”???!!😭,Spiderman Miles Morales,https://www.youtube.com/watch?v=U-1cn1yOKYc,Gameplay
45,Seeing Miles unlocking his venom powers was legit one of the coolest things in marvel history.,Spiderman Miles Morales,https://www.youtube.com/watch?v=U-1cn1yOKYc,Gameplay
46,It would have been hilarious if at the beginning when miles said “how does Pete do this secret identity thing?” He had forgot to hang up the phone 🤣,Spiderman Miles Morales,https://www.youtube.com/watch?v=U-1cn1yOKYc,Gameplay
47,"""oh yea avengers tower""
takes a second look:
""wait, avengers tower""",Spiderman Miles Morales,https://www.youtube.com/watch?v=U-1cn1yOKYc,Gameplay
48,"Jack: they’re just straight up dead
Guards: no casualties 
Jack: 😑",Spiderman Miles Morales,https://www.youtube.com/watch?v=U-1cn1yOKYc,Gameplay
49,He's accent sounds like Niall Horan's. I love it,Spiderman Miles Morales,https://www.youtube.com/watch?v=U-1cn1yOKYc,Gameplay
50,"""I drew Spiderman when I was younger....I wasn't actually Spiderman."" That's what they all say.",Spiderman Miles Morales,https://www.youtube.com/watch?v=U-1cn1yOKYc,Gameplay
51,A game that finally captured every girls winter clothes: leggings an boots,Spiderman Miles Morales,https://www.youtube.com/watch?v=U-1cn1yOKYc,Gameplay
52,“This is fun!” He says while kicking a dude into fire,Spiderman Miles Morales,https://www.youtube.com/watch?v=U-1cn1yOKYc,Gameplay
53,"""Let's see if we can go do a crime before we head home"" 

You're the hero jack lol",Spiderman Miles Morales,https://www.youtube.com/watch?v=U-1cn1yOKYc,Gameplay
54,"Hahahahaha
""Miles!""
""What?""
""You awake?""",Spiderman Miles Morales,https://www.youtube.com/watch?v=U-1cn1yOKYc,Gameplay
55,"I wasnt a fan of the early iterations of Miles Morales, but they really did a lot in this game to make him relatable and likeable.  Maybe ill have to check out some of the more recent stories.",Spiderman Miles Morales,https://www.youtube.com/watch?v=U-1cn1yOKYc,Gameplay
56,"Miles talking about important parts of the story.

Jack: RaTrAcInG",Spiderman Miles Morales,https://www.youtube.com/watch?v=U-1cn1yOKYc,Gameplay
57,It's a game where you can still get fun web-slinging around the city when you're done the story mode. 🙂,Spiderman Miles Morales,https://www.youtube.com/watch?v=U-1cn1yOKYc,Gameplay
58,I actually really like Pete’s face now. I feel like it really suits him.,Spiderman Miles Morales,https://www.youtube.com/watch?v=U-1cn1yOKYc,Gameplay
59,"love series like this Jack, keep it up, wouldn't mind if you did more games like these :) ... maybe even the Avengers game next? Just a suggestion, but yeah.",Spiderman Miles Morales,https://www.youtube.com/watch?v=U-1cn1yOKYc,Gameplay
60,"Everyone else: Gushing over graphics and ray tracing
Me: trying to interpret what rio is saying because I’m learning spanish",Spiderman Miles Morales,https://www.youtube.com/watch?v=U-1cn1yOKYc,Gameplay
61,"""oh look the avengers tower. Avengers tower?!""",Spiderman Miles Morales,https://www.youtube.com/watch?v=U-1cn1yOKYc,Gameplay
62,"Peter: “protect this city with your life”
Pedestrian: “You’re shorter than I thought.”
Jack: “Hey man, I can kill you with one punch”",Spiderman Miles Morales,https://www.youtube.com/watch?v=U-1cn1yOKYc,Gameplay
63,"“Let’s get down to the ground level to look around”

body slams himself into the sidewalk",Spiderman Miles Morales,https://www.youtube.com/watch?v=U-1cn1yOKYc,Gameplay
64,"Krieger is about energy, I'm just waiting for Electro to get loose now.",Spiderman Miles Morales,https://www.youtube.com/watch?v=U-1cn1yOKYc,Gameplay
65,"“Lets increase our ability to get it”

H U H ? 😃",Spiderman Miles Morales,https://www.youtube.com/watch?v=U-1cn1yOKYc,Gameplay
66,Jack: yeah it is the avengers tower. The Avengers Tower?!?!,Spiderman Miles Morales,https://www.youtube.com/watch?v=U-1cn1yOKYc,Gameplay
67,"Miles : ""Peter Never Loses""
Jack : ""oh god he's gonna die""",Spiderman Miles Morales,https://www.youtube.com/watch?v=U-1cn1yOKYc,Gameplay
68,Dude that venom punch looks like the lightning sword style from Demon Slayer except its : fighting styles,Spiderman Miles Morales,https://www.youtube.com/watch?v=U-1cn1yOKYc,Gameplay
69,"Jack: He sounds like troy baker mixed with Jeff Goldblum 

Me who looked it up: That is troy baker",Spiderman Miles Morales,https://www.youtube.com/watch?v=U-1cn1yOKYc,Gameplay
70,Why does the new Peter kinda look like Tom Holland is that jus me or what,Spiderman Miles Morales,https://www.youtube.com/watch?v=U-1cn1yOKYc,Gameplay
71,"They should have kept pete's old face, this one looks like an uncanny Tom Holland",Spiderman Miles Morales,https://www.youtube.com/watch?v=U-1cn1yOKYc,Gameplay
72,"Jack: press the like button LIKE A BOSS
Literally all of his viewers: he said it! He said the thing!",Spiderman Miles Morales,https://www.youtube.com/watch?v=U-1cn1yOKYc,Gameplay
73,"Instead of Sean fan-girling over lighting, he’s fan-girling about animations haha",Spiderman Miles Morales,https://www.youtube.com/watch?v=U-1cn1yOKYc,Gameplay
74,Seeing a Spiderman just swinging around the city like that makes me want to be a Spiderman. It looks so fucking amazing and fun.,Spiderman Miles Morales,https://www.youtube.com/watch?v=U-1cn1yOKYc,Gameplay
75,"27:48 - ""His swinging is a lot more fluid...it's a lot more solid""

Next up, his swinging is a lot more gaseous",Spiderman Miles Morales,https://www.youtube.com/watch?v=U-1cn1yOKYc,Gameplay
76,"""I hate chase of goose!"" he said that in the last game in the stealth mission for the antibiotics",Spiderman Miles Morales,https://www.youtube.com/watch?v=U-1cn1yOKYc,Gameplay
77,"""Do you have ANY non destructive hobbies?!!!"" ""Fly fishing on the Volga!!"" Best line in the game, love the banter there.",Spiderman Miles Morales,https://www.youtube.com/watch?v=U-1cn1yOKYc,Gameplay
78,I like it how mile’s mother forgets about him being gone while my Mexican mother threatens me with “la una chankla”  and internal damnation if I’m late.,Spiderman Miles Morales,https://www.youtube.com/watch?v=U-1cn1yOKYc,Gameplay
79,"Jack: flushes toilet

Jack: NEXT GEN GAMEPLAY",Spiderman Miles Morales,https://www.youtube.com/watch?v=U-1cn1yOKYc,Gameplay
80,"When Peter started struggling against rhino like he was gonna die, I just had Vietnam flashbacks to last of us part 2",Spiderman Miles Morales,https://www.youtube.com/watch?v=U-1cn1yOKYc,Gameplay
81,"Game: introduces nuform energy
Jack five seconds later: whats powering their tech?",Spiderman Miles Morales,https://www.youtube.com/watch?v=U-1cn1yOKYc,Gameplay
82,"Jack: “Mom’s cooking Pizzarolls and I gotta be home!”

Me: “Priorities are a must.”",Spiderman Miles Morales,https://www.youtube.com/watch?v=U-1cn1yOKYc,Gameplay
83,"Jack: ""Should i head home, or should i stop crime?""

Miles:""I gotta head home! Christmas dinner sounds pretty good right about now!""",Spiderman Miles Morales,https://www.youtube.com/watch?v=U-1cn1yOKYc,Gameplay
84,Jack: oh that’s so fun get punched through a wall that hurt,Spiderman Miles Morales,https://www.youtube.com/watch?v=U-1cn1yOKYc,Gameplay
85,"""he actually feels like a teenager"" -sean 2020",Spiderman Miles Morales,https://www.youtube.com/watch?v=U-1cn1yOKYc,Gameplay
86,The tinkerer is that guy from the first tom holland spiderman movie that makes the alien drones and guns,Spiderman Miles Morales,https://www.youtube.com/watch?v=U-1cn1yOKYc,Gameplay
87,"""I drew allot of spiderman when I was younger. I wasnt ACTUALLY spiderman.""

... I don't buy it",Spiderman Miles Morales,https://www.youtube.com/watch?v=U-1cn1yOKYc,Gameplay
88,i know he did not get this game a day before it actually came out....,Spiderman Miles Morales,https://www.youtube.com/watch?v=U-1cn1yOKYc,Gameplay
89,"Here's one of the 
""Jacksepticeye shot challenge""
We're you have to take a shot of alcohol whenever jack amazed over the graphics, lighting, details, or more",Spiderman Miles Morales,https://www.youtube.com/watch?v=U-1cn1yOKYc,Gameplay
90,Why does Jack's camera look a little off??,Spiderman Miles Morales,https://www.youtube.com/watch?v=U-1cn1yOKYc,Gameplay
91,He didn't get the thing his mon told him to get lol,Spiderman Miles Morales,https://www.youtube.com/watch?v=U-1cn1yOKYc,Gameplay
92,Damn this looks so good,Spiderman Miles Morales,https://www.youtube.com/watch?v=U-1cn1yOKYc,Gameplay
93,"Sean: ""oh this is definitely gunna get copyrighted""
Me: (knowing he can't hear me) ""it's okay just scream the entire time""",Spiderman Miles Morales,https://www.youtube.com/watch?v=U-1cn1yOKYc,Gameplay
94,"AHHHH it seems like literally, EVERY side character is a villian!",Spiderman Miles Morales,https://www.youtube.com/watch?v=U-1cn1yOKYc,Gameplay
95,everything looks so insane but pete’s new face looks younger than miles,Spiderman Miles Morales,https://www.youtube.com/watch?v=U-1cn1yOKYc,Gameplay
96,"This Peter looks more like Tom Holland but also not, I don't know how to feel.",Spiderman Miles Morales,https://www.youtube.com/watch?v=U-1cn1yOKYc,Gameplay
97,I like how Jack's not even realizing he's going the wrong way when he talks about the game,Spiderman Miles Morales,https://www.youtube.com/watch?v=U-1cn1yOKYc,Gameplay
98,"1:03:42 Petition for this to be the new ""Could you pay me in advance""",Spiderman Miles Morales,https://www.youtube.com/watch?v=U-1cn1yOKYc,Gameplay
99,"Have to say, Hispanic mom cooking pasteles for the Christmas dinner is quite accurate. It ain’t a Christmas dinner for my dad without it.",Spiderman Miles Morales,https://www.youtube.com/watch?v=U-1cn1yOKYc,Gameplay
100,Moanin’ is a fantastic album. Kinda sad Jack showed no reaction.,Spiderman Miles Morales,https://www.youtube.com/watch?v=U-1cn1yOKYc,Gameplay
101,"He should have just said “it’s a date, a play date”",Spiderman Miles Morales,https://www.youtube.com/watch?v=U-1cn1yOKYc,Gameplay
102,Woooooow those graphics though,Spiderman Miles Morales,https://www.youtube.com/watch?v=U-1cn1yOKYc,Gameplay
103,"""This game is just a snip it of what to come next""

Proceeds to make multiple episodes",Spiderman Miles Morales,https://www.youtube.com/watch?v=U-1cn1yOKYc,Gameplay
104,"51:25 
Jack: oh your webs shouldn't have worked there, that's not how physics work but im fine with it.. your still cool Miles.",Spiderman Miles Morales,https://www.youtube.com/watch?v=U-1cn1yOKYc,Gameplay
105,Awww man watching this make me sad because of Miles dad,Spiderman Miles Morales,https://www.youtube.com/watch?v=U-1cn1yOKYc,Gameplay
106,"Old Peter looks like Andrew Garfield, New Peter looks like Tom Holland and to a lesser extent Tobey Maguire.",Spiderman Miles Morales,https://www.youtube.com/watch?v=U-1cn1yOKYc,Gameplay
107,We just not gonna talk about how miles had AirPods in his ears on the subway then put on headphones over them after he got up the stairs?,Spiderman Miles Morales,https://www.youtube.com/watch?v=U-1cn1yOKYc,Gameplay
108,I love how they added the Tom Holland character into the set,Spiderman Miles Morales,https://www.youtube.com/watch?v=U-1cn1yOKYc,Gameplay
109,when I got a notification for a part 3 I was like “WHAT THE ACTUAL FU-“ and “THERE IS SUCH THING AS A PART 2????”,Spiderman Miles Morales,https://www.youtube.com/watch?v=U-1cn1yOKYc,Gameplay
110,"I can't believe spider man really said ""ya'll trying to catch these hands"" lmfao I'm dead",Spiderman Miles Morales,https://www.youtube.com/watch?v=U-1cn1yOKYc,Gameplay
111,"Sean: Avengers tower wasn't in the last game was it?
Playstation: has a trophy for going to the top of Avengers tower.",Spiderman Miles Morales,https://www.youtube.com/watch?v=U-1cn1yOKYc,Gameplay
112,"""Hope this musics not copyright but i dont wanna turn it off its part of the experience"" 
Gets copyright striked two times",Spiderman Miles Morales,https://www.youtube.com/watch?v=U-1cn1yOKYc,Gameplay
113,i love how jack is gushing over what the mom made for dinner like it’s real life lmao,Spiderman Miles Morales,https://www.youtube.com/watch?v=U-1cn1yOKYc,Gameplay
114,"Killer: I’m gonna kill you

Jack: Wait... look at this reflection",Spiderman Miles Morales,https://www.youtube.com/watch?v=U-1cn1yOKYc,Gameplay
115,"The game and you, Jack, are amazing. Only thing is that the game volume is a bit low. Otherwise love it.",Spiderman Miles Morales,https://www.youtube.com/watch?v=U-1cn1yOKYc,Gameplay
116,"Ganke: “... we’ll be trending by midnight” 
Jack: “It’s not that easy, Ganke”
After 4 hours this video is #1 on trending for gaming",Spiderman Miles Morales,https://www.youtube.com/watch?v=U-1cn1yOKYc,Gameplay
117,"Me: nice graphics.
Jack: you can see there reflections in the puddles 😃",Spiderman Miles Morales,https://www.youtube.com/watch?v=U-1cn1yOKYc,Gameplay
118,25:00 Peter should’ve said that “With great power comes great responsibility.”,Spiderman Miles Morales,https://www.youtube.com/watch?v=U-1cn1yOKYc,Gameplay
119,miles in this game handles more like himself than Peter did in the other one,Spiderman Miles Morales,https://www.youtube.com/watch?v=U-1cn1yOKYc,Gameplay
120,"“Hey, dude. I can kill you with a single punch”
The reason I’m glad Sean doesn’t have spider powers",Spiderman Miles Morales,https://www.youtube.com/watch?v=U-1cn1yOKYc,Gameplay
121,Fun fact: the Tinkerer was in Spider-Man: Homecoming. He was the one making all of Vulture’s gear and weapons,Spiderman Miles Morales,https://www.youtube.com/watch?v=U-1cn1yOKYc,Gameplay
122,"Ayyy the record that Jack chose is called Esta Navidad by Willie Colón, a well known Puerto Rican musician! :DD we used to play that during our holiday parties! Cool!",Spiderman Miles Morales,https://www.youtube.com/watch?v=U-1cn1yOKYc,Gameplay
123,Am I the only one that was so confused when he was talking about the fish and stuff,Spiderman Miles Morales,https://www.youtube.com/watch?v=U-1cn1yOKYc,Gameplay
124,28:11 Jack: Let's get down to the ground level: proceeds to land on a man and says nothing,Spiderman Miles Morales,https://www.youtube.com/watch?v=U-1cn1yOKYc,Gameplay
125,Our king didn’t expect miles to take down that plane with  a single web,Spiderman Miles Morales,https://www.youtube.com/watch?v=U-1cn1yOKYc,Gameplay
126,"Jack: plays as spiderman

Also Jack: “I wanna VaNdLe ThInGs!¡!”",Spiderman Miles Morales,https://www.youtube.com/watch?v=U-1cn1yOKYc,Gameplay
127,The way sean kept on gushing on graphics took me back to the good ol' uncharted 4 days,Spiderman Miles Morales,https://www.youtube.com/watch?v=U-1cn1yOKYc,Gameplay
128,"2:52 So I started singing along and did a whole verse of just ""uh-oh""s and then when the vocals came in again, I started cracking up.",Spiderman Miles Morales,https://www.youtube.com/watch?v=U-1cn1yOKYc,Gameplay
129,So one's Spider-Man and the other's Jake Peralta man. Neat.,Spiderman Miles Morales,https://www.youtube.com/watch?v=U-1cn1yOKYc,Gameplay
130,"""Thats cool we actualy get to see him now, UUUUUWUUUU!"" Lol",Spiderman Miles Morales,https://www.youtube.com/watch?v=U-1cn1yOKYc,Gameplay
131,"Rhino: “I HATE CHASE OF GOOSE”

Rhino was probably that one kid in goose game where you stole his glasses and made him buy his own toy again, now he hates geese and lives a life of crime. Think about it.",Spiderman Miles Morales,https://www.youtube.com/watch?v=U-1cn1yOKYc,Gameplay
132,"28:13 
causally just crushed a dude by landing on him with alot of momentum
""Excuse me, spider man coming through.""",Spiderman Miles Morales,https://www.youtube.com/watch?v=U-1cn1yOKYc,Gameplay
133,"Miles: leaps of building 
Me: you forgot your present",Spiderman Miles Morales,https://www.youtube.com/watch?v=U-1cn1yOKYc,Gameplay
134,Hilarious how the high quality mode has to be an inferior frame rate.,Spiderman Miles Morales,https://www.youtube.com/watch?v=U-1cn1yOKYc,Gameplay
135,"Spider Man: killing people is bad
Miles: Yeets the dude into fire (10:24)",Spiderman Miles Morales,https://www.youtube.com/watch?v=U-1cn1yOKYc,Gameplay
136,"Small touch: “La Nochebuena” is a very Latino thing of celebrating the night of Christmas Eve, instead of the Christmas Day itself. I love that they actually seem to have done the effort to be accurate to Miles’s heritage",Spiderman Miles Morales,https://www.youtube.com/watch?v=U-1cn1yOKYc,Gameplay
137,"Me: What the hell is Raytracing?
Jack: Explains it
Me: Oh.",Spiderman Miles Morales,https://www.youtube.com/watch?v=U-1cn1yOKYc,Gameplay
138,Wait if I'm right prowler the villian is miles's uncle right?,Spiderman Miles Morales,https://www.youtube.com/watch?v=U-1cn1yOKYc,Gameplay
139,28:12 jack casually lands on a dude from a whole buildings hight and says nothing,Spiderman Miles Morales,https://www.youtube.com/watch?v=U-1cn1yOKYc,Gameplay
140,28:20 Jack LANDED on a man and he still alive what a champ,Spiderman Miles Morales,https://www.youtube.com/watch?v=U-1cn1yOKYc,Gameplay
141,"*miles running up the sides of buildings*

Seán: oh my God, the ray tracing is incredible. You can see all the reflections",Spiderman Miles Morales,https://www.youtube.com/watch?v=U-1cn1yOKYc,Gameplay
142,"This didn’t feel like an hour long video, but it was, and I watched it all.",Spiderman Miles Morales,https://www.youtube.com/watch?v=U-1cn1yOKYc,Gameplay
143,"51:28 dude, you've been literally flying THROUGH trees",Spiderman Miles Morales,https://www.youtube.com/watch?v=U-1cn1yOKYc,Gameplay
144,Why does miles sound just like Sid The Science Kid,Spiderman Miles Morales,https://www.youtube.com/watch?v=U-1cn1yOKYc,Gameplay
145,"""He feels so much bouncier and wilder..."" Ummm ok Jack...

5:53",Spiderman Miles Morales,https://www.youtube.com/watch?v=U-1cn1yOKYc,Gameplay
146,"Jack: ""this guy is evil""
Also Jack: ""I'll kill you in one punch""",Spiderman Miles Morales,https://www.youtube.com/watch?v=U-1cn1yOKYc,Gameplay
147,"28:52 
Some random pedestrian on the street: Huh, you're a lot shorter than I thought 

Jack: … ",Spiderman Miles Morales,https://www.youtube.com/watch?v=U-1cn1yOKYc,Gameplay
148,Peter is Bryan Dechart meets Tom Holland in this game,Spiderman Miles Morales,https://www.youtube.com/watch?v=U-1cn1yOKYc,Gameplay
