,comment,Gioco,URL,Video
1092,They kept the stupid hoedown scene but left this out :(,The Last of Us 2,https://www.youtube.com/watch?v=qPNiIeKMHyg,Trailer
1093,It hurts much more after the release,The Last of Us 2,https://www.youtube.com/watch?v=qPNiIeKMHyg,Trailer
1094,When does this take place and does this actually happen in the game?,The Last of Us 2,https://www.youtube.com/watch?v=qPNiIeKMHyg,Trailer
1095,joel here coming walking through the valley of death????????????,The Last of Us 2,https://www.youtube.com/watch?v=qPNiIeKMHyg,Trailer
1096,this didn't age well.....,The Last of Us 2,https://www.youtube.com/watch?v=qPNiIeKMHyg,Trailer
1097,I guess she’s imagining Joel in this? 🧐,The Last of Us 2,https://www.youtube.com/watch?v=qPNiIeKMHyg,Trailer
1098,Damn when this game coming out?,The Last of Us 2,https://www.youtube.com/watch?v=qPNiIeKMHyg,Trailer
1099,Best game ever 💪no doubt 👌,The Last of Us 2,https://www.youtube.com/watch?v=qPNiIeKMHyg,Trailer
1100,"Why not give Joel the logan treatment, let him have a heroic sacrifice and satisfying end",The Last of Us 2,https://www.youtube.com/watch?v=qPNiIeKMHyg,Trailer
1101,Imagine if one of the random stormtroopers that died on the Death Star  has a daughter that finds Luke years later and smashes his head in with a  golf club. Then the rest of the movie is about her trying to track down  Leia to kill her and her friends. That’s basically the plot of lous 2,The Last of Us 2,https://www.youtube.com/watch?v=qPNiIeKMHyg,Trailer
1102,This trailers better than the whole story,The Last of Us 2,https://www.youtube.com/watch?v=qPNiIeKMHyg,Trailer
1103,Was that Joel's ghost or something?,The Last of Us 2,https://www.youtube.com/watch?v=qPNiIeKMHyg,Trailer
1104,TLOU 3: Joel won the gulag,The Last of Us 2,https://www.youtube.com/watch?v=qPNiIeKMHyg,Trailer
1105,"Everyone capable of esoteric thought and artistic metaphor: oh wow, in hindsight this trailer is actually perfect
Everyone else: Lmao naughty dog lied! Neil Cuckmann! They laughed at us part 2 hurhurhurhur worst game ever!",The Last of Us 2,https://www.youtube.com/watch?v=qPNiIeKMHyg,Trailer
1106,"I mean, it has good gameplay and its pretty. I guess.",The Last of Us 2,https://www.youtube.com/watch?v=qPNiIeKMHyg,Trailer
1107,"miro esto en el 2020 para imaginar que last of us 2 si fue excelente, no bueno, porque  es bueno,pero quiero imaginar que fue excelente",The Last of Us 2,https://www.youtube.com/watch?v=qPNiIeKMHyg,Trailer
1108,Anyone here after this wasn’t in the game,The Last of Us 2,https://www.youtube.com/watch?v=qPNiIeKMHyg,Trailer
1109,"Just wish that naughty dog would acknowledge the mistake they made and make it different, it can all just have been a bad dream. This trailer was way better than the whole story... Not did she not complete her revenge, but she lost her comfortable life, her girlfriend, her family, her revenge, killed hundreds of people, two fingers and the skill to play a guitar... Such a dark and sad ending 💔",The Last of Us 2,https://www.youtube.com/watch?v=qPNiIeKMHyg,Trailer
1110,People who say this game is good are the same ones who clap when an airplane lands,The Last of Us 2,https://www.youtube.com/watch?v=qPNiIeKMHyg,Trailer
1111,"The last of us, may live!",The Last of Us 2,https://www.youtube.com/watch?v=qPNiIeKMHyg,Trailer
1112,"nice  content
btw joel teachs elly",The Last of Us 2,https://www.youtube.com/watch?v=qPNiIeKMHyg,Trailer
1113,"God, this did NOT age well.",The Last of Us 2,https://www.youtube.com/watch?v=qPNiIeKMHyg,Trailer
1114,Expectations: Subverted,The Last of Us 2,https://www.youtube.com/watch?v=qPNiIeKMHyg,Trailer
1115,This aged like milk,The Last of Us 2,https://www.youtube.com/watch?v=qPNiIeKMHyg,Trailer
1116,I still love this trailer,The Last of Us 2,https://www.youtube.com/watch?v=qPNiIeKMHyg,Trailer
1117,Joel’s been dead since 2016 😨,The Last of Us 2,https://www.youtube.com/watch?v=qPNiIeKMHyg,Trailer
1118,Why was this never in the game,The Last of Us 2,https://www.youtube.com/watch?v=qPNiIeKMHyg,Trailer
1119,and we are now gravely disappointed,The Last of Us 2,https://www.youtube.com/watch?v=qPNiIeKMHyg,Trailer
1120,Don't make promises you can't keep kiddo.,The Last of Us 2,https://www.youtube.com/watch?v=qPNiIeKMHyg,Trailer
1121,3:21 Abby's still alive...,The Last of Us 2,https://www.youtube.com/watch?v=qPNiIeKMHyg,Trailer
1122,Maybe this is her imagination,The Last of Us 2,https://www.youtube.com/watch?v=qPNiIeKMHyg,Trailer
1123,I'm about to cry,The Last of Us 2,https://www.youtube.com/watch?v=qPNiIeKMHyg,Trailer
1124,But now Joel is death :(,The Last of Us 2,https://www.youtube.com/watch?v=qPNiIeKMHyg,Trailer
1125,Mega geiles Spiel! Die Story ist einfach Wahnsinn! War schön lange nicht mehr so gefesselt von einem Spiel wie bei the last of us part 2!,The Last of Us 2,https://www.youtube.com/watch?v=qPNiIeKMHyg,Trailer
1126,Why hasn't this game released yet?,The Last of Us 2,https://www.youtube.com/watch?v=qPNiIeKMHyg,Trailer
1127,"Please fire Neil, find Amy Hennig back, and let her remake The last of us 2.",The Last of Us 2,https://www.youtube.com/watch?v=qPNiIeKMHyg,Trailer
1128,"""We kinda forgot they where the main characters"" Neil Druckman",The Last of Us 2,https://www.youtube.com/watch?v=qPNiIeKMHyg,Trailer
1129,Straight up liars.,The Last of Us 2,https://www.youtube.com/watch?v=qPNiIeKMHyg,Trailer
1130,"Feel like this is going to be bioshock burial at sea style, with Joel just a fragment of imagination like Elizabeth imagined booker",The Last of Us 2,https://www.youtube.com/watch?v=qPNiIeKMHyg,Trailer
1131,Ellie: I'm gonna kill every single one of them...except the one that really matters.,The Last of Us 2,https://www.youtube.com/watch?v=qPNiIeKMHyg,Trailer
1132,JOEL DESERVED BETTER !!!!,The Last of Us 2,https://www.youtube.com/watch?v=qPNiIeKMHyg,Trailer
1133,Just going to pretend this was an abandoned project. I'd rather have nothing than the part 2 we got.,The Last of Us 2,https://www.youtube.com/watch?v=qPNiIeKMHyg,Trailer
1134,I haven’t even got a PS4 and I’m still hyped af for this game lmao,The Last of Us 2,https://www.youtube.com/watch?v=qPNiIeKMHyg,Trailer
1135,Who's back here after realizing this wasnt in the game.,The Last of Us 2,https://www.youtube.com/watch?v=qPNiIeKMHyg,Trailer
1136,"I  N E E D  T H I S  G A M E  T O  H U R R Y  U P  A N D  C O M E  O U T. 

this is my favourite game ever and I just have such an emotional connection to this",The Last of Us 2,https://www.youtube.com/watch?v=qPNiIeKMHyg,Trailer
1137,If only we knew how bad it was gonna be,The Last of Us 2,https://www.youtube.com/watch?v=qPNiIeKMHyg,Trailer
1138,"""Joel can you sing""
Joel:""No""
Ellie:""please please please!😢""
Joel:""i said no""",The Last of Us 2,https://www.youtube.com/watch?v=qPNiIeKMHyg,Trailer
1139,this trailer does not really make sense now...,The Last of Us 2,https://www.youtube.com/watch?v=qPNiIeKMHyg,Trailer
1140,"I think Ellie got bit on the neck, but because she’s immune, it doesn’t matter. Cool detail.",The Last of Us 2,https://www.youtube.com/watch?v=qPNiIeKMHyg,Trailer
1141,3 years later,The Last of Us 2,https://www.youtube.com/watch?v=qPNiIeKMHyg,Trailer
1142,Almost reminds me of the time I beat Glenn to death! Only golf clubs are involved now! Teehee,The Last of Us 2,https://www.youtube.com/watch?v=qPNiIeKMHyg,Trailer
1143,I want to know where the f is this part in the game,The Last of Us 2,https://www.youtube.com/watch?v=qPNiIeKMHyg,Trailer
1144,"""But I can't walk on the path of the right because I'm wrong"" summary of the last of 2",The Last of Us 2,https://www.youtube.com/watch?v=qPNiIeKMHyg,Trailer
1145,aged like milk,The Last of Us 2,https://www.youtube.com/watch?v=qPNiIeKMHyg,Trailer
1146,"I personally didn't know much about the Last of Us franchise, except that the first game was apparently near legendary, but the drama with the leakage around a story of the sequel is fascinating to follow) 🙃🙂",The Last of Us 2,https://www.youtube.com/watch?v=qPNiIeKMHyg,Trailer
1147,I’d like to take a moment of silence...,The Last of Us 2,https://www.youtube.com/watch?v=qPNiIeKMHyg,Trailer
1148,"I’m happy that I saw the leaks, I’d be so disappointed if I bought the game.",The Last of Us 2,https://www.youtube.com/watch?v=qPNiIeKMHyg,Trailer
1149,"6 years waiting and trash story , good job Neil Druckman",The Last of Us 2,https://www.youtube.com/watch?v=qPNiIeKMHyg,Trailer
1150,honestly the trailer is better than the game itself. had such wasted potential,The Last of Us 2,https://www.youtube.com/watch?v=qPNiIeKMHyg,Trailer
1151,I was waiting for this scene in actual game... SAD.,The Last of Us 2,https://www.youtube.com/watch?v=qPNiIeKMHyg,Trailer
1152,I have a HUGE feeling that ellie is talking about the fireflies when she said that she was gonna kill each and every last one of them,The Last of Us 2,https://www.youtube.com/watch?v=qPNiIeKMHyg,Trailer
1153,Best Game,The Last of Us 2,https://www.youtube.com/watch?v=qPNiIeKMHyg,Trailer
1154,Damn this came out 2 years ago,The Last of Us 2,https://www.youtube.com/watch?v=qPNiIeKMHyg,Trailer
1155,Ye time to replay part one I guess,The Last of Us 2,https://www.youtube.com/watch?v=qPNiIeKMHyg,Trailer
1156,I hope she learnt to swim too!!,The Last of Us 2,https://www.youtube.com/watch?v=qPNiIeKMHyg,Trailer
1157,They tricked us,The Last of Us 2,https://www.youtube.com/watch?v=qPNiIeKMHyg,Trailer
1158,This... this is the best thing that showed up on my notifications. Ever.,The Last of Us 2,https://www.youtube.com/watch?v=qPNiIeKMHyg,Trailer
1159,Hugh Jackman and kaitdever,The Last of Us 2,https://www.youtube.com/watch?v=qPNiIeKMHyg,Trailer
1160,What could have been...,The Last of Us 2,https://www.youtube.com/watch?v=qPNiIeKMHyg,Trailer
1161,"Roses are red
Violets are blue",The Last of Us 2,https://www.youtube.com/watch?v=qPNiIeKMHyg,Trailer
1162,Now i hate bodybuilder and golf,The Last of Us 2,https://www.youtube.com/watch?v=qPNiIeKMHyg,Trailer
1163,this didn't age well aint it?,The Last of Us 2,https://www.youtube.com/watch?v=qPNiIeKMHyg,Trailer
1164,Watching this now is so painful...😢,The Last of Us 2,https://www.youtube.com/watch?v=qPNiIeKMHyg,Trailer
1165,So I guess Last of Us can be added to the graveyard of franchises that were killed because of bad storytelling and pushing political agenda.,The Last of Us 2,https://www.youtube.com/watch?v=qPNiIeKMHyg,Trailer
1166,He really gonna get murked with a golf club tho... That's embarrassing 🤣🤣🤣🤣,The Last of Us 2,https://www.youtube.com/watch?v=qPNiIeKMHyg,Trailer
1167,"Señores y señoras, en este momento Xbox murió",The Last of Us 2,https://www.youtube.com/watch?v=qPNiIeKMHyg,Trailer
1168,RÍP JOE ☹️ ☹️,The Last of Us 2,https://www.youtube.com/watch?v=qPNiIeKMHyg,Trailer
1169,"why is nobody talking about THE QUALITY
1:37",The Last of Us 2,https://www.youtube.com/watch?v=qPNiIeKMHyg,Trailer
1170,Pretty much looks like the reason she's gonna go kill all the fire flies is because they came after Joel and killed him and now Ellie is coming after all of them.,The Last of Us 2,https://www.youtube.com/watch?v=qPNiIeKMHyg,Trailer
1171,This is like playing with Arthur then dying then playing with Micah,The Last of Us 2,https://www.youtube.com/watch?v=qPNiIeKMHyg,Trailer
1172,this game was never released,The Last of Us 2,https://www.youtube.com/watch?v=qPNiIeKMHyg,Trailer
1173,These trailers will be better than the actual game,The Last of Us 2,https://www.youtube.com/watch?v=qPNiIeKMHyg,Trailer
1174,Naughty Dogs had never realized how much we loved Joel....,The Last of Us 2,https://www.youtube.com/watch?v=qPNiIeKMHyg,Trailer
1175,THIS SCENE WAS NOT IN THE GAME!!!!,The Last of Us 2,https://www.youtube.com/watch?v=qPNiIeKMHyg,Trailer
1176,"She-Hulk is the daughter of the surgeon Joel killed from the first game.  She-Hulk hunts down and kills Joel.  Jesse, the Asian guy from the trailer, gets Nan-king'd by the Westboro Baptist Church 2.0.  Ellie kills a bunch of people in She-Hulk's group.  You take control of She-Hulk and she kills Ellie in the final fight.  Enjoy.
tl;dr Joel and Ellie get killed by She-Hulk.  The end.",The Last of Us 2,https://www.youtube.com/watch?v=qPNiIeKMHyg,Trailer
1177,"Went to go see the comments on the other trailer, but they turned them off 🤣",The Last of Us 2,https://www.youtube.com/watch?v=qPNiIeKMHyg,Trailer
1178,Why? Just why!?,The Last of Us 2,https://www.youtube.com/watch?v=qPNiIeKMHyg,Trailer
1179,"My friend and I are convinced that this Joel is a figment of Ellie's imagination and that the real Joel is already dead.

Why would Joel calmly stroll through a house filled with corpses, find Ellie playing the guitar, and casually ask, ""What are you doing, kiddo?"" Furthermore, why would he then immediately follow up, ""You really going to go through with this?"" Seems more like Ellie talking to herself than a conversation with Joel",The Last of Us 2,https://www.youtube.com/watch?v=qPNiIeKMHyg,Trailer
1180,Anyone else notice that Ellie has the same hairstyle as Tess did?,The Last of Us 2,https://www.youtube.com/watch?v=qPNiIeKMHyg,Trailer
1181,I help you fast. Never buy this game.,The Last of Us 2,https://www.youtube.com/watch?v=qPNiIeKMHyg,Trailer
1182,"How did She get the Tattoos? Is there anyone in an apocalypse sayin ""damn, gurl, Got THE idea for ur Concepts!"" ?!",The Last of Us 2,https://www.youtube.com/watch?v=qPNiIeKMHyg,Trailer
1183,We were lied to.,The Last of Us 2,https://www.youtube.com/watch?v=qPNiIeKMHyg,Trailer
1184,I have a feeling Naughty Dog won't release... The Last of Us (part 2) Until late 2018/early 2019.,The Last of Us 2,https://www.youtube.com/watch?v=qPNiIeKMHyg,Trailer
1185,SMH 🤦🏽‍♂️,The Last of Us 2,https://www.youtube.com/watch?v=qPNiIeKMHyg,Trailer
1186,It's been too long.,The Last of Us 2,https://www.youtube.com/watch?v=qPNiIeKMHyg,Trailer
1187,Me watching this trailer to see how much it relates to the actual game 😂,The Last of Us 2,https://www.youtube.com/watch?v=qPNiIeKMHyg,Trailer
1188,"This game has such an intense story! And I am truly sorry for people who are not capable of feeling empathy or who are not open-minded enough to play until the end. If they stop and rage at the smallest ""this is not the way I want it to be!"" then maybe go play Barbie. If you don't care for story, go play Call of Duty. 
But if you really want to get dragged into this emotional rollercoaster, feel for the characters and think about what's motivating them, how deep the rabbit hole goes... Then this is a perfect game. Yes, your favourite characters might die. Old ones, new ones - at any second! And you will be sad and maybe angry about it - and that's a good thing! How many games make you sad and cry? Make you stop and think? There are very few (big titles) out there capable of that.",The Last of Us 2,https://www.youtube.com/watch?v=qPNiIeKMHyg,Trailer
1189,"cycle of revenge helps no one, leaves no soul untouched. the ugly truth of life is that some burdens of the soul have no solution",The Last of Us 2,https://www.youtube.com/watch?v=qPNiIeKMHyg,Trailer
1190,can someone help me,The Last of Us 2,https://www.youtube.com/watch?v=qPNiIeKMHyg,Trailer
1191,Maybe she is hallucinating and is Telling joel who is only in her mind that she will kill anyone that had to do Something with the death of joel... man that would hit right in my feelings,The Last of Us 2,https://www.youtube.com/watch?v=qPNiIeKMHyg,Trailer
1192,El mejor juego del año,The Last of Us 2,https://www.youtube.com/watch?v=qPNiIeKMHyg,Trailer
1193,Reality is often disappointing...,The Last of Us 2,https://www.youtube.com/watch?v=qPNiIeKMHyg,Trailer
1194,2019 baby,The Last of Us 2,https://www.youtube.com/watch?v=qPNiIeKMHyg,Trailer
1195,"Just finished the game, watching this trailer frustrates me. The storyline was horrible.",The Last of Us 2,https://www.youtube.com/watch?v=qPNiIeKMHyg,Trailer
1196,I know how old this is now but I literally learnt how to play that song on my guitar cuz I’m a huge fan of this,The Last of Us 2,https://www.youtube.com/watch?v=qPNiIeKMHyg,Trailer
1197,Shawn james is the greatest,The Last of Us 2,https://www.youtube.com/watch?v=qPNiIeKMHyg,Trailer
1198,what could have been...biggest letdown in video game history.  took everything that made the first game great and destroyed it. joel dies almost immediately and goes out like a punk. ellie is just moody and downright unlikable for most of the game. and guess what? a revenge story without revenge. what the hell were they thinking...,The Last of Us 2,https://www.youtube.com/watch?v=qPNiIeKMHyg,Trailer
1199,So this was a freakin lie 😒,The Last of Us 2,https://www.youtube.com/watch?v=qPNiIeKMHyg,Trailer
1200,"""This game sucks.""

~Arthur Morgan",The Last of Us 2,https://www.youtube.com/watch?v=qPNiIeKMHyg,Trailer
1201,"It's funny that when this trailer initially released, a lot of speculation is that Ellie was getting revenge for Joel's death. It sounded ludicrous because why would they kill off one of the best characters in gaming, especially at the beginning of their game. Surely, Ellie would be getting revenge for something else and Joel would be accompanying her, right?? Well here we are now lol",The Last of Us 2,https://www.youtube.com/watch?v=qPNiIeKMHyg,Trailer
1202,"She goes from this to “nahh nevermind, just go” like bruh.. the hype this trailer brought was let down",The Last of Us 2,https://www.youtube.com/watch?v=qPNiIeKMHyg,Trailer
1203,"""Revenge is a fools game""

- Arthur Morgan",The Last of Us 2,https://www.youtube.com/watch?v=qPNiIeKMHyg,Trailer
1204,"What if this is the beginning of Tlou 3... Ellie went looking for Dina and found out those people/""a new group"" killed her (Or maybe another character like Tom and Maria,could even be the whole community in Jackson),leaving Ellie fully alone,with her now imagining seeing Joel in places,guiding her,but still being completely lost and revengefull,showing us how everithing happened in Tlou 2 still affects her,she'll be so mad after losing everithing,that this trailer could make a lot sense,but we'll make her words come true,""i'm gonna find and i'm gonna kill every last one of them"",from there ""The last of us"",this meaning that maybe this is one of the last of the big communities,or the last at this point in the US,(just maybe),the only certain thing is that Ellie will leave nothing but a path of blood and death,making her way through everything,to an uncertain end,and so giving the song she sings a meaning too.This could give the triology (in my opinion) an amazing closure,now that could make this story rise again...",The Last of Us 2,https://www.youtube.com/watch?v=qPNiIeKMHyg,Trailer
1205,i lowkey wish we got this scene in the game at first i thought ellie was gonna go down a mental kinda trip where she would see and talk to joel even though he’s not really there,The Last of Us 2,https://www.youtube.com/watch?v=qPNiIeKMHyg,Trailer
1206,"I went back here to relive my blissful theorizing of how awesome and fulfilling this game's story is gonna be.

 Yeah... I'm just gonna stay here forever.",The Last of Us 2,https://www.youtube.com/watch?v=qPNiIeKMHyg,Trailer
1207,The fact people say this trailer lies or tells a different story clearly forget about all the theories when this trailer came out that Joel is dead and an illusion 🤦‍♂️,The Last of Us 2,https://www.youtube.com/watch?v=qPNiIeKMHyg,Trailer
1208,"Hopefully there is a part 3, and joe keeps coming back as an illusion.",The Last of Us 2,https://www.youtube.com/watch?v=qPNiIeKMHyg,Trailer
1209,"""I'm going to find and kill every last one of them, but not the person that actually kill you, that one can live"" -Ellie",The Last of Us 2,https://www.youtube.com/watch?v=qPNiIeKMHyg,Trailer
1210,"Just my thought on this trailer, I already watched the whole walkthrough and now know what this scene means 
Ellie said that she would kill every last one of them to joel even though he's not there so joel must be a ghost already that still haunts ellie to this day.",The Last of Us 2,https://www.youtube.com/watch?v=qPNiIeKMHyg,Trailer
1211,"If only this was the game..... Just Ellie and Joel killing stuff. Hell, if that was the whole plot it would be a million times better than what we got",The Last of Us 2,https://www.youtube.com/watch?v=qPNiIeKMHyg,Trailer
1212,I feel like this coulda been a cut scene from a version of The game that Ellie kept seeing a dead Joe talk to her while shes on her journey,The Last of Us 2,https://www.youtube.com/watch?v=qPNiIeKMHyg,Trailer
1213,"I would have loved for this to be in the game, I love this song and the mood of this",The Last of Us 2,https://www.youtube.com/watch?v=qPNiIeKMHyg,Trailer
1214,"It's Just a vision. This scene maybe takes place during the travel to seattle 
If you read ellie's journal she wrote she has visions and she sees him in her dreams.",The Last of Us 2,https://www.youtube.com/watch?v=qPNiIeKMHyg,Trailer
1215,Who’s here after understanding what that “I’m gonna kill every last one of them” was for?,The Last of Us 2,https://www.youtube.com/watch?v=qPNiIeKMHyg,Trailer
1216,"DAMN, I remember how excited I was first time seeing this!🙌🏽 Waited 7 years just to be sucker punched in the gut, not even 2 hours into the game!🙄😒",The Last of Us 2,https://www.youtube.com/watch?v=qPNiIeKMHyg,Trailer
1217,"""you were the chosen one! It was said you'd destroy depression not join it! Bring balance to 2020 not leave it in darkness!""",The Last of Us 2,https://www.youtube.com/watch?v=qPNiIeKMHyg,Trailer
1218,"After having played the end of the game I am almosg crying now

Spoiler ahead:",The Last of Us 2,https://www.youtube.com/watch?v=qPNiIeKMHyg,Trailer
1219,Im just gonna say it........,The Last of Us 2,https://www.youtube.com/watch?v=qPNiIeKMHyg,Trailer
1220,This might seem a bit crazy but hear me out : The firefly symbol is not really on point since they don’t exist anymore but it stands for the group that went after Joel. Joel right here is just her imagination asking her if she’s really gonna go on this dark path of redemption and she is full of hatred obviously losing her mind being on an absolute murder spree. This is the psycho Ellie that takes over in part 2 and the only thing reminding her of Joel is the guitar. This whole story was planned from the beginning..,The Last of Us 2,https://www.youtube.com/watch?v=qPNiIeKMHyg,Trailer
1221,Am I the only who teared up when Ellie sings if i were to lose u in the campaign,The Last of Us 2,https://www.youtube.com/watch?v=qPNiIeKMHyg,Trailer
1222,"I am suprised that so many people claim that ""this does not happen in the actual game"" or even call it ""false advertisment"". Joel entering from the light, the lyrics of the song, Ellie's words at the end... it is all there, you just have to open your eyes, ears and most importantly minds.",The Last of Us 2,https://www.youtube.com/watch?v=qPNiIeKMHyg,Trailer
1223,The saddest part of this is that this scene isn't even in the game.,The Last of Us 2,https://www.youtube.com/watch?v=qPNiIeKMHyg,Trailer
1224,Joel death made me feel so sad that it felt like I lost a loved one,The Last of Us 2,https://www.youtube.com/watch?v=qPNiIeKMHyg,Trailer
1225,"Regardless of how terrible and disappointing the game is, we'll always have these trailers, to watch and rewatch, and imagine what could have been. :')",The Last of Us 2,https://www.youtube.com/watch?v=qPNiIeKMHyg,Trailer
1226,I have a strange sensation for telling everyone smile.....and Feel Her Love !,The Last of Us 2,https://www.youtube.com/watch?v=qPNiIeKMHyg,Trailer
1227,"Ellie in The trailer:""I'm gonna find and i'm gonna kill every last one them""

Ellie in the game: B  R   U   H",The Last of Us 2,https://www.youtube.com/watch?v=qPNiIeKMHyg,Trailer
1228,Loved the first game and the second one after watching this again I’ve come to the conclusion that it was worth the wait,The Last of Us 2,https://www.youtube.com/watch?v=qPNiIeKMHyg,Trailer
1229,The problem about the game many people came for Ellie and Joel no one cared about the other characters but by killing him off so early it loses its appeal,The Last of Us 2,https://www.youtube.com/watch?v=qPNiIeKMHyg,Trailer
1230,Ellie: Im gonna find and kill every one of them ,The Last of Us 2,https://www.youtube.com/watch?v=qPNiIeKMHyg,Trailer
1231,"I remember when this first came out and everyone was hyped. You couldn't go two seconds on the internet without seeing breakdowns and theories. Man, I miss those times. Now, we got this absolute shit of a game to love with.",The Last of Us 2,https://www.youtube.com/watch?v=qPNiIeKMHyg,Trailer
1232,You know something is wrong when you don’t sympathize with who you are supposed to sympathize,The Last of Us 2,https://www.youtube.com/watch?v=qPNiIeKMHyg,Trailer
1233,"""Keep your expectations low and you will never be disappointed."" - Kratos",The Last of Us 2,https://www.youtube.com/watch?v=qPNiIeKMHyg,Trailer
1234,I wish I could unsee the game so i can be as exited as I was when I first saw this.,The Last of Us 2,https://www.youtube.com/watch?v=qPNiIeKMHyg,Trailer
