,comment,Gioco,URL,Video
2,Finishing this game felt like losing a friend.,The Witcher 3,https://www.youtube.com/watch?v=XHrskkHf958,Trailer
3,"The only bad thing about this game is that it doesn't tell you what to do with your life after you beat the game %100
Best game ever
Edit: I made this comment and didn't check back. I was amazed when I saw I have 1.9k likes. Thank you :)",The Witcher 3,https://www.youtube.com/watch?v=XHrskkHf958,Trailer
4,This trailer feels so emotional when you watch it after beating the game...,The Witcher 3,https://www.youtube.com/watch?v=XHrskkHf958,Trailer
5,"Games like this make you think, you'll never find a better one.",The Witcher 3,https://www.youtube.com/watch?v=XHrskkHf958,Trailer
6,funny people ask for the song and no one says darude sandstorm. thats how epic this game is,The Witcher 3,https://www.youtube.com/watch?v=XHrskkHf958,Trailer
7,"I heard this song in The Walking Dead, waching this trailer back now is amazing!",The Witcher 3,https://www.youtube.com/watch?v=XHrskkHf958,Trailer
8,Anyone else get teary-eyed watching this after beating the game?,The Witcher 3,https://www.youtube.com/watch?v=XHrskkHf958,Trailer
9,"This game is kinda bittersweet

it's amazing and goes above and beyond in almost every aspect
but there won't be another like it for a log time",The Witcher 3,https://www.youtube.com/watch?v=XHrskkHf958,Trailer
10,Best game I have ever played...,The Witcher 3,https://www.youtube.com/watch?v=XHrskkHf958,Trailer
11,"I'm a Fallout fanboy, but even I admit, as great as I thought Fallout 4 was, it's nothing compared to this masterpiece.",The Witcher 3,https://www.youtube.com/watch?v=XHrskkHf958,Trailer
12,"4 f**king years after release and watching this still gives me goosebumps. Will you ever let me go, Geralt?",The Witcher 3,https://www.youtube.com/watch?v=XHrskkHf958,Trailer
13,"I just finished the game, hours and hours of gameplay. Clearing like 95% of the game. Now I'm depressed the story came to a close. 10/10 GOTY worhty.",The Witcher 3,https://www.youtube.com/watch?v=XHrskkHf958,Trailer
14,"I just finished my first playthrough of the Witcher 3 and I have to say, it reminded me of why I play video games in the first place. I was fearing that a shift in my life was happening, as i've gotten older my free time has become more sparse and i've been hesitant to give it up to video games because no matter how flashy the graphics or the initial entry point into the created worlds, The glamour and effect of a new game has begun to wear off on me more and more rapidly. When I was younger my brother and I had a couple of shared experiences of playing together cooperatively on games that would takes us a year or more to complete. Through the trials and tribulations we became extremely immersed in the worlds these games created and fully invested in the characters. Finally completing them was a fully emotional experience (this only happened for us with two games. very rare indeed.) For a young kid with a big wide imagination stepping into another realm and exploring and questing was a dream come true and one I committed to very seriously and connected to. As i've grown older, I've been anywhere from casual to avid gamer throughout the past couple of years and though I've become no less willing to chase titles and try new experiences, the novelty of most games wears thin quickly and I have found most experiences mildly disappointing. After semi-bland experience to semi-bland experience I started to think of video games as mild sedatives (short reprieves from the 'real world' used until one becomes bored.) I'd forgotten what a true gaming experience was like, and had begun to fear that perhaps my childhood naivety was what made the experiences magic and not the games themselves (and to a certain degree that is true.) However, the Witcher 3 reminded me of what I had forgotten. It reminded me of why I play video games in the first place. A video game can be art, vast and enthralling and expansive, immersive, witty, fluid, challenging, chilling, and heartbreaking. I dove into the Witcher 3 and not only was it so beautifully crafted and rendered in its' voice acting, combat system, environments, plot and intrigue, but IT TOOK TIME. I have been obsessively playing the game for about a month and a half, relishing every last detail. And when the time came to part ways I, quite unexpectedly, welled up with tears. I waited until the end of the credits to the inevitable switch back to Geralt, and took a long last stroll through the empty ruins of Kaer Morrhen, found a nice rock by a stream in the woods and took a last pan of the environment, watching a flock of birds cross the sky, deer nibble on grass beside the riverbed, and clouds enshroud the tips of far-off mountain peaks. I watched Geralt watch the scene, knowing that I will most likely put this game away for a good long while while I digest it and move forward with my life, and I just soaked in the detail for a good moment before clicking my system off. Unforgettable experience. I will cherish it.",The Witcher 3,https://www.youtube.com/watch?v=XHrskkHf958,Trailer
15,"When everyone says this game is a 10/10 deserver, IGN gives 9.3 when Everyone says MGSV was a 9/10 game Ign gives 10/10 -.-",The Witcher 3,https://www.youtube.com/watch?v=XHrskkHf958,Trailer
16,"I think this is the only game where I've gone back and found every quest, every side location, I would not stop until I'd ticket off every single question mark on that map. By far my favourite game of all time.",The Witcher 3,https://www.youtube.com/watch?v=XHrskkHf958,Trailer
17,Witcher 3 ruinned gaming cause itll be a long time before before a gma e as good as this releases and until then nothing will be any good,The Witcher 3,https://www.youtube.com/watch?v=XHrskkHf958,Trailer
18,"I've got over 100 hours in Morrowind, 200 hours in Oblivion and 500+ hours in Skyrim... finally decided to check out the Witcher series. 

Witcher 1:",The Witcher 3,https://www.youtube.com/watch?v=XHrskkHf958,Trailer
19,The chills tho...best game I've ever played.Would bang Yen again.,The Witcher 3,https://www.youtube.com/watch?v=XHrskkHf958,Trailer
20,This has gotta be the best trailer ever.,The Witcher 3,https://www.youtube.com/watch?v=XHrskkHf958,Trailer
21,"1 year, guys, 1 year since this Masterpiece was released and we are getting another major expac in 2 weeks.",The Witcher 3,https://www.youtube.com/watch?v=XHrskkHf958,Trailer
22,"grand game truly...if anybody is wondering about the background song its ""oats in the water"" by ben howard..",The Witcher 3,https://www.youtube.com/watch?v=XHrskkHf958,Trailer
23,Dear CDProjectRED! Thank you for this absolutely memorable and interesting game! You did well! Thank you!,The Witcher 3,https://www.youtube.com/watch?v=XHrskkHf958,Trailer
24,196 soldiers of the wild hunt disliked this,The Witcher 3,https://www.youtube.com/watch?v=XHrskkHf958,Trailer
25,"you can feel this trailer amazing, but when you finished this story, and gets all those memories back, it will make you manly cry... it's one of games, makes you wanna get amnesia, just to get through it once again. Kurwa Mać! so glad to be Polish at this moment",The Witcher 3,https://www.youtube.com/watch?v=XHrskkHf958,Trailer
26,They deleted this trailer from their official channel! Wtf!?,The Witcher 3,https://www.youtube.com/watch?v=XHrskkHf958,Trailer
27,"The ending of this trailer; taking you back to where it all began, riding down from hanged mans tree to the crossroads inn, just gives me chills everytime",The Witcher 3,https://www.youtube.com/watch?v=XHrskkHf958,Trailer
28,I wish it was May 18th 2015 again so I could experience this game for the first time again.,The Witcher 3,https://www.youtube.com/watch?v=XHrskkHf958,Trailer
29,"After 25 years of gaming, only 3 games have made me cry. OoT, FFVII and THIS. Gonna start my second play through soon. But I know that after finishing both dlcs, I'm going feel empty inside... again",The Witcher 3,https://www.youtube.com/watch?v=XHrskkHf958,Trailer
30,"Holy shit, I have never seen this trailer before. It slipped by me somehow, probably because I got the game a day early and was playing it. It is amazing how they convey the emotions and the story line without a single word spoken.",The Witcher 3,https://www.youtube.com/watch?v=XHrskkHf958,Trailer
31,I was not prepared for the feels.,The Witcher 3,https://www.youtube.com/watch?v=XHrskkHf958,Trailer
32,"This is honestly one of the prettiest games that I have ever played. The story, the characters, the environments and the soundtrack just draw you in completely. The only bad thing about it is that it ends. CD Projekt Red never fails to impress. And now, in 2020, I am confident that Cyberpunk will not disappoint.",The Witcher 3,https://www.youtube.com/watch?v=XHrskkHf958,Trailer
33,This is not launch trailer but farewell trailer,The Witcher 3,https://www.youtube.com/watch?v=XHrskkHf958,Trailer
34,so this year GOTY will go to Blood and Wine DLC right,The Witcher 3,https://www.youtube.com/watch?v=XHrskkHf958,Trailer
35,"Every other game has better looking trailer than game. Witcher 3 has better looking game than trailer, which is already great.",The Witcher 3,https://www.youtube.com/watch?v=XHrskkHf958,Trailer
36,1:57 - 2:02 Made me cry :-(,The Witcher 3,https://www.youtube.com/watch?v=XHrskkHf958,Trailer
37,"There's a reason this game won GOTY. I've been play video game since I was 4 years old back in 1989, nothing I have played holds a candle to the masterpiece that is the Witcher 3.",The Witcher 3,https://www.youtube.com/watch?v=XHrskkHf958,Trailer
38,The game was legendary ....,The Witcher 3,https://www.youtube.com/watch?v=XHrskkHf958,Trailer
39,Girls cry over Twilight. Real men cry over this trailer.,The Witcher 3,https://www.youtube.com/watch?v=XHrskkHf958,Trailer
40,"Damn this feels more like a sad tribute than a trailer, never seen this before.",The Witcher 3,https://www.youtube.com/watch?v=XHrskkHf958,Trailer
41,I  bought the game and I slept with it one night. yeah that's a ture story.,The Witcher 3,https://www.youtube.com/watch?v=XHrskkHf958,Trailer
42,This has gotta be the best trailer ever.,The Witcher 3,https://www.youtube.com/watch?v=XHrskkHf958,Trailer
43,Whose playing after they've watched the Witcher series?,The Witcher 3,https://www.youtube.com/watch?v=XHrskkHf958,Trailer
44,Who's here for 2019 baby!!!! A true hunt never ends!!!,The Witcher 3,https://www.youtube.com/watch?v=XHrskkHf958,Trailer
45,Who is here after watching the Witcher series from Netflix. This piece of music also most of the other scores in the game are simply amazing and better that the TV series but the series too does a decent job in bringing the witcher lore to TV format.,The Witcher 3,https://www.youtube.com/watch?v=XHrskkHf958,Trailer
46,game of all time,The Witcher 3,https://www.youtube.com/watch?v=XHrskkHf958,Trailer
47,I want to delete my memory! So I can play it again! I feel empty.,The Witcher 3,https://www.youtube.com/watch?v=XHrskkHf958,Trailer
48,"Is it weird that it has been years now, yet i can still vividly recall nearly every quest and location? The game has stuck with me like no other game has or ever will i think.",The Witcher 3,https://www.youtube.com/watch?v=XHrskkHf958,Trailer
49,"This trailer is perfect to watch right after you finish your playthrough. It's like revisiting all the best moments, and seeing your friends. No other game made me care for characters like if they were real. This game is a definition of masterpiece.",The Witcher 3,https://www.youtube.com/watch?v=XHrskkHf958,Trailer
50,"Best story + best graphic = best game ever I played. Thank you CDP, I'm so proud that is Polish masterpiece :)",The Witcher 3,https://www.youtube.com/watch?v=XHrskkHf958,Trailer
51,Just finished Witcher 3.  It makes a strong case that video games can be considered as works of art.,The Witcher 3,https://www.youtube.com/watch?v=XHrskkHf958,Trailer
52,Still one of the most beautiful launch trailers ever.,The Witcher 3,https://www.youtube.com/watch?v=XHrskkHf958,Trailer
53,"Completing this game and both addons 100% took one year of my life

Worth it.",The Witcher 3,https://www.youtube.com/watch?v=XHrskkHf958,Trailer
54,One of the best trailers ever made to one of the best games ever made. Zelda Breath of the Wild is nothing compared to Witcher 3.,The Witcher 3,https://www.youtube.com/watch?v=XHrskkHf958,Trailer
55,"""I'll take the long way round"". Well, I certainly did cough Gwent cough",The Witcher 3,https://www.youtube.com/watch?v=XHrskkHf958,Trailer
56,"I'm stuck in the blood and wine dlc doing random shit, cant end it, I'm too afraid to end this game",The Witcher 3,https://www.youtube.com/watch?v=XHrskkHf958,Trailer
57,The Witcher 3 + Ben Howard = Best trailer ever :D,The Witcher 3,https://www.youtube.com/watch?v=XHrskkHf958,Trailer
58,A friend told me this game was outdated but his body looked pretty outdated when I hit it with my car,The Witcher 3,https://www.youtube.com/watch?v=XHrskkHf958,Trailer
59,I bought this game with complete edition recently and I can't stop playing this. I being playing almost 2 weeks.,The Witcher 3,https://www.youtube.com/watch?v=XHrskkHf958,Trailer
60,"Being CDrojectRed they must have tears in their eyes knowing that the comment section proves whole heartedly that their vision has fulfilled not only their creative approach but the players too.

Best experience I ever had in a video game",The Witcher 3,https://www.youtube.com/watch?v=XHrskkHf958,Trailer
61,this is my favourite the witcher trailer,The Witcher 3,https://www.youtube.com/watch?v=XHrskkHf958,Trailer
62,Proud to be from Poland because of this awesome game!,The Witcher 3,https://www.youtube.com/watch?v=XHrskkHf958,Trailer
63,"After 1 year, still the best game of all time",The Witcher 3,https://www.youtube.com/watch?v=XHrskkHf958,Trailer
64,"Fair well white wolf, we’ll never forget you 😢",The Witcher 3,https://www.youtube.com/watch?v=XHrskkHf958,Trailer
65,"Watching this and knowing every scene, all the back-stories to them all, how they all turned out (and not always for the best)... tears to the eyes. I love this game, and this trailer does it amazing justice. Epic song too.",The Witcher 3,https://www.youtube.com/watch?v=XHrskkHf958,Trailer
66,I am depressed because the game ended,The Witcher 3,https://www.youtube.com/watch?v=XHrskkHf958,Trailer
67,I keep coming back to this trailer because it combined two of my favorite things ever: Ben Howard and The Witcher 3. God I'm really gonna miss this game.,The Witcher 3,https://www.youtube.com/watch?v=XHrskkHf958,Trailer
68,Watching this makes me sad cause its finished but I'm also happy for all the amazing memories this game me. Agter playing this game I read the books then played the other 2 games then started this one again. This game will always have a place in my heart. Nothing can replace this,The Witcher 3,https://www.youtube.com/watch?v=XHrskkHf958,Trailer
69,Milion times better than Netflix adaptation of books 🤦‍♂️,The Witcher 3,https://www.youtube.com/watch?v=XHrskkHf958,Trailer
70,"For those who ask, this game has won GOTY everywhere in a year where Bloodborne, Metal Gear Solid V and Fallout 4 were released. Considering how much overhyped crap people buy before release date, it is at least worth buying the main game and support CD Projekt Red.",The Witcher 3,https://www.youtube.com/watch?v=XHrskkHf958,Trailer
71,"Watching this a year later, and it makes me so happy. One of my favorite games ever!",The Witcher 3,https://www.youtube.com/watch?v=XHrskkHf958,Trailer
72,This song would've fit perfectly with a RDR2 trailer but it fits so well in this trailer as well. One of the best game trailers.,The Witcher 3,https://www.youtube.com/watch?v=XHrskkHf958,Trailer
73,When the game has better graphics than the trailer🙌🙌,The Witcher 3,https://www.youtube.com/watch?v=XHrskkHf958,Trailer
74,before anyone asks Ben Howard - Oats in the Water,The Witcher 3,https://www.youtube.com/watch?v=XHrskkHf958,Trailer
75,"holy chills... the game still to this day gives me goosebumps, bittersweet game because none can compare to it!! thank you CDPR for this masterpiece!!! youve got a lifetime supporter out of this guy",The Witcher 3,https://www.youtube.com/watch?v=XHrskkHf958,Trailer
76,Cant believe its almost been 3 years. Top 3 games ive ever played. Maybe even the best one. I will miss you dearly.,The Witcher 3,https://www.youtube.com/watch?v=XHrskkHf958,Trailer
77,"If a game can be called ""LEGENDARY"" I can make sure THIS is the game that mark an entire generation and the more to come~ because once again ""The Witcher"" made, achieve the impossible within the gaming industry/world.",The Witcher 3,https://www.youtube.com/watch?v=XHrskkHf958,Trailer
78,If you watch this after finishing the game you're going to die inside,The Witcher 3,https://www.youtube.com/watch?v=XHrskkHf958,Trailer
79,Yeah struggled first time playing this. Took it back and after a couple off years I came back to it and it blown my mind amazing loved it. 10/10.,The Witcher 3,https://www.youtube.com/watch?v=XHrskkHf958,Trailer
80,This game has such a strong emotion you get so attached to the characters it's so sad looking back at it now. Best game I have ever played.,The Witcher 3,https://www.youtube.com/watch?v=XHrskkHf958,Trailer
81,"Best game trailer ever, for one of the best games I have ever played.  Win Win",The Witcher 3,https://www.youtube.com/watch?v=XHrskkHf958,Trailer
82,"Jumping on the band wagon late. I'm just looking for new PS4 games to play. 
Everyone's comments have sealed this decision for me.
I'm buying this game. :)",The Witcher 3,https://www.youtube.com/watch?v=XHrskkHf958,Trailer
83,Did anybody else get all warm and fuzzy inside watching this?The song fits perfectly in this trailer!!!!!!,The Witcher 3,https://www.youtube.com/watch?v=XHrskkHf958,Trailer
84,"Here I am! december 2019,  watching this, oh god wanna play it again.",The Witcher 3,https://www.youtube.com/watch?v=XHrskkHf958,Trailer
85,Man this song fits perfectly with the trailer,The Witcher 3,https://www.youtube.com/watch?v=XHrskkHf958,Trailer
86,"over four years later, and I still can't get over how perfect this trailer and this game are.",The Witcher 3,https://www.youtube.com/watch?v=XHrskkHf958,Trailer
87,"The game is a masterpiece of immersive storytelling.  When you start off in White Orchard and you help the Dwarf find the arsonist who burned his forge, you feel the tensions between the people of White Orchard and the Nilfgaardian Army.  They immediately hang the guy from the nearest tree without a trial.  They show through actions.",The Witcher 3,https://www.youtube.com/watch?v=XHrskkHf958,Trailer
88,"I remember waiting for this game.. every day when I came back from work I was checking time to release, like some maniac.. then finally got it. Maaan I can't describe this by words. I'm playing now for the 3rd time and try to do everything on 100%. It's fucking epic.",The Witcher 3,https://www.youtube.com/watch?v=XHrskkHf958,Trailer
89,Simply the most beautiful masterpiece in the whole world of games. Cant get better than this. Thank you!,The Witcher 3,https://www.youtube.com/watch?v=XHrskkHf958,Trailer
90,"I just watched this trailer after finishing the game and shit guys I just cried. All these feelings during this trailer. I recognize all the cutscenes and ofc what happened in them. This game is just a fuckin masterpiece. My mindset while I played this game was just astonishing the main story is awesome and the side quests too ! All this narration in this game just made the best game of 2015 and with Blood & Wine 2016 (B&W won the best RPG price of 2016, yes an expansion). Now I'll wait many years for cyberpunk and sorry for my bad english :D",The Witcher 3,https://www.youtube.com/watch?v=XHrskkHf958,Trailer
91,"I just got this on Xbox Game Pass last week. For some reason I never played it despite hearing how much of a masterpiece it is. Nothing could've prepared me for how good this game is and the only experience I can compare it too was when I played The Last of Us for the first time and it emotionally wrecked me. I beat the main quests in 4 days and in a week Ive played over 70 hours of it. The characters, the story, the world, the music. It's all brilliant. I actually find myself missing the characters and feel kind of empty now. I bought and played both DLCs which are the epitome of post launch content. As soon as the credits rolled I went to the xbox marketplace and paid full price to own the game, I felt dirty only playing it free through gamepass and not giving CD Project Red my money. Because holy shit do they ever deserve it. Might be the best game I've ever played. Somehow I'd never seen this trailer when the game came out too and my god does it hit the feels. They tell you the basic plot, get you emotionally invested, have a who's who of a bunch of the characters you'll meet, then hint at the intense climactic moments that are to come all with just visuals and the amazing Ben Howard song (which btw thank you to the marketing team at CD Project Red for choosing this song and getting me into him, his music is fantastic). This is a game to remember",The Witcher 3,https://www.youtube.com/watch?v=XHrskkHf958,Trailer
92,Shut up and take my money!,The Witcher 3,https://www.youtube.com/watch?v=XHrskkHf958,Trailer
93,0:12 Dat opening guitar sound tells the whole mood of this game....,The Witcher 3,https://www.youtube.com/watch?v=XHrskkHf958,Trailer
94,This game will go down in history as one of the best games ever if not THE best game ever.,The Witcher 3,https://www.youtube.com/watch?v=XHrskkHf958,Trailer
95,This trailer reminds me of Hershel,The Witcher 3,https://www.youtube.com/watch?v=XHrskkHf958,Trailer
96,"September 3rd, 2019 and still playing. 💯",The Witcher 3,https://www.youtube.com/watch?v=XHrskkHf958,Trailer
97,"That moment when your thinking to replay the game for the third time...but knowing that your outside life wont exist for atleast a month,best game Ever :D",The Witcher 3,https://www.youtube.com/watch?v=XHrskkHf958,Trailer
98,Come to watch this after the show :o anyone?,The Witcher 3,https://www.youtube.com/watch?v=XHrskkHf958,Trailer
99,Happy 2 year anniversary of this trailer being released :),The Witcher 3,https://www.youtube.com/watch?v=XHrskkHf958,Trailer
100,"One of my absolute favorite games right now, had no problem playing it a second time, now its time for the expansions.",The Witcher 3,https://www.youtube.com/watch?v=XHrskkHf958,Trailer
101,"Such kind of masterpiece isn't gonna come for a very long time, that is why I am playing this game very slow, bit by bit. It has been around 5 months, and I am just at level 23 right now with 40% main quest completion. And now there are these two amazing DLCs left also.",The Witcher 3,https://www.youtube.com/watch?v=XHrskkHf958,Trailer
102,One of the absolute best games ever created. Cheers CDPR.,The Witcher 3,https://www.youtube.com/watch?v=XHrskkHf958,Trailer
103,i could watch this for years in a loop,The Witcher 3,https://www.youtube.com/watch?v=XHrskkHf958,Trailer
104,1:57 That moment in the game was one of the most emotionally impactful in gaming for me.,The Witcher 3,https://www.youtube.com/watch?v=XHrskkHf958,Trailer
105,Still the most magnificent trailer ever made.,The Witcher 3,https://www.youtube.com/watch?v=XHrskkHf958,Trailer
106,Witcher 3 was my first touch with the series. After completing it I bought the first two games plus the dlcs and now I'm reading the books. Strongly recommend to anyone who's interested. Can't wait to watch the netflix series. So much to do and so little time...,The Witcher 3,https://www.youtube.com/watch?v=XHrskkHf958,Trailer
107,this trailer deepens the depression after finishing this game,The Witcher 3,https://www.youtube.com/watch?v=XHrskkHf958,Trailer
108,"I think it's impressive how you look at this trailer, and then realize that the actual game itself is even better looking than the trailer for it is.",The Witcher 3,https://www.youtube.com/watch?v=XHrskkHf958,Trailer
109,"Best RPG by far, which has inturn ruined all other RPG's for me because they have to now be at that level.",The Witcher 3,https://www.youtube.com/watch?v=XHrskkHf958,Trailer
110,The weight of the story didn't actually hit me until towards the end with everything that happened there. This is easily one of the best games I've ever played.,The Witcher 3,https://www.youtube.com/watch?v=XHrskkHf958,Trailer
111,lol i got a witcher ad for a witcher video!,The Witcher 3,https://www.youtube.com/watch?v=XHrskkHf958,Trailer
112,Best trailer in history? and most true,The Witcher 3,https://www.youtube.com/watch?v=XHrskkHf958,Trailer
113,"This game killed me, like it's seriously overwhelming with regards to the story and the gameplay. 10/10",The Witcher 3,https://www.youtube.com/watch?v=XHrskkHf958,Trailer
114,"1:31 - 1:39
Geralt: CIRI PUT YOUR BLINDFOLD BACK ON! MOMMY AND DADDY ARE JUST HUGGING!",The Witcher 3,https://www.youtube.com/watch?v=XHrskkHf958,Trailer
115,All this trailer needed was more Lambert.,The Witcher 3,https://www.youtube.com/watch?v=XHrskkHf958,Trailer
116,"Honestly felt like I had a lump in my throat when I watched this, it’s that powerful",The Witcher 3,https://www.youtube.com/watch?v=XHrskkHf958,Trailer
117,"Dam, this is how trailers should be done, so emotional, and I haven't even played the game yet, I'm sold, but one question if anyone can help me, do i need to play the previous games to understand the story? I want to anyway but i can't seem to find em around anymore",The Witcher 3,https://www.youtube.com/watch?v=XHrskkHf958,Trailer
