,comment,Gioco,URL,Video
791,This looks like a different game,The Last of Us 2,https://www.youtube.com/watch?v=qPNiIeKMHyg,Trailer
792,RIP joel,The Last of Us 2,https://www.youtube.com/watch?v=qPNiIeKMHyg,Trailer
793,Was this part in the game? I dont own a playstation and I'm curious,The Last of Us 2,https://www.youtube.com/watch?v=qPNiIeKMHyg,Trailer
794,"I don't think yall realize how long it takes to develop a game and saying stuff like "" im still waiting "" isn't,, helping like be patient. It will come out and you'll glad it came out, for it's something worth the wait.",The Last of Us 2,https://www.youtube.com/watch?v=qPNiIeKMHyg,Trailer
795,El más intenso que es jugado,The Last of Us 2,https://www.youtube.com/watch?v=qPNiIeKMHyg,Trailer
796,"So, i must say something now.

I really, really love this game. The atmosphere is as good as the game before, but in the end, Part 1 was better. And i really want to tell why. Sorry, but i don't really know where i can do this, so i tell u my opinion right here, lol. I don't want to hate or hype anything. Also i want to tell u, how i wish, how the future of TLOU should look like. And i hope, any dev will see this, bc' i can barely say, i speak for the most. Warning, there are spoilers. So please, play the game first. Then read this.",The Last of Us 2,https://www.youtube.com/watch?v=qPNiIeKMHyg,Trailer
797,This scene isn't in the game?,The Last of Us 2,https://www.youtube.com/watch?v=qPNiIeKMHyg,Trailer
798,This was the story that was supposed to be. Joel isn't dead and they could of had a journey of redemption together. But no...we got something else instead.,The Last of Us 2,https://www.youtube.com/watch?v=qPNiIeKMHyg,Trailer
799,"""I'm going to kill every last one"" Ok Eren calm down",The Last of Us 2,https://www.youtube.com/watch?v=qPNiIeKMHyg,Trailer
800,"Could someone please tell me AT WHAT POINT IN THE GAME DID THIS SCENE HAPPEN? that’s young Joel from what I can tell and he wasn’t styling that look when she was older, wtf Naughty Dog?",The Last of Us 2,https://www.youtube.com/watch?v=qPNiIeKMHyg,Trailer
801,Revenge can blind and consume and by the time your eyes open you realized what you should have cherished more is now gone,The Last of Us 2,https://www.youtube.com/watch?v=qPNiIeKMHyg,Trailer
802,"Ellie: “I’m going to find and kill every last one of them”
Tommy: Actually..",The Last of Us 2,https://www.youtube.com/watch?v=qPNiIeKMHyg,Trailer
803,Ohhh what could have been....,The Last of Us 2,https://www.youtube.com/watch?v=qPNiIeKMHyg,Trailer
804,"Coronavirus: Becomes a pandemic

Me: Watches people neglect the severity of the disease, ultimately causing it to spread and, as a result, TLOU 2 gets pushed back because of it ",The Last of Us 2,https://www.youtube.com/watch?v=qPNiIeKMHyg,Trailer
805,Was this scene in the game?,The Last of Us 2,https://www.youtube.com/watch?v=qPNiIeKMHyg,Trailer
806,Yet this scene is nowhere to be found in the actual game as released. What we did get was a disjointed disaster of a story in comparison to the original. I believe the entire narrative was changed and that's why the game was delayed for so long. What a shame....,The Last of Us 2,https://www.youtube.com/watch?v=qPNiIeKMHyg,Trailer
807,"Aun digo que este juego tuvo el mejor final para una futura parte 3 en unos años, es lo que los pequeños ""adultos"" sensibles no entienden por que querian la venganza completada y un final feliz con unicornios y abrazos, juegen Mario Bros mejor",The Last of Us 2,https://www.youtube.com/watch?v=qPNiIeKMHyg,Trailer
808,❤️,The Last of Us 2,https://www.youtube.com/watch?v=qPNiIeKMHyg,Trailer
809,I’m just going to pretend like the second game never happened lol,The Last of Us 2,https://www.youtube.com/watch?v=qPNiIeKMHyg,Trailer
810,this is a lesbian moment,The Last of Us 2,https://www.youtube.com/watch?v=qPNiIeKMHyg,Trailer
811,i love this game and their unboxing.,The Last of Us 2,https://www.youtube.com/watch?v=qPNiIeKMHyg,Trailer
812,she’s so hot ..,The Last of Us 2,https://www.youtube.com/watch?v=qPNiIeKMHyg,Trailer
813,Nadine Ross vs Abby,The Last of Us 2,https://www.youtube.com/watch?v=qPNiIeKMHyg,Trailer
814,"If joel was a hallucination, he wouldnt have come through the door looking around, he would instead be just standing there infront of ellie. Tbh my theory is that tommy's town was attacked by the fireflies and looking at the new bite mark on ellies neck it seems that they were out of town since quite a while. Ellie says I will kill them all must be referring to the fireflies and I think she will come to know soon (if she hasnt yet) that she is the cure to the infection. It seems that they are in a village and joel just came in after checking out one of the houses and finding it clean explaining why his dress and gun is clean. I bet joel isnt dead, he cant be cuz he is joel.",The Last of Us 2,https://www.youtube.com/watch?v=qPNiIeKMHyg,Trailer
815,This actually looked like a good game,The Last of Us 2,https://www.youtube.com/watch?v=qPNiIeKMHyg,Trailer
816,press f for Joel 😔,The Last of Us 2,https://www.youtube.com/watch?v=qPNiIeKMHyg,Trailer
817,tlou2 is like an cod ghost and assassins unity or cod iw first we say its bad after a year we say it wasnt bad it was diffrent,The Last of Us 2,https://www.youtube.com/watch?v=qPNiIeKMHyg,Trailer
818,"I’ve never played the last of us but I know lots of the fans were disappointed with the game via reviews but I don’t really understand why, can anyone explain?",The Last of Us 2,https://www.youtube.com/watch?v=qPNiIeKMHyg,Trailer
819,"It is rumored that is suppose to release in October of this year,just what I read,plus let’s all think it’s a big game and just imagine all the builds and textures and graphics they have to work on, Last Of Us 1 was such a big game and long story so that’s just something to think about 👍🤔",The Last of Us 2,https://www.youtube.com/watch?v=qPNiIeKMHyg,Trailer
820,I didn't realised how wrong ellie was 2:30,The Last of Us 2,https://www.youtube.com/watch?v=qPNiIeKMHyg,Trailer
821,"3:17

Except for you didn't",The Last of Us 2,https://www.youtube.com/watch?v=qPNiIeKMHyg,Trailer
822,"Yeah, you're gonna kill every last one of them.",The Last of Us 2,https://www.youtube.com/watch?v=qPNiIeKMHyg,Trailer
823,Whats the name of the song?,The Last of Us 2,https://www.youtube.com/watch?v=qPNiIeKMHyg,Trailer
824,"Trailer Ellie: ""I'm gonna find and I'm gonna kill every last one of them""

Ellie at the end of the game: ""or am I gonna?""",The Last of Us 2,https://www.youtube.com/watch?v=qPNiIeKMHyg,Trailer
825,I can say the story of tlou 2 is masterpiece and shitty at the same time.,The Last of Us 2,https://www.youtube.com/watch?v=qPNiIeKMHyg,Trailer
826,"There is sth I never understood, if current gen can actually support such beautiful graphics then why is it like 3 games that have great graphics like that? Sure this is alot of work but it took developers all that time that current gen is almost obsolete to develop such great graphics? Meh",The Last of Us 2,https://www.youtube.com/watch?v=qPNiIeKMHyg,Trailer
827,"Let you be demned, ND. You stole too much from us. Too much, too early. The shadow of this gama may forewer be your nightmare.",The Last of Us 2,https://www.youtube.com/watch?v=qPNiIeKMHyg,Trailer
828,JD,The Last of Us 2,https://www.youtube.com/watch?v=qPNiIeKMHyg,Trailer
829,remember when we all watched it and thought its gonna be the best game ever existing? well look at us now,The Last of Us 2,https://www.youtube.com/watch?v=qPNiIeKMHyg,Trailer
830,the best,The Last of Us 2,https://www.youtube.com/watch?v=qPNiIeKMHyg,Trailer
831,"I have so much empathy for these people who don't reach the depth of the game, just because it was not the game they imagined during the last few years. They are completely missing the whole point of view by only focusing on their own hatred. Didn't think people could lack of so much sensitivity, humanity, the whole game is teaching lessons and it seems that lots of players are not good listeners. But in this goal, the choices they made, ND clearly highlighted the contrast between the virtue and the insensitivity of players, even if they knew that this could displease lots of their customers. ",The Last of Us 2,https://www.youtube.com/watch?v=qPNiIeKMHyg,Trailer
832,I played gold today. I got  Joel in one.,The Last of Us 2,https://www.youtube.com/watch?v=qPNiIeKMHyg,Trailer
833,1:18,The Last of Us 2,https://www.youtube.com/watch?v=qPNiIeKMHyg,Trailer
834,MY BABY'S ALL GROWN UP IM CRYING,The Last of Us 2,https://www.youtube.com/watch?v=qPNiIeKMHyg,Trailer
835,tlou2 is like an cod ghost and assassins unity or cod iw first we say its bad after a year we say it wasnt bad it was diffrent,The Last of Us 2,https://www.youtube.com/watch?v=qPNiIeKMHyg,Trailer
836,Looking back this is different than the circumstances but fits in the big picture. This is right before Ellie leave for Seattle. The man in this trailer is Tommy. He asked Ellie if she really wants to do this. The dead in the house is different than the final game. Maybe there was a fight in Jackson in the initial version.,The Last of Us 2,https://www.youtube.com/watch?v=qPNiIeKMHyg,Trailer
837,They didn't know...,The Last of Us 2,https://www.youtube.com/watch?v=qPNiIeKMHyg,Trailer
838,"This scene not being in the game was my biggest disappointment with it. I was so looking forward to where this was going to plug in. Was it before, was it after? Just kept waiting and waiting and... It never came.",The Last of Us 2,https://www.youtube.com/watch?v=qPNiIeKMHyg,Trailer
839,Finally! My dream came true! Ellie has grown up and can play the guitar!,The Last of Us 2,https://www.youtube.com/watch?v=qPNiIeKMHyg,Trailer
840,I find it weird how the trailer is better than the actual game,The Last of Us 2,https://www.youtube.com/watch?v=qPNiIeKMHyg,Trailer
841,I miss Joel,The Last of Us 2,https://www.youtube.com/watch?v=qPNiIeKMHyg,Trailer
842,Best game ever for me,The Last of Us 2,https://www.youtube.com/watch?v=qPNiIeKMHyg,Trailer
843,Sick they lied about to us,The Last of Us 2,https://www.youtube.com/watch?v=qPNiIeKMHyg,Trailer
844,"I always come back to visit this trailer, I wish I never saw the comments",The Last of Us 2,https://www.youtube.com/watch?v=qPNiIeKMHyg,Trailer
845,"huge absolute spoilers

what yall mad at? Abby forgave her life twice god dangit",The Last of Us 2,https://www.youtube.com/watch?v=qPNiIeKMHyg,Trailer
846,"Why wasn’t this part in the game 
I’ve beaten the game and this never came up",The Last of Us 2,https://www.youtube.com/watch?v=qPNiIeKMHyg,Trailer
847,"3:21 welp, that was a lie",The Last of Us 2,https://www.youtube.com/watch?v=qPNiIeKMHyg,Trailer
848,After 7 years .........,The Last of Us 2,https://www.youtube.com/watch?v=qPNiIeKMHyg,Trailer
849,"Well Ellie....you're gunna kill ""Every last NONE of them""",The Last of Us 2,https://www.youtube.com/watch?v=qPNiIeKMHyg,Trailer
850,"Ah, yes. When this game gave off incredible, chilling vibes....and then it turned into a dumpster fire.",The Last of Us 2,https://www.youtube.com/watch?v=qPNiIeKMHyg,Trailer
851,Can someone please explain why was the game Lauched years after trailer,The Last of Us 2,https://www.youtube.com/watch?v=qPNiIeKMHyg,Trailer
852,1:48 where even is that in game,The Last of Us 2,https://www.youtube.com/watch?v=qPNiIeKMHyg,Trailer
853,"What are you doing, kiddo?
...",The Last of Us 2,https://www.youtube.com/watch?v=qPNiIeKMHyg,Trailer
854,"Am I the only one who's kinda gonna miss Ellie being a little girl, I mean I assume she's still gonna be a teenager but idk, I like the idea of Joel having like his ""little"" girl back and obviously she has to grow up at some point but idk",The Last of Us 2,https://www.youtube.com/watch?v=qPNiIeKMHyg,Trailer
855,Turns out thats Tommy,The Last of Us 2,https://www.youtube.com/watch?v=qPNiIeKMHyg,Trailer
856,on this game everybody go for the head shot i do it all the time its so fun and if you do it too you will have fun too,The Last of Us 2,https://www.youtube.com/watch?v=qPNiIeKMHyg,Trailer
857,So this scene never came in the game.,The Last of Us 2,https://www.youtube.com/watch?v=qPNiIeKMHyg,Trailer
858,😍😍😍 wow,The Last of Us 2,https://www.youtube.com/watch?v=qPNiIeKMHyg,Trailer
859,"So basically, there's some flashbacks with Ellie and Joel, blah blah blah and then Joel and Tommy get captured. Ellie finds them right as Joel is getting his brains smashed in with a f*cking golf club by the MA'AM or whatever and then they get Ellie to camp and think about what to do with her.",The Last of Us 2,https://www.youtube.com/watch?v=qPNiIeKMHyg,Trailer
860,When will be this game  released?,The Last of Us 2,https://www.youtube.com/watch?v=qPNiIeKMHyg,Trailer
861,Give me tabs to pls))),The Last of Us 2,https://www.youtube.com/watch?v=qPNiIeKMHyg,Trailer
862,I feel so bad about this. Was hoping for a diferent thing. Im just sad about it. Its a great game but the story feels like a checklist to just make people feel angry and use it as a excuse. Wasted potential just to be edgy and different from other developers.,The Last of Us 2,https://www.youtube.com/watch?v=qPNiIeKMHyg,Trailer
863,what song is she playing?,The Last of Us 2,https://www.youtube.com/watch?v=qPNiIeKMHyg,Trailer
864,"This is the most moving trailer I have ever seen for any form of media, ever",The Last of Us 2,https://www.youtube.com/watch?v=qPNiIeKMHyg,Trailer
865,What song need the name of it pls,The Last of Us 2,https://www.youtube.com/watch?v=qPNiIeKMHyg,Trailer
866,I was so excited. and now...so disappointed,The Last of Us 2,https://www.youtube.com/watch?v=qPNiIeKMHyg,Trailer
867,😭💔,The Last of Us 2,https://www.youtube.com/watch?v=qPNiIeKMHyg,Trailer
868,Prepare for the biggest dissapointing game of the year boys,The Last of Us 2,https://www.youtube.com/watch?v=qPNiIeKMHyg,Trailer
869,I SCREACHED LIKE THEM CLICKERS WHEN I SAW THE TRAILER OMG,The Last of Us 2,https://www.youtube.com/watch?v=qPNiIeKMHyg,Trailer
870,"hmmm, that's a strange setting for a golf game",The Last of Us 2,https://www.youtube.com/watch?v=qPNiIeKMHyg,Trailer
871,They screwed us on this game,The Last of Us 2,https://www.youtube.com/watch?v=qPNiIeKMHyg,Trailer
872,allright now we know....,The Last of Us 2,https://www.youtube.com/watch?v=qPNiIeKMHyg,Trailer
873,wtf this was released in 2016???,The Last of Us 2,https://www.youtube.com/watch?v=qPNiIeKMHyg,Trailer
874,DAT GRAPHICS THOOO,The Last of Us 2,https://www.youtube.com/watch?v=qPNiIeKMHyg,Trailer
875,This trailer makes no sense now.,The Last of Us 2,https://www.youtube.com/watch?v=qPNiIeKMHyg,Trailer
876,the trailer is better then the game I couldn't even play the whole game it was so bad. But I love this trailer,The Last of Us 2,https://www.youtube.com/watch?v=qPNiIeKMHyg,Trailer
877,It can't be for nothing? Eh Neil?,The Last of Us 2,https://www.youtube.com/watch?v=qPNiIeKMHyg,Trailer
878,If you look closely you can see that Joel is in all the marketing material but not the game itself.,The Last of Us 2,https://www.youtube.com/watch?v=qPNiIeKMHyg,Trailer
879,"I swear, I dont understand this game. The first version is much better than this.",The Last of Us 2,https://www.youtube.com/watch?v=qPNiIeKMHyg,Trailer
880,herif cennetten geliyo demiştik kimse inanmıştı noldu ?,The Last of Us 2,https://www.youtube.com/watch?v=qPNiIeKMHyg,Trailer
881,i am from colmbia,The Last of Us 2,https://www.youtube.com/watch?v=qPNiIeKMHyg,Trailer
882,Wow!!!,The Last of Us 2,https://www.youtube.com/watch?v=qPNiIeKMHyg,Trailer
883,In falling in love,The Last of Us 2,https://www.youtube.com/watch?v=qPNiIeKMHyg,Trailer
884,The reveal that the story is just a “anti homophobia” theme has seriously killed the hype for me,The Last of Us 2,https://www.youtube.com/watch?v=qPNiIeKMHyg,Trailer
885,It has nothing to do with the game I played tho.,The Last of Us 2,https://www.youtube.com/watch?v=qPNiIeKMHyg,Trailer
886,I wish it was dina who was killed and then Joel and Ellie would team up and kickass instead of what we got,The Last of Us 2,https://www.youtube.com/watch?v=qPNiIeKMHyg,Trailer
887,"In my opinion the game wasn’t even that bad, just cause you aren’t happy with how things turned out doesn’t make it a bad game, I’m kinda disappointed with where they took the story but I still really enjoyed this game...😷",The Last of Us 2,https://www.youtube.com/watch?v=qPNiIeKMHyg,Trailer
888,Song please?,The Last of Us 2,https://www.youtube.com/watch?v=qPNiIeKMHyg,Trailer
889,Only you DON’T! YOU DON’T KILL EVERY LAST ONE OF ‘EM! *flips table*,The Last of Us 2,https://www.youtube.com/watch?v=qPNiIeKMHyg,Trailer
890,Tem para o ps3 ?,The Last of Us 2,https://www.youtube.com/watch?v=qPNiIeKMHyg,Trailer
891,Nop u forgot Abby.,The Last of Us 2,https://www.youtube.com/watch?v=qPNiIeKMHyg,Trailer
892,Anyone else not happy with the ending?,The Last of Us 2,https://www.youtube.com/watch?v=qPNiIeKMHyg,Trailer
893,Anyone else a bit disappointed that this wasn't a scene in the game?,The Last of Us 2,https://www.youtube.com/watch?v=qPNiIeKMHyg,Trailer
894,Just came back here to congrats naughty dog on killing their franchise,The Last of Us 2,https://www.youtube.com/watch?v=qPNiIeKMHyg,Trailer
895,1:18,The Last of Us 2,https://www.youtube.com/watch?v=qPNiIeKMHyg,Trailer
896,This is at the farmhouse,The Last of Us 2,https://www.youtube.com/watch?v=qPNiIeKMHyg,Trailer
897,I don't bother rationalizing why Joel is in these trailers.  The game was marketed to the fans of the first game but was made for different ones.  It's that simple.,The Last of Us 2,https://www.youtube.com/watch?v=qPNiIeKMHyg,Trailer
898,Amazing,The Last of Us 2,https://www.youtube.com/watch?v=qPNiIeKMHyg,Trailer
899,And I thoughted this will be my Game Of The Year ...,The Last of Us 2,https://www.youtube.com/watch?v=qPNiIeKMHyg,Trailer
900,This trailer aint even make it seem like he was gonna die!!!!,The Last of Us 2,https://www.youtube.com/watch?v=qPNiIeKMHyg,Trailer
901,They lied to us 😑,The Last of Us 2,https://www.youtube.com/watch?v=qPNiIeKMHyg,Trailer
902,tis ganr make me die miselff.,The Last of Us 2,https://www.youtube.com/watch?v=qPNiIeKMHyg,Trailer
903,Lies she had one enemy and we all know she doesn’t kill them when abby come!!!!,The Last of Us 2,https://www.youtube.com/watch?v=qPNiIeKMHyg,Trailer
904,"Ashley Johnson sang it better than Shawn James, it’s as she’s the original singer. Who says nothing beats the original?",The Last of Us 2,https://www.youtube.com/watch?v=qPNiIeKMHyg,Trailer
905,song????,The Last of Us 2,https://www.youtube.com/watch?v=qPNiIeKMHyg,Trailer
906,This built up so much hype. Now we are all disappointed,The Last of Us 2,https://www.youtube.com/watch?v=qPNiIeKMHyg,Trailer
907,"I get that everyone is furious by the ending of this game, but I mean come on. She realized that wouldn’t fix anything. I don’t love the ending, trust me but it’s like you all don’t have any sympathy for them at all. I know Joel was beloved but when you think about it Abby was justified",The Last of Us 2,https://www.youtube.com/watch?v=qPNiIeKMHyg,Trailer
908,cobra kai season 2,The Last of Us 2,https://www.youtube.com/watch?v=qPNiIeKMHyg,Trailer
909,The last of us part 3,The Last of Us 2,https://www.youtube.com/watch?v=qPNiIeKMHyg,Trailer
910,The last of us part 1,The Last of Us 2,https://www.youtube.com/watch?v=qPNiIeKMHyg,Trailer
911,Spoiler alert: she doesn't,The Last of Us 2,https://www.youtube.com/watch?v=qPNiIeKMHyg,Trailer
912,This like..... wasn’t even in the game?,The Last of Us 2,https://www.youtube.com/watch?v=qPNiIeKMHyg,Trailer
913,"Vengo del futuro y este juego es terriblemente odiado por sus fans, sin saber el mensaje que en verdad nos quiere enseñar y la obra de arte que resultó ser :/",The Last of Us 2,https://www.youtube.com/watch?v=qPNiIeKMHyg,Trailer
914,y donde chucha  se encuentra la venganza en el juego? tantos años esperando para que al final deje vivir a la mujer que le quita la vida a joel? minimo que la dejara fallecer o que por ultimo ambas mueran al final pero que mierda ¡ es un gran trailer  pero que desilusion dios¡¡¡¡,The Last of Us 2,https://www.youtube.com/watch?v=qPNiIeKMHyg,Trailer
915,"Gameplay: 4/10
(I know it got top notch ratings even from haters, but think about it, 90% of the game was sneaking past or guns blazing through enemies. Very few, but good, puzzles.
Graphics: 9/10 ",The Last of Us 2,https://www.youtube.com/watch?v=qPNiIeKMHyg,Trailer
916,I just finished The Last of Us and I was so sad when it ended 😭.... but so excited for this part 2!!!!,The Last of Us 2,https://www.youtube.com/watch?v=qPNiIeKMHyg,Trailer
917,Is anybody gonna get this game???🤩🤩🤩🤩,The Last of Us 2,https://www.youtube.com/watch?v=qPNiIeKMHyg,Trailer
918,The last of us part 2,The Last of Us 2,https://www.youtube.com/watch?v=qPNiIeKMHyg,Trailer
919,This Song is so cool,The Last of Us 2,https://www.youtube.com/watch?v=qPNiIeKMHyg,Trailer
920,WHYYYYYY JOEL,The Last of Us 2,https://www.youtube.com/watch?v=qPNiIeKMHyg,Trailer
921,They did my boy Joel dirty,The Last of Us 2,https://www.youtube.com/watch?v=qPNiIeKMHyg,Trailer
922,"Игра которая никогда не выйдет, разработчики разорились, очень жаль",The Last of Us 2,https://www.youtube.com/watch?v=qPNiIeKMHyg,Trailer
923,"When I seen this trailer I was blown away,

3 years later",The Last of Us 2,https://www.youtube.com/watch?v=qPNiIeKMHyg,Trailer
924,you guys ready for tlou3 where ellie's son kills abby,The Last of Us 2,https://www.youtube.com/watch?v=qPNiIeKMHyg,Trailer
925,This game is awesome and more then awesome!!!!!!!!!!!!!!!!!!!!!!!!,The Last of Us 2,https://www.youtube.com/watch?v=qPNiIeKMHyg,Trailer
926,"Ellie: ""I'm gonna find and kill Evey last one of them""

Also Ellie: ""Except the last one""",The Last of Us 2,https://www.youtube.com/watch?v=qPNiIeKMHyg,Trailer
927,Awesome,The Last of Us 2,https://www.youtube.com/watch?v=qPNiIeKMHyg,Trailer
928,song ?,The Last of Us 2,https://www.youtube.com/watch?v=qPNiIeKMHyg,Trailer
929,“I’m gonna find and I’m gonna kill every last one of them.”,The Last of Us 2,https://www.youtube.com/watch?v=qPNiIeKMHyg,Trailer
930,Chordssssss,The Last of Us 2,https://www.youtube.com/watch?v=qPNiIeKMHyg,Trailer
931,"idk wtf happened to her face in the new trailer, I like this one better cause I can see the same Ellie 

omg I miss Ellie and Joel so much, can't wait",The Last of Us 2,https://www.youtube.com/watch?v=qPNiIeKMHyg,Trailer
932,This game is why I have trust issues,The Last of Us 2,https://www.youtube.com/watch?v=qPNiIeKMHyg,Trailer
933,Spoilers,The Last of Us 2,https://www.youtube.com/watch?v=qPNiIeKMHyg,Trailer
934,LOOOOOLLLL/.... GOT FOREVER!!! GOT FOREVER!!!,The Last of Us 2,https://www.youtube.com/watch?v=qPNiIeKMHyg,Trailer
935,I need an explanaton,The Last of Us 2,https://www.youtube.com/watch?v=qPNiIeKMHyg,Trailer
936,Ahora se siente,The Last of Us 2,https://www.youtube.com/watch?v=qPNiIeKMHyg,Trailer
937,Why the game graphics are not like trailer ?,The Last of Us 2,https://www.youtube.com/watch?v=qPNiIeKMHyg,Trailer
938,"PLEASE NO EXTRA SPOILERS....   YES I KNOW JOEL GETS KILLED BUT I KNOW NOTHING ELSE, IM WAITING FOR PS5 RELEASE, JUST WONDERING IF THIS SCENE IS IN THE GAME?",The Last of Us 2,https://www.youtube.com/watch?v=qPNiIeKMHyg,Trailer
939,I still love this game,The Last of Us 2,https://www.youtube.com/watch?v=qPNiIeKMHyg,Trailer
940,"Ex naughty dog employee leaked this awful game so you guys know the truth on how these punks are about to screw you over. 

I hope you guys don't let this person's sacrifice go in vien.",The Last of Us 2,https://www.youtube.com/watch?v=qPNiIeKMHyg,Trailer
941,One of the best trailers for one of the least favoured video games of all time.,The Last of Us 2,https://www.youtube.com/watch?v=qPNiIeKMHyg,Trailer
942,"🚫🧢 the ending was trash ""Worst Game of 2020""",The Last of Us 2,https://www.youtube.com/watch?v=qPNiIeKMHyg,Trailer
943,The way the lied to us.,The Last of Us 2,https://www.youtube.com/watch?v=qPNiIeKMHyg,Trailer
944,This must be a patrol but it isn't,The Last of Us 2,https://www.youtube.com/watch?v=qPNiIeKMHyg,Trailer
945,The title should be renamed What’s Left of Us?  Part Ma’am,The Last of Us 2,https://www.youtube.com/watch?v=qPNiIeKMHyg,Trailer
946,"""They lied to Us 2""",The Last of Us 2,https://www.youtube.com/watch?v=qPNiIeKMHyg,Trailer
947,You like golf?,The Last of Us 2,https://www.youtube.com/watch?v=qPNiIeKMHyg,Trailer
948,BEST GAME EVER 2020,The Last of Us 2,https://www.youtube.com/watch?v=qPNiIeKMHyg,Trailer
949,Thank god I didn’t buy this game after playing the first,The Last of Us 2,https://www.youtube.com/watch?v=qPNiIeKMHyg,Trailer
950,The lie of us 2,The Last of Us 2,https://www.youtube.com/watch?v=qPNiIeKMHyg,Trailer
951,This wasn't even in the game...,The Last of Us 2,https://www.youtube.com/watch?v=qPNiIeKMHyg,Trailer
952,"The story line in part 2 reminds me of the last season of GAME OF THRONES ...""Downstream Shit Story Ending""",The Last of Us 2,https://www.youtube.com/watch?v=qPNiIeKMHyg,Trailer
953,they invested enough time to make a fake trailer to fool everyone. well played.,The Last of Us 2,https://www.youtube.com/watch?v=qPNiIeKMHyg,Trailer
954,"The detail is well worth the wait. Just look when Joel walks through that puddle, the detail is perfect.",The Last of Us 2,https://www.youtube.com/watch?v=qPNiIeKMHyg,Trailer
955,The cake was a lie ...,The Last of Us 2,https://www.youtube.com/watch?v=qPNiIeKMHyg,Trailer
956,That scene was not even in game,The Last of Us 2,https://www.youtube.com/watch?v=qPNiIeKMHyg,Trailer
