,comment,Gioco,URL,Video
2,"When this trailer was released, I once saw a comment about Joel being a ghost in this scene. Damn.",The Last of Us 2,https://www.youtube.com/watch?v=qPNiIeKMHyg,Trailer
3,"I remember reading a comment of a guy who said that here Joel is already dead, is like a ghost, because he came out from the light and he is like a vision of Ellie. He said this because he thought that Ellie wanted revenge Joel killing the Joel's killers. I read that comment 2 years ago. That was fucking true.",The Last of Us 2,https://www.youtube.com/watch?v=qPNiIeKMHyg,Trailer
4,"Trailer Ellie: I'm gonna kill every last one of them

Ellie in game: XD",The Last of Us 2,https://www.youtube.com/watch?v=qPNiIeKMHyg,Trailer
5,i swear when he said “what are you doing kiddo?” my heart like shattered. that really was her father figure and he lead her in all the right directions in her teen years. i truly believed he shaped her into who she became. it’s almost like she lost her better half,The Last of Us 2,https://www.youtube.com/watch?v=qPNiIeKMHyg,Trailer
6,This hits differently now...,The Last of Us 2,https://www.youtube.com/watch?v=qPNiIeKMHyg,Trailer
7,"So in the teaser's that joel is in, we don't really see Joel's face, maybe thats a symbol to Joel's death and a symbol that joel isn't really there and Ellie is just hallucinating...",The Last of Us 2,https://www.youtube.com/watch?v=qPNiIeKMHyg,Trailer
8,"""If I ever were to lose you, I'd surely lose myself""

And on her path for revenge she did lose herself. Only in letting it go and inevitably losing everything, was she able to find herself again.",The Last of Us 2,https://www.youtube.com/watch?v=qPNiIeKMHyg,Trailer
9,I feel jealous of myself 3 years ago for not knowing what was about to come...,The Last of Us 2,https://www.youtube.com/watch?v=qPNiIeKMHyg,Trailer
10,God this tells a whole different story now and I'm so sad again! She is so connected to him when she plays 😭Amazing work!,The Last of Us 2,https://www.youtube.com/watch?v=qPNiIeKMHyg,Trailer
11,"""Once we get outta this mess, I'm gonna teach you how to play the guitar. I reckon you'd really like that.""",The Last of Us 2,https://www.youtube.com/watch?v=qPNiIeKMHyg,Trailer
12,"Me 2016: No way these graphics looks this good.
Me 2020: I was a fool.",The Last of Us 2,https://www.youtube.com/watch?v=qPNiIeKMHyg,Trailer
13,Never trusting trailers ever again.,The Last of Us 2,https://www.youtube.com/watch?v=qPNiIeKMHyg,Trailer
14,"“You’re really gonna go through all of this” man, this was genius",The Last of Us 2,https://www.youtube.com/watch?v=qPNiIeKMHyg,Trailer
15,Ellie’s singing has so much meaning which makes the song 10x better,The Last of Us 2,https://www.youtube.com/watch?v=qPNiIeKMHyg,Trailer
16,I just love the fact that everyone is coming back to look at these old comments and realize how badly they aged.,The Last of Us 2,https://www.youtube.com/watch?v=qPNiIeKMHyg,Trailer
17,"Watching this after playing the second one, thats just Joel’s Conscience pretty much talking to her in the trailer, so basically she imagining him",The Last of Us 2,https://www.youtube.com/watch?v=qPNiIeKMHyg,Trailer
18,"The song that Ellie sings says a lot about her in the current game, and I thought the detail about what Joel says to Ellie is great, which makes a lot more sense when you know the history of the game.",The Last of Us 2,https://www.youtube.com/watch?v=qPNiIeKMHyg,Trailer
19,"Man, this song is so beautiful, and I love how well Ellie sings this masterpiece <3 I must've listened to it damn near 50 times.
Lyrics for everyone <3:
Wish I was back in Texas.",The Last of Us 2,https://www.youtube.com/watch?v=qPNiIeKMHyg,Trailer
20,"I walk through the valley
With the shadow of death

And i fear no evil",The Last of Us 2,https://www.youtube.com/watch?v=qPNiIeKMHyg,Trailer
21,is it just me or but the story here looks way different from the one we have now? Make me wonder what the first version of the game looked like.,The Last of Us 2,https://www.youtube.com/watch?v=qPNiIeKMHyg,Trailer
22,"Ellie : ""I'm going to kill everyone last one of them ""

Abby : ""actually no""",The Last of Us 2,https://www.youtube.com/watch?v=qPNiIeKMHyg,Trailer
23,I see everyone came back to this video. And I think Joel coming to see her... is a memory or even a “ghost” in her mind. And you definitely see it when you finish the game. You put the trailer and game together and you’ll probably see the same thing?,The Last of Us 2,https://www.youtube.com/watch?v=qPNiIeKMHyg,Trailer
24,Yalll remember when everyone thought she was pregnant and they took her damm kid just cuz the guitar was hiding her stomach 😂,The Last of Us 2,https://www.youtube.com/watch?v=qPNiIeKMHyg,Trailer
25,"After seeing... THAT scene... this trailer has a whole new meaning now. I mean, all this trailer is telling me now is that ellie is suffering from delusions and mental collapse... and Joel is a figment.",The Last of Us 2,https://www.youtube.com/watch?v=qPNiIeKMHyg,Trailer
26,Maybe Ellie was hallucinating Joel the whole time? But we didn’t get to see that..,The Last of Us 2,https://www.youtube.com/watch?v=qPNiIeKMHyg,Trailer
27,"""And i'll forgive my enemies when they come.""",The Last of Us 2,https://www.youtube.com/watch?v=qPNiIeKMHyg,Trailer
28,wow so many Abby in the trailer she must be the main character,The Last of Us 2,https://www.youtube.com/watch?v=qPNiIeKMHyg,Trailer
29,"Ellie in 2016: Im Going To Kill All Every Last One Of them.
Ellie in 2020: yeah, we cool.",The Last of Us 2,https://www.youtube.com/watch?v=qPNiIeKMHyg,Trailer
30,This is like watching a wedding video after you have just divorced,The Last of Us 2,https://www.youtube.com/watch?v=qPNiIeKMHyg,Trailer
31,"When I first saw this trailer 3 years ago, I thought she ment by killing all the runners and clickers........
.....but I was wrong.....",The Last of Us 2,https://www.youtube.com/watch?v=qPNiIeKMHyg,Trailer
32,"Ellie: I’m gonna kill every last one of them

Me after I beat the game: NO YOU DIDNT",The Last of Us 2,https://www.youtube.com/watch?v=qPNiIeKMHyg,Trailer
33,I refuse to believe that this was the trailer for the game I played.,The Last of Us 2,https://www.youtube.com/watch?v=qPNiIeKMHyg,Trailer
34,"“I can’t walk on the path of the right because I’m wrong” 
This song hits hard now after playing the game 😥",The Last of Us 2,https://www.youtube.com/watch?v=qPNiIeKMHyg,Trailer
35,Am I the only one freaking out about the fact that Joel taught Ellie how to play the guitar like he said he would.,The Last of Us 2,https://www.youtube.com/watch?v=qPNiIeKMHyg,Trailer
36,"the reason of her hands shaking is because of PTSD, that's the ghost of Joel she's seeing.",The Last of Us 2,https://www.youtube.com/watch?v=qPNiIeKMHyg,Trailer
37,"If you think about it, maybe this trailer was supposed to be Ellie in her own mind. Wherever she is might be symbolism of what the world she lives in is. Conflict is everywhere she goes. The song pretty much tells her story too. Maybe every time she plays the guitar, she hears Joel speaking to her (after all, the guitar was the last thing Ellie has left of Joel). The last bit of dialogue could have been her talking to Joel in her head and that she is telling him that she’ll kill “them”. (Abby n Friends) :0",The Last of Us 2,https://www.youtube.com/watch?v=qPNiIeKMHyg,Trailer
38,"I’ve always loved the shit out of this trailer. And the way he walks up I figured he was ethereal. And now after playing the game. This shit makes me cry. This trailer gave me so much hope for what the game had. It could’ve been better. But it was still good. And now, no more of him. ✊😢",The Last of Us 2,https://www.youtube.com/watch?v=qPNiIeKMHyg,Trailer
39,"This is an absolutely genius trailer, like wow. We were completely unaware of what this was when it came out, but after playing the game all the way through, it has an entirely new meaning. THIS is how you should do a trailer for something.",The Last of Us 2,https://www.youtube.com/watch?v=qPNiIeKMHyg,Trailer
40,"Abby: You took my family, you took everything away from me

Joel: 𝗜 𝗱𝗼𝗻'𝘁 𝗲𝘃𝗲𝗻 𝗸𝗻𝗼𝘄 𝘄𝗵𝗼 𝘆𝗼𝘂 𝗮𝗿𝗲",The Last of Us 2,https://www.youtube.com/watch?v=qPNiIeKMHyg,Trailer
41,"Everytime I saw Joel, it made me tear up. I do not hate the game. I like how progressive it was but I didn't watch the interviews so I didn't know the trailers were meant to mislead us. I was expecting to see more of Joel and this scene. Still, I have to give it to Naughty Dog. It was an emotional roller coaster ride. It's an experience to play this game. I want more! ❤️",The Last of Us 2,https://www.youtube.com/watch?v=qPNiIeKMHyg,Trailer
42,"there aren’t villains or heroes in this beautiful story, just humans attempting to survive but most importantly trying to find their own PEACE while making both good and horrible things... Joel decides to kill everyone who obstacles him in saving Ellie, and said he would do it again because Ellie is all that he has left! it was a selfish choice to take her away from the hospital, but still full of love!",The Last of Us 2,https://www.youtube.com/watch?v=qPNiIeKMHyg,Trailer
43,"Ellie:
“I’m gonna find and I’m gonna kill every last one of them.”

Abby’s plot armour:",The Last of Us 2,https://www.youtube.com/watch?v=qPNiIeKMHyg,Trailer
44,"This hits deeper now. The meaning behind this song, Joel's question, and Ellie's answer all came together now. Any other reason why Ellie's on this rampage would've made lesser sense if it wasn't for ""that moment"".",The Last of Us 2,https://www.youtube.com/watch?v=qPNiIeKMHyg,Trailer
45,"I just finished the game and talking to my therapist. My appointment is for tomorrow and will continue for a month or so.
Thanks NaughtyDog.",The Last of Us 2,https://www.youtube.com/watch?v=qPNiIeKMHyg,Trailer
46,We were right when we said this was “Joel’s ghost”.,The Last of Us 2,https://www.youtube.com/watch?v=qPNiIeKMHyg,Trailer
47,I started to tear up watching this after beating the game. I hope part 3 isn’t as emotionally destructive.,The Last of Us 2,https://www.youtube.com/watch?v=qPNiIeKMHyg,Trailer
48,"This game is like John Wick kills everyone, then sees Iosef and leaves him alone.",The Last of Us 2,https://www.youtube.com/watch?v=qPNiIeKMHyg,Trailer
49,"This trailer was revealed when they originally planed on Ellie killing Abby for killing Joel, but we know how they changed script for the end, Ellie did a decision Abby couldnt make and find peace, even though she may seem like losing everything, father, love, family, but as long she is alive, life can be full of possibilities.",The Last of Us 2,https://www.youtube.com/watch?v=qPNiIeKMHyg,Trailer
50,"She better know how to swim, all those times I spent hours trying to find that crate thing",The Last of Us 2,https://www.youtube.com/watch?v=qPNiIeKMHyg,Trailer
51,"I wish Youtube could rollback old comments. I want to speculate all this myself again, after knowing how everything turned out.",The Last of Us 2,https://www.youtube.com/watch?v=qPNiIeKMHyg,Trailer
52,"If you watched this 4 years ago and didn’t know Joel was gonna die, your either blind or in denial",The Last of Us 2,https://www.youtube.com/watch?v=qPNiIeKMHyg,Trailer
53,"Okay as misleading as people think this is and I agree it is, it’s still pretty freakin cool. The graphics, Ellie playing guitar and singing after having seemed to have just wiped out an entire house of enemies, the song being sung fits her character in this game so well, Joel walking in and just watching Ellie as she says that really badass line, at first glance it struck all of our chords, pun intended",The Last of Us 2,https://www.youtube.com/watch?v=qPNiIeKMHyg,Trailer
54,"Thank you so much for inspiration! I managed to make my own cover ""Through the Valley""  🎶",The Last of Us 2,https://www.youtube.com/watch?v=qPNiIeKMHyg,Trailer
55,"3 years I’ve waited for this game, and I’m currently on a walk, taking a break from the game. Knowing what has happened, this trailer hurts a bit",The Last of Us 2,https://www.youtube.com/watch?v=qPNiIeKMHyg,Trailer
56,"After completing the game and watching that emotionally brutal ending, the fact that Joel comes in when Ellie sings ""surely goodness and mercy will follow me all the days of my life"" hits 100x times harder. What a game, what a story 👏🏼",The Last of Us 2,https://www.youtube.com/watch?v=qPNiIeKMHyg,Trailer
57,"It is like going back in time and the project had been canceled is better than knowing that ""Abby"" existed",The Last of Us 2,https://www.youtube.com/watch?v=qPNiIeKMHyg,Trailer
58,"2:50 I kinda like the tone and coloring in this part, it shows that Ellie is just innocent that wants justice using vengence.",The Last of Us 2,https://www.youtube.com/watch?v=qPNiIeKMHyg,Trailer
59,"Imagine if you will:
- Abby and the Fireflies torture and kill Dina trying to get her to give up Joel’s whereabouts.
- Ellie resents Joel for the hospital thing and for being the indirect cause of Dina’s death
- The game plays out while Joel and Ellie try to reconcile. We get all those beautiful father/daughter moments and a story about forgiveness.",The Last of Us 2,https://www.youtube.com/watch?v=qPNiIeKMHyg,Trailer
60,"“I wish things were different, but it weren’t us who changed”

- Arthur Morgan",The Last of Us 2,https://www.youtube.com/watch?v=qPNiIeKMHyg,Trailer
61,"""I'm going to kill every last one of them,"" except the one that actually kills Joel.",The Last of Us 2,https://www.youtube.com/watch?v=qPNiIeKMHyg,Trailer
62,"""I use to think tlou2 was tragedy, but now I realize, its a comedy.""

     - Joker",The Last of Us 2,https://www.youtube.com/watch?v=qPNiIeKMHyg,Trailer
63,I actually think that this is a excellent game. Not the one we expected though 😂. And this trailer hits different now.,The Last of Us 2,https://www.youtube.com/watch?v=qPNiIeKMHyg,Trailer
64,First time seeing this and hearing Ellie singing and me focusing on the lyrics + Joel's Silhouette coming from a bright background without showing his face after. Minutes of analysis I came to the conclusion that Joel was Dead and ellie will Vengeance him.,The Last of Us 2,https://www.youtube.com/watch?v=qPNiIeKMHyg,Trailer
65,Yall ok we got to prepare for Joel's death because if rockstar has taught us anything it's that gruff bearded gunslingers arnt allowed to make it to the end of their own games,The Last of Us 2,https://www.youtube.com/watch?v=qPNiIeKMHyg,Trailer
66,After that scene happened i had to get off and just kinda sit there for an hour in shock and lowkey traumatized,The Last of Us 2,https://www.youtube.com/watch?v=qPNiIeKMHyg,Trailer
67,"After the Last scene et the credits.. i couldn’t held my shit together... This game is such a human game. It is a game we have to meditate, to think about every decision Ellie made, Abby made. Only after that, we can be able to acknowledge the fact that, it’s the best ending possible for this... What was Ellie’s fear ? To be all alone. There she is...",The Last of Us 2,https://www.youtube.com/watch?v=qPNiIeKMHyg,Trailer
68,"People are so mad about ellie's decision not to kill abby. She went through and killed all those people in a blind rage. In the end, she thought about joel and what he would say. She thought about what she said to joel about how she wanted to forgive him. When she thought about this, she realized that she didn't really want to kill them. Violence isn't always the answer, regardless of how much the person wants it to be. Ellie, in the end, forgave joel for saving her and saw that she didn't need to kill abby",The Last of Us 2,https://www.youtube.com/watch?v=qPNiIeKMHyg,Trailer
69,"Here JOEL is like her imagination because JOELwas killed by ABBY in winter season and ELLIE is singing the song in the rainy season where she is taking the revenge therefore some soldiers of WLF were shown dead
And when ELLIE imagined JOEL coming JOEL asked her ""YOU WANNA GO THROUGH THIS"" which means JOEL is telling her plz don't suffer . In the last words of the song ELLIE is telling that she is knowing that she is on the wrong path but after seeing JOEL'S FACE she kept her guitar and changed her mind and told that she will find and kill every last enemy",The Last of Us 2,https://www.youtube.com/watch?v=qPNiIeKMHyg,Trailer
70,I like to think that Joel in this is a figment of Ellie's imagination.,The Last of Us 2,https://www.youtube.com/watch?v=qPNiIeKMHyg,Trailer
71,I think this is what ellie sees in her head when she plays the guitar she thinks about joel and what he would say to her :/,The Last of Us 2,https://www.youtube.com/watch?v=qPNiIeKMHyg,Trailer
72,"""But I know when I die my soul is damned"". 

Those are the last words of the actual song. Wow. Never could I have imagined what happens in this game when the trailer first came out.",The Last of Us 2,https://www.youtube.com/watch?v=qPNiIeKMHyg,Trailer
73,"When she said ""im gonna find and kill every last one of them"" it hit me",The Last of Us 2,https://www.youtube.com/watch?v=qPNiIeKMHyg,Trailer
74,Thats the difference between ellie and abby,The Last of Us 2,https://www.youtube.com/watch?v=qPNiIeKMHyg,Trailer
75,Trailer - “you couldn’t live with your own failure. And where did that bring you? Back to me.”,The Last of Us 2,https://www.youtube.com/watch?v=qPNiIeKMHyg,Trailer
76,"Joel is walking up to Ellie in her room at the beginning game, on exact lyric where  he steps into frame during this trailer.
I love and hate these details...",The Last of Us 2,https://www.youtube.com/watch?v=qPNiIeKMHyg,Trailer
77,"Ellie on trailer : I'm gonna find, and i'm gonna kill... Every last one of them...

Ellie in game : Understandable, have a nice day!",The Last of Us 2,https://www.youtube.com/watch?v=qPNiIeKMHyg,Trailer
78,"I can't even think about Ellie, even look to the poster in my room without feel a lot of pain, empty, disappointed and sad😭 this game broke me",The Last of Us 2,https://www.youtube.com/watch?v=qPNiIeKMHyg,Trailer
79,I really wish this scene was in game. However I like the little reference to this trailer in the flashback where young Ellie is listening to this song when Joel comes in to talk to her and plays Future Days.,The Last of Us 2,https://www.youtube.com/watch?v=qPNiIeKMHyg,Trailer
80,"Trailer Ellie: I’m gonna find and I’m gonna kill every last one of them.
Game Ellie: lmao",The Last of Us 2,https://www.youtube.com/watch?v=qPNiIeKMHyg,Trailer
81,"God this trailer hits really hard after playing the game, definitely my favorite game of 2020!",The Last of Us 2,https://www.youtube.com/watch?v=qPNiIeKMHyg,Trailer
82,This whole trailer is brilliant. It’s total foreshadowing of all the themes and events in the game without spoiling anything.,The Last of Us 2,https://www.youtube.com/watch?v=qPNiIeKMHyg,Trailer
83,Imagine if this was a dream of Ellie the night after Jolie is killed... and she’s telling him she’ll going kill everyone,The Last of Us 2,https://www.youtube.com/watch?v=qPNiIeKMHyg,Trailer
84,"I don't care what anyone says, this game did not disappoint, and the trailer hits so much different now.",The Last of Us 2,https://www.youtube.com/watch?v=qPNiIeKMHyg,Trailer
85,Anybody notice how towards the end of the first game Joel tells Ellie that he will teach her how to play guitar...here she is playing the guitar,The Last of Us 2,https://www.youtube.com/watch?v=qPNiIeKMHyg,Trailer
86,"I enjoy that the teaser gave Ellie a tiny bit of the drawl that Joel and Tommy have. It would make sense considering how much time she spends with them.
We didn't get that in the game, but that's probably the least of the things the advertisements showed but didn't deliver on.",The Last of Us 2,https://www.youtube.com/watch?v=qPNiIeKMHyg,Trailer
87,Neil Druckman and the Naughty Dog team have really delivered a masterpiece...it will be talked about for years...and I hope they will also do part III.,The Last of Us 2,https://www.youtube.com/watch?v=qPNiIeKMHyg,Trailer
88,"Actually after this trailer reddit was swarmed by comments that Joel must be dead and appearing as a ghost. I do believe this is why they put out the trailer with Joel (instead of Jesse) behind Ellie, so we forget about this theory. Trailer was and is giving me chills.",The Last of Us 2,https://www.youtube.com/watch?v=qPNiIeKMHyg,Trailer
89,"I hate how the game turned out, but watching this now makes it clear to me that he was only there in a symbolic sense. His face was never shown, she seems accepting of the fact that he just showed up, and when she finished playing, she held the neck of the guitar for a moment before letting go, as if to remember the good times with him teaching her for just a little bit longer.",The Last of Us 2,https://www.youtube.com/watch?v=qPNiIeKMHyg,Trailer
90,God damn when Joel first appears in the doorway and makes his way to Ellie. It gives me chills every time. Greatest duo in gaming history.,The Last of Us 2,https://www.youtube.com/watch?v=qPNiIeKMHyg,Trailer
91,"I honestly felt that if Joel could say one last thing to her before he died, it would be to just let it go and not do what he did. So that she will get the life of peace that Joel never had. I'd like to think that's why her memory of Joel asked whether she'd go through with this. Because even she knows if Joel was alive, he wouldn't have wanted her to go down this path.",The Last of Us 2,https://www.youtube.com/watch?v=qPNiIeKMHyg,Trailer
92,"Im gonna say it: 
This Ellie is what I was hoping to see in the game. I expected some kind of revenge story, but with Joel to be there through it all, even if he died, having more time with him would been really cool and heartwarming... I really dont hate to play with Aby, it´s just that I really wanted her to die after that scene...",The Last of Us 2,https://www.youtube.com/watch?v=qPNiIeKMHyg,Trailer
93,"This video is suppose to let you know what ellie is capable of. The song and the game explains the whole thing. Ellie is a ""Predator"". Joel mentions it himself in a memory.",The Last of Us 2,https://www.youtube.com/watch?v=qPNiIeKMHyg,Trailer
94,"Honestly I only have a problem with how they ended Elli’s side of the story. She lost everything, her connection to Joe through her ability to play the guitar, her mother’s knife, Dina and JJ, and her friend Jessie. All she has left is the bracelet, Joe’s watch and his revolver. I think that is just too freaking sad, we need a dlc of her finding Dina, plz.",The Last of Us 2,https://www.youtube.com/watch?v=qPNiIeKMHyg,Trailer
95,"""They had us in the first half, not gonna lie""",The Last of Us 2,https://www.youtube.com/watch?v=qPNiIeKMHyg,Trailer
96,I went from being excited about this trailer to being depressed about how the game turned out. It had the potential to be a masterpiece. RIP Joel you deserved a better story.,The Last of Us 2,https://www.youtube.com/watch?v=qPNiIeKMHyg,Trailer
97,"This was my mantra the entire game through  
""Every last one of them!"" 
I wanted to follow through so bad",The Last of Us 2,https://www.youtube.com/watch?v=qPNiIeKMHyg,Trailer
98,"I'm just a bit confused how someone can write this, and then read it back and think, wow this is good",The Last of Us 2,https://www.youtube.com/watch?v=qPNiIeKMHyg,Trailer
99,"If the trailer was real

Joel: What are you doing kiddo? You really gonna go through with this?",The Last of Us 2,https://www.youtube.com/watch?v=qPNiIeKMHyg,Trailer
100,"Ellie: ""I'm going to find and kill every last one of them... Apart from the one person who actually killed Joel""",The Last of Us 2,https://www.youtube.com/watch?v=qPNiIeKMHyg,Trailer
101,Talk about something “hitting differently” I was just getting back to normal,The Last of Us 2,https://www.youtube.com/watch?v=qPNiIeKMHyg,Trailer
102,Had a feeling Joel wont be in this fame when I saw the trailer for the first time few years ago. Got in an argument with my friend for that XD,The Last of Us 2,https://www.youtube.com/watch?v=qPNiIeKMHyg,Trailer
103,"when this trailer was first released, everyone was questioning why you never saw joel's face. and now we know we never saw his face because he was never actually there, just a ghost in ellie's imagination. and he questions her motives and if she'll really go through with killing them all, which is why she let abby go, because ellie knows joel wouldn't have wanted her to become that person.",The Last of Us 2,https://www.youtube.com/watch?v=qPNiIeKMHyg,Trailer
104,back in the day we were thinking she was gonna kill all the fireflies but i think she was talking about the wolfs instead,The Last of Us 2,https://www.youtube.com/watch?v=qPNiIeKMHyg,Trailer
105,I just wish one thing for the last of us part 2 Ellie knows how to swim 😂😂,The Last of Us 2,https://www.youtube.com/watch?v=qPNiIeKMHyg,Trailer
106,"Now this is like a living vision that Ellie see. Joel talk to her....and Ellie can notice about him but. In this trailer, After the events. Joel seems like a ghost...",The Last of Us 2,https://www.youtube.com/watch?v=qPNiIeKMHyg,Trailer
107,"The first time I saw this trailer I said that Joel is dead, because I realized one Ellie does not answer Joel and that is what his imagination is.  apart he said he will kill every last one of them.  I always knew it from the beginning",The Last of Us 2,https://www.youtube.com/watch?v=qPNiIeKMHyg,Trailer
108,I like to come here now and then to just get the sad vibes. ❤️ This game meant the world to me.,The Last of Us 2,https://www.youtube.com/watch?v=qPNiIeKMHyg,Trailer
109,"iM gOnNa fInD aNd iM gOnNa kILL eVeRy lASt oNe oF tHeM 
- Ellie",The Last of Us 2,https://www.youtube.com/watch?v=qPNiIeKMHyg,Trailer
