,comment,Gioco,URL,Video
781,"Well guys, I'm here w/ the song. Oats on the water by Ben Howard",The Witcher 3,https://www.youtube.com/watch?v=XHrskkHf958,Trailer
782,About to get it for switch is this song in game cause it is amazing,The Witcher 3,https://www.youtube.com/watch?v=XHrskkHf958,Trailer
783,I automatically realized this song since it was used on The Walking Dead. Glad the song was chosen for this amazing game's trailer too. ,The Witcher 3,https://www.youtube.com/watch?v=XHrskkHf958,Trailer
784,"I swear the polish make the best games and game trailers. Both This War Of Mine and The Witcher are amazing games...

Poland, how do you do it? Please, educate our American companies, they need some help.",The Witcher 3,https://www.youtube.com/watch?v=XHrskkHf958,Trailer
785,Best music for witcher gmv. So far,The Witcher 3,https://www.youtube.com/watch?v=XHrskkHf958,Trailer
786,BEST GAME EVER!!!!!!!!!,The Witcher 3,https://www.youtube.com/watch?v=XHrskkHf958,Trailer
787,Best game in the history of games!,The Witcher 3,https://www.youtube.com/watch?v=XHrskkHf958,Trailer
788,MASTERPIECE!!!!!!!!,The Witcher 3,https://www.youtube.com/watch?v=XHrskkHf958,Trailer
789,Only other game that can compete with this for goty is barman. All aboard the hype train! Whoop whoop!,The Witcher 3,https://www.youtube.com/watch?v=XHrskkHf958,Trailer
790,This game is awesome but however it's not my type which really sucks cause i really want to play this game more!,The Witcher 3,https://www.youtube.com/watch?v=XHrskkHf958,Trailer
791,Skyrim vs witcher 3,The Witcher 3,https://www.youtube.com/watch?v=XHrskkHf958,Trailer
792,I challenge anyone to find a better more thrilling game trailer than this!,The Witcher 3,https://www.youtube.com/watch?v=XHrskkHf958,Trailer
793,"better than fallout4, because it has been fully finished",The Witcher 3,https://www.youtube.com/watch?v=XHrskkHf958,Trailer
794,"What they don't tell you is that bit at the end of you riding your horse around town is what you'll spend a lost of your time doing.
""Need to find out what that last marker is!""
Great game tho",The Witcher 3,https://www.youtube.com/watch?v=XHrskkHf958,Trailer
795,Once you complete the game you slowly start to understand what people in the comments meant. I feel like I finished a chapter I needed to complete in my life.,The Witcher 3,https://www.youtube.com/watch?v=XHrskkHf958,Trailer
796,Whats with the succubus part ???where i can find him,The Witcher 3,https://www.youtube.com/watch?v=XHrskkHf958,Trailer
797,What is the name of the background music of this trailer,The Witcher 3,https://www.youtube.com/watch?v=XHrskkHf958,Trailer
798,Is the game good or boring,The Witcher 3,https://www.youtube.com/watch?v=XHrskkHf958,Trailer
799,My only issue with this game is the wild goose chase looking fir ciri.,The Witcher 3,https://www.youtube.com/watch?v=XHrskkHf958,Trailer
800,кто исполняет? как песня называется?,The Witcher 3,https://www.youtube.com/watch?v=XHrskkHf958,Trailer
801,Man I should'nt have have played this. I mean everything to me sucks now.,The Witcher 3,https://www.youtube.com/watch?v=XHrskkHf958,Trailer
802,Oats in the water this song was in a Walking dead episode,The Witcher 3,https://www.youtube.com/watch?v=XHrskkHf958,Trailer
803,is 2:24 going to be in a dlc?,The Witcher 3,https://www.youtube.com/watch?v=XHrskkHf958,Trailer
804,Oats in the water - Ben Howard,The Witcher 3,https://www.youtube.com/watch?v=XHrskkHf958,Trailer
805,"I used to play Quake III Arena with a Polish dude, forgot his name, but never the fun times we had!!",The Witcher 3,https://www.youtube.com/watch?v=XHrskkHf958,Trailer
806,What's that song called?,The Witcher 3,https://www.youtube.com/watch?v=XHrskkHf958,Trailer
807,Ben  howard! Nice!,The Witcher 3,https://www.youtube.com/watch?v=XHrskkHf958,Trailer
808,what armor is geralt wearing here?,The Witcher 3,https://www.youtube.com/watch?v=XHrskkHf958,Trailer
809,Music ?,The Witcher 3,https://www.youtube.com/watch?v=XHrskkHf958,Trailer
810,what's the song name,The Witcher 3,https://www.youtube.com/watch?v=XHrskkHf958,Trailer
811,When did 1:57 happen in the game? I don't remember that...,The Witcher 3,https://www.youtube.com/watch?v=XHrskkHf958,Trailer
812,whats the name of the song in this trailer??,The Witcher 3,https://www.youtube.com/watch?v=XHrskkHf958,Trailer
813,Will there ever be a game like this again?,The Witcher 3,https://www.youtube.com/watch?v=XHrskkHf958,Trailer
814,Anyone know how to get the armor with the scarf he's wearing in the trailer?,The Witcher 3,https://www.youtube.com/watch?v=XHrskkHf958,Trailer
815,Ben Howard - Oats In The Water.. is the name of the song enjoy,The Witcher 3,https://www.youtube.com/watch?v=XHrskkHf958,Trailer
816,What a trailer.,The Witcher 3,https://www.youtube.com/watch?v=XHrskkHf958,Trailer
817,Geralt is so sexy. I cannot handle it..,The Witcher 3,https://www.youtube.com/watch?v=XHrskkHf958,Trailer
818,I am growing old. I have been getting white hair,The Witcher 3,https://www.youtube.com/watch?v=XHrskkHf958,Trailer
819,what is the name of this song? can anyone tell me?,The Witcher 3,https://www.youtube.com/watch?v=XHrskkHf958,Trailer
820,best story,The Witcher 3,https://www.youtube.com/watch?v=XHrskkHf958,Trailer
821,"Hi!Tell me, what song is playing in the trailer?",The Witcher 3,https://www.youtube.com/watch?v=XHrskkHf958,Trailer
822,What music?,The Witcher 3,https://www.youtube.com/watch?v=XHrskkHf958,Trailer
823,The Walking Dead had this song featured.,The Witcher 3,https://www.youtube.com/watch?v=XHrskkHf958,Trailer
824,BEST GAME 4REVER,The Witcher 3,https://www.youtube.com/watch?v=XHrskkHf958,Trailer
825,"I love Skyrim, would I like this game? Thinking about getting it",The Witcher 3,https://www.youtube.com/watch?v=XHrskkHf958,Trailer
826,What an epic trailer,The Witcher 3,https://www.youtube.com/watch?v=XHrskkHf958,Trailer
827,Sad that both Iorveth and Saskia are MIA so far...,The Witcher 3,https://www.youtube.com/watch?v=XHrskkHf958,Trailer
828,15 seasons and wondering how this song is not in Supernatural 🤔🤷🏼‍♂️,The Witcher 3,https://www.youtube.com/watch?v=XHrskkHf958,Trailer
829,5 years..,The Witcher 3,https://www.youtube.com/watch?v=XHrskkHf958,Trailer
830,"people who haven't finished the game will be so confused right now,",The Witcher 3,https://www.youtube.com/watch?v=XHrskkHf958,Trailer
831,its on sale right now on steam half price. has to finish 1 and 2 before i pay it but i will buy it early considering half price,The Witcher 3,https://www.youtube.com/watch?v=XHrskkHf958,Trailer
832,This is suh a rip of of skyrim. Also my parents don't love me.,The Witcher 3,https://www.youtube.com/watch?v=XHrskkHf958,Trailer
833,Best trailer od all time.,The Witcher 3,https://www.youtube.com/watch?v=XHrskkHf958,Trailer
834,When does this game come out?,The Witcher 3,https://www.youtube.com/watch?v=XHrskkHf958,Trailer
835,I know it's trivial but what song is it playing,The Witcher 3,https://www.youtube.com/watch?v=XHrskkHf958,Trailer
836,does anybody know the song name or band???,The Witcher 3,https://www.youtube.com/watch?v=XHrskkHf958,Trailer
837,Still here...,The Witcher 3,https://www.youtube.com/watch?v=XHrskkHf958,Trailer
838,Started in rpgs after playing The Witcher 2 in X360. Then i made a promise to myself that my first game in the Xbox One would be The Witcher 3...i cried when the moment came,The Witcher 3,https://www.youtube.com/watch?v=XHrskkHf958,Trailer
839,CD Projekt Red,The Witcher 3,https://www.youtube.com/watch?v=XHrskkHf958,Trailer
840,That hair is not available? why?,The Witcher 3,https://www.youtube.com/watch?v=XHrskkHf958,Trailer
841,Song perfectly fits ,The Witcher 3,https://www.youtube.com/watch?v=XHrskkHf958,Trailer
842,This song was played in The Walking Dead,The Witcher 3,https://www.youtube.com/watch?v=XHrskkHf958,Trailer
843,imma witchaa...hayaaaaaa!,The Witcher 3,https://www.youtube.com/watch?v=XHrskkHf958,Trailer
844,song? pleas,The Witcher 3,https://www.youtube.com/watch?v=XHrskkHf958,Trailer
845,One of my favorite videos tbh.,The Witcher 3,https://www.youtube.com/watch?v=XHrskkHf958,Trailer
846,Ben Howard❤,The Witcher 3,https://www.youtube.com/watch?v=XHrskkHf958,Trailer
847,Can someone explain why people say this is the best game ever (not an insult a genuine question),The Witcher 3,https://www.youtube.com/watch?v=XHrskkHf958,Trailer
848,does this game involve kratos?,The Witcher 3,https://www.youtube.com/watch?v=XHrskkHf958,Trailer
849,"Never really played an rpg, but should i get this game?",The Witcher 3,https://www.youtube.com/watch?v=XHrskkHf958,Trailer
850,why dose he carry 2 swords on he's back?,The Witcher 3,https://www.youtube.com/watch?v=XHrskkHf958,Trailer
851,Can’t wait to play this on the PS5,The Witcher 3,https://www.youtube.com/watch?v=XHrskkHf958,Trailer
852,will there be the witch 4 ?,The Witcher 3,https://www.youtube.com/watch?v=XHrskkHf958,Trailer
853,I hate how witcher 3 doesn't have very much content :/ super bored,The Witcher 3,https://www.youtube.com/watch?v=XHrskkHf958,Trailer
854,Started it but then faded away with fortnite - think ill go back - the music chills my bones man.,The Witcher 3,https://www.youtube.com/watch?v=XHrskkHf958,Trailer
855,"Best.
game
EVER",The Witcher 3,https://www.youtube.com/watch?v=XHrskkHf958,Trailer
856,Time for another play through.......,The Witcher 3,https://www.youtube.com/watch?v=XHrskkHf958,Trailer
857,song what song,The Witcher 3,https://www.youtube.com/watch?v=XHrskkHf958,Trailer
858,this game is leagues ahead of its time,The Witcher 3,https://www.youtube.com/watch?v=XHrskkHf958,Trailer
859,i Wish the Witcher TV Show would be more the Game then the TV series!,The Witcher 3,https://www.youtube.com/watch?v=XHrskkHf958,Trailer
860,This song was so suitable for the video,The Witcher 3,https://www.youtube.com/watch?v=XHrskkHf958,Trailer
861,RPG Game of the decade for sure,The Witcher 3,https://www.youtube.com/watch?v=XHrskkHf958,Trailer
862,Song?,The Witcher 3,https://www.youtube.com/watch?v=XHrskkHf958,Trailer
863,Whos the song by,The Witcher 3,https://www.youtube.com/watch?v=XHrskkHf958,Trailer
864,Name music?,The Witcher 3,https://www.youtube.com/watch?v=XHrskkHf958,Trailer
865,wow what cheese song you guys chose,The Witcher 3,https://www.youtube.com/watch?v=XHrskkHf958,Trailer
866,music?,The Witcher 3,https://www.youtube.com/watch?v=XHrskkHf958,Trailer
867,Best game ever,The Witcher 3,https://www.youtube.com/watch?v=XHrskkHf958,Trailer
868,i need witcher 4,The Witcher 3,https://www.youtube.com/watch?v=XHrskkHf958,Trailer
869,THE BEST GAME!!!!!,The Witcher 3,https://www.youtube.com/watch?v=XHrskkHf958,Trailer
870,Song?,The Witcher 3,https://www.youtube.com/watch?v=XHrskkHf958,Trailer
871,What's the song please?,The Witcher 3,https://www.youtube.com/watch?v=XHrskkHf958,Trailer
872,"It's a damn shame that tales such as these and with these kinds of settings are underrepresented in popular media, at least in my opinion. Not only these BRILLIANT modern recastings, but their older sources. It upsets me greatly that there is no effort to make something like a film of Beowulf that is accurate and attempts to capture the spirit of the work. Especially because that really would not be hard to do given the budget that some blockbusters have. It's just a damn shame. More people need to fall in love with the ancient heroic North.",The Witcher 3,https://www.youtube.com/watch?v=XHrskkHf958,Trailer
873,Anyone? What is this song?,The Witcher 3,https://www.youtube.com/watch?v=XHrskkHf958,Trailer
874,Is that the ursine set?,The Witcher 3,https://www.youtube.com/watch?v=XHrskkHf958,Trailer
875,What's the song called?,The Witcher 3,https://www.youtube.com/watch?v=XHrskkHf958,Trailer
876,i cri evrytiem,The Witcher 3,https://www.youtube.com/watch?v=XHrskkHf958,Trailer
877,what's the name of this song ??? :(((,The Witcher 3,https://www.youtube.com/watch?v=XHrskkHf958,Trailer
878,What is name of music,The Witcher 3,https://www.youtube.com/watch?v=XHrskkHf958,Trailer
879,song??,The Witcher 3,https://www.youtube.com/watch?v=XHrskkHf958,Trailer
880,Should I get this or skyrim,The Witcher 3,https://www.youtube.com/watch?v=XHrskkHf958,Trailer
881,qual o nome da musica,The Witcher 3,https://www.youtube.com/watch?v=XHrskkHf958,Trailer
882,Wats the name of this song please anyone?,The Witcher 3,https://www.youtube.com/watch?v=XHrskkHf958,Trailer
883,Oats in the water,The Witcher 3,https://www.youtube.com/watch?v=XHrskkHf958,Trailer
884,I got a a question. Is this game free roam after you beat it?,The Witcher 3,https://www.youtube.com/watch?v=XHrskkHf958,Trailer
885,its official. GAME OF THE NEXT 10 YEARS. face it. we wont see another one like this for a very long time.,The Witcher 3,https://www.youtube.com/watch?v=XHrskkHf958,Trailer
886,Nostalgia,The Witcher 3,https://www.youtube.com/watch?v=XHrskkHf958,Trailer
887,Most loved game series and it’s well deserved,The Witcher 3,https://www.youtube.com/watch?v=XHrskkHf958,Trailer
888,i wish that the game looked as good as this on the play4 cuz the frame is terrible,The Witcher 3,https://www.youtube.com/watch?v=XHrskkHf958,Trailer
889,song name?,The Witcher 3,https://www.youtube.com/watch?v=XHrskkHf958,Trailer
890,song?,The Witcher 3,https://www.youtube.com/watch?v=XHrskkHf958,Trailer
891,OUR LAST HOPE CDPR YOU ARE THE CHOOSEN ONE PLEASE NEVER FALL,The Witcher 3,https://www.youtube.com/watch?v=XHrskkHf958,Trailer
892,Is it just me or the song sounds like it's from shrek,The Witcher 3,https://www.youtube.com/watch?v=XHrskkHf958,Trailer
893,Geralt doesn't wear heavy armor,The Witcher 3,https://www.youtube.com/watch?v=XHrskkHf958,Trailer
894,"Pamiętam jak oglądałem to w dniu premiery, to już 5 lat, czuje się staro",The Witcher 3,https://www.youtube.com/watch?v=XHrskkHf958,Trailer
895,Witcher 3 > Cyberpunk2077,The Witcher 3,https://www.youtube.com/watch?v=XHrskkHf958,Trailer
896,How do I get the armor he is using,The Witcher 3,https://www.youtube.com/watch?v=XHrskkHf958,Trailer
897,great game. not such a great trailer.,The Witcher 3,https://www.youtube.com/watch?v=XHrskkHf958,Trailer
898,what's the worst part of this game? it ends,The Witcher 3,https://www.youtube.com/watch?v=XHrskkHf958,Trailer
899,Is it just me or some of those scenes are not in the game?,The Witcher 3,https://www.youtube.com/watch?v=XHrskkHf958,Trailer
900,Song??,The Witcher 3,https://www.youtube.com/watch?v=XHrskkHf958,Trailer
901,witcher>cyberpunk,The Witcher 3,https://www.youtube.com/watch?v=XHrskkHf958,Trailer
902,"Where is the Game of the Decade edition of it? For really, there is not a single game that can even come close to Witcher 3.
I guess the only people that say Witcher 3 isn't the greatest RPG ever haven't played it yet or they are ES:Shitrim fans.",The Witcher 3,https://www.youtube.com/watch?v=XHrskkHf958,Trailer
903,Hours and hours of sex scenes.SOLD!,The Witcher 3,https://www.youtube.com/watch?v=XHrskkHf958,Trailer
904,"Witcher 3, one of the few game if only that's more epic than their trailers.",The Witcher 3,https://www.youtube.com/watch?v=XHrskkHf958,Trailer
905,Ive bought the GOTY for 20€,The Witcher 3,https://www.youtube.com/watch?v=XHrskkHf958,Trailer
906,Song?,The Witcher 3,https://www.youtube.com/watch?v=XHrskkHf958,Trailer
907,top,The Witcher 3,https://www.youtube.com/watch?v=XHrskkHf958,Trailer
908,Never played the game .. but i will start from tomorrow,The Witcher 3,https://www.youtube.com/watch?v=XHrskkHf958,Trailer
909,How long did it take you guys to complete the game?,The Witcher 3,https://www.youtube.com/watch?v=XHrskkHf958,Trailer
910,I must cry,The Witcher 3,https://www.youtube.com/watch?v=XHrskkHf958,Trailer
911,"5 years later...

Cyberpunk 2077 is on its way...sooner or later...
But this game...",The Witcher 3,https://www.youtube.com/watch?v=XHrskkHf958,Trailer
912,What is the song?,The Witcher 3,https://www.youtube.com/watch?v=XHrskkHf958,Trailer
913,"I just heard this song and thought ""this would fit perfectly with The Walking Dead"" and it turns out it was in The Walking Dead, haha! Anyways, I'm troubled whether to get the Collectors Edition for this or Skyrim: Special Edition. I've only seen the gameplay trailer, tutorial, and launch trailer for The Witcher 3, and I've only seen the announcement trailer, gameplay trailer, and the character customization for Skyrim: Special Edition. Basically, I know very little about both because I want to be surprised depending on which game I get. Can anybody lead me to the right choice?",The Witcher 3,https://www.youtube.com/watch?v=XHrskkHf958,Trailer
914,My favourite game and there trailor,The Witcher 3,https://www.youtube.com/watch?v=XHrskkHf958,Trailer
915,can someone tell me the name of song,The Witcher 3,https://www.youtube.com/watch?v=XHrskkHf958,Trailer
916,Hopefully cyberpunk 2077 is as good as this,The Witcher 3,https://www.youtube.com/watch?v=XHrskkHf958,Trailer
917,Whats the name of the song?,The Witcher 3,https://www.youtube.com/watch?v=XHrskkHf958,Trailer
918,They did it boys,The Witcher 3,https://www.youtube.com/watch?v=XHrskkHf958,Trailer
919,Those people who pushed that dislike button dont deserve play any games. NEVER!,The Witcher 3,https://www.youtube.com/watch?v=XHrskkHf958,Trailer
920,This video>witcher netflix,The Witcher 3,https://www.youtube.com/watch?v=XHrskkHf958,Trailer
921,gud,The Witcher 3,https://www.youtube.com/watch?v=XHrskkHf958,Trailer
922,#99vidas,The Witcher 3,https://www.youtube.com/watch?v=XHrskkHf958,Trailer
923,The game is pure Gem.,The Witcher 3,https://www.youtube.com/watch?v=XHrskkHf958,Trailer
924,I cried,The Witcher 3,https://www.youtube.com/watch?v=XHrskkHf958,Trailer
925,My only complain is... why the wind is this game is way too strong all trees rocking back and forth like hell.,The Witcher 3,https://www.youtube.com/watch?v=XHrskkHf958,Trailer
926,Can someone please tell me if it's necessary to play the first two witcher's before playing Witcher 3?,The Witcher 3,https://www.youtube.com/watch?v=XHrskkHf958,Trailer
927,Ностальгия...,The Witcher 3,https://www.youtube.com/watch?v=XHrskkHf958,Trailer
928,So barons wife is the grandma with the signs,The Witcher 3,https://www.youtube.com/watch?v=XHrskkHf958,Trailer
929,Can somebody can give me the song's name please ?,The Witcher 3,https://www.youtube.com/watch?v=XHrskkHf958,Trailer
930,Who else still playing this in 2020?,The Witcher 3,https://www.youtube.com/watch?v=XHrskkHf958,Trailer
931,Five years later and this game hasn't been topped. Let's see how cyberpunk will do.,The Witcher 3,https://www.youtube.com/watch?v=XHrskkHf958,Trailer
932,Song name???,The Witcher 3,https://www.youtube.com/watch?v=XHrskkHf958,Trailer
933,,The Witcher 3,https://www.youtube.com/watch?v=XHrskkHf958,Trailer
934,Is this a trailer or a tribute?,The Witcher 3,https://www.youtube.com/watch?v=XHrskkHf958,Trailer
935,It is absurd how great this game is.,The Witcher 3,https://www.youtube.com/watch?v=XHrskkHf958,Trailer
936,What song is that ,The Witcher 3,https://www.youtube.com/watch?v=XHrskkHf958,Trailer
937,Most glitchiest game ever but still love it 😍,The Witcher 3,https://www.youtube.com/watch?v=XHrskkHf958,Trailer
938,198 people just hate life,The Witcher 3,https://www.youtube.com/watch?v=XHrskkHf958,Trailer
939,song,The Witcher 3,https://www.youtube.com/watch?v=XHrskkHf958,Trailer
940,"I just started this game and this trailer made me want to play more and more, but there will always be the nr 1 spot only for red dead 2",The Witcher 3,https://www.youtube.com/watch?v=XHrskkHf958,Trailer
941,Awesome game right here 🙌,The Witcher 3,https://www.youtube.com/watch?v=XHrskkHf958,Trailer
942,"The part with yen and geralt looking sad and then ciri crying is actually a HUGE plot point in the game, if they turned that camera round that would of been a huge spoiler ",The Witcher 3,https://www.youtube.com/watch?v=XHrskkHf958,Trailer
943,best rol game ever,The Witcher 3,https://www.youtube.com/watch?v=XHrskkHf958,Trailer
944,Long live Radovid V the Stern. The king in the North,The Witcher 3,https://www.youtube.com/watch?v=XHrskkHf958,Trailer
945,This game is truly something else...,The Witcher 3,https://www.youtube.com/watch?v=XHrskkHf958,Trailer
946,Song?,The Witcher 3,https://www.youtube.com/watch?v=XHrskkHf958,Trailer
947,"421 fans of bethesda, EA and Ubisoft disliked this! hahahahaha WITNESS THE NEW KING IN TOWN, CD PROJEKT RED",The Witcher 3,https://www.youtube.com/watch?v=XHrskkHf958,Trailer
948,Nostalgia.,The Witcher 3,https://www.youtube.com/watch?v=XHrskkHf958,Trailer
949,Amazing game but this could have been a much better trailer.,The Witcher 3,https://www.youtube.com/watch?v=XHrskkHf958,Trailer
950,When the game is better then the trailer,The Witcher 3,https://www.youtube.com/watch?v=XHrskkHf958,Trailer
951,"love this game so much... but don't know why, feels like:
Geralt of Rivia = Ezio Auditore da Firenze",The Witcher 3,https://www.youtube.com/watch?v=XHrskkHf958,Trailer
952,S k,The Witcher 3,https://www.youtube.com/watch?v=XHrskkHf958,Trailer
953,What is that song,The Witcher 3,https://www.youtube.com/watch?v=XHrskkHf958,Trailer
954,Lilac and Gooseberries,The Witcher 3,https://www.youtube.com/watch?v=XHrskkHf958,Trailer
955,Is it better than Zelda botw?,The Witcher 3,https://www.youtube.com/watch?v=XHrskkHf958,Trailer
956,God this teaser is BS,The Witcher 3,https://www.youtube.com/watch?v=XHrskkHf958,Trailer
957,why is gamespot the only one with dis trailer?,The Witcher 3,https://www.youtube.com/watch?v=XHrskkHf958,Trailer
958,Worst part of this game is that I'll never be as satisfied with another game as much as I was with this one,The Witcher 3,https://www.youtube.com/watch?v=XHrskkHf958,Trailer
959,What's the song,The Witcher 3,https://www.youtube.com/watch?v=XHrskkHf958,Trailer
960,I still don't understand. Who are the main antagonists? The crones or the Wild Hunt? I just started a new game plus btw...,The Witcher 3,https://www.youtube.com/watch?v=XHrskkHf958,Trailer
961,I love this game,The Witcher 3,https://www.youtube.com/watch?v=XHrskkHf958,Trailer
962,Rollercoaster of emotions😢😢😢,The Witcher 3,https://www.youtube.com/watch?v=XHrskkHf958,Trailer
963,Cyberpunk 2077 go best games,The Witcher 3,https://www.youtube.com/watch?v=XHrskkHf958,Trailer
964,"NO GOOD SWORD. , NO EFFECTIVE  WITCHER. THE REAL WAR IS NOT MAN AGAINST MAN,  BUT MAN AGAINST PRINCIPALITIES OF DARKNESS, AND ONLY THE SWORD OF HEAVEN, IS EFFECTIVE AGAINST ALL THE EVIL FORCES, WHOM  WANTS US, TO DESTROY ONE ANOTHER. MAY THE GOD OF HEAVEN, INLIGHTEN YOU,  AND BLESS YOU, SO WE CAN LIVE  MORE PEACEFULLY, AND RESTED UPON THIS PATH OF LIFE, WHICH IS HARD AND DELICATE, ",The Witcher 3,https://www.youtube.com/watch?v=XHrskkHf958,Trailer
965,What song is this? I quite like it a lot...,The Witcher 3,https://www.youtube.com/watch?v=XHrskkHf958,Trailer
966,KURWAA,The Witcher 3,https://www.youtube.com/watch?v=XHrskkHf958,Trailer
967,i love this game,The Witcher 3,https://www.youtube.com/watch?v=XHrskkHf958,Trailer
968,"Iam play witcher 1, and not really like, is there okay if i jump to play witcher 3 without 1 and 2 ?",The Witcher 3,https://www.youtube.com/watch?v=XHrskkHf958,Trailer
969,Song?,The Witcher 3,https://www.youtube.com/watch?v=XHrskkHf958,Trailer
970,Got bored of it,The Witcher 3,https://www.youtube.com/watch?v=XHrskkHf958,Trailer
971,how bad is the sexual content in this game? i want to buy it for my friend for Christmas but that part kinda makes me want to put off buying it.,The Witcher 3,https://www.youtube.com/watch?v=XHrskkHf958,Trailer
972,I want it so bad.,The Witcher 3,https://www.youtube.com/watch?v=XHrskkHf958,Trailer
973,Is it worth buying a next gen system just to play this game? Because it sorta looks like it. ,The Witcher 3,https://www.youtube.com/watch?v=XHrskkHf958,Trailer
974,"This version of the song is so much better than the original in my opinion. Does anyone know where to find it without the background sounds in the video?

Ben Howard - Oats In The Water (if you didn't know)",The Witcher 3,https://www.youtube.com/watch?v=XHrskkHf958,Trailer
975,This sheer trailer is better than many other games.,The Witcher 3,https://www.youtube.com/watch?v=XHrskkHf958,Trailer
976,Just realised the only person missing from this trailer is Vesemir. He won’t be forgotten...,The Witcher 3,https://www.youtube.com/watch?v=XHrskkHf958,Trailer
977,"If you hate the witcher 3, trust me you should not be playing videogames, it is a crime to hate this game.",The Witcher 3,https://www.youtube.com/watch?v=XHrskkHf958,Trailer
978,Lol forgot how bad this game looked when it came out. Much better now specialy with all amazing graphic mods on pc so beautiful!,The Witcher 3,https://www.youtube.com/watch?v=XHrskkHf958,Trailer
979,Best game ever made,The Witcher 3,https://www.youtube.com/watch?v=XHrskkHf958,Trailer
980,It's just so sad that we won't see any other witcher game(at least until cuberpunk 2077 is out). Just a masterpiece guys. I have finished it 2 times and I will do it again in the summer. Best rpg game ever for me,The Witcher 3,https://www.youtube.com/watch?v=XHrskkHf958,Trailer
981,dan patrick show,The Witcher 3,https://www.youtube.com/watch?v=XHrskkHf958,Trailer
982,What song is this? Don't say Darude Sandstorm please......I know that trick.,The Witcher 3,https://www.youtube.com/watch?v=XHrskkHf958,Trailer
983,Is it good game,The Witcher 3,https://www.youtube.com/watch?v=XHrskkHf958,Trailer
984,Juegazoooooooo,The Witcher 3,https://www.youtube.com/watch?v=XHrskkHf958,Trailer
985,Poor pc users because of console. Cdpr downgraded it just because consoles can't handle  it :(,The Witcher 3,https://www.youtube.com/watch?v=XHrskkHf958,Trailer
